username;date;retweets;favorites;text;geo;mentions;hashtags;id;permalink
;2016-06-25 23:47;0;0;""Yeni düşmanlar bulmanıza gerek yok. Dostunuza destek olun yeter." Jon Snow";;;;"746822054029168640";https://twitter.com/mustfsami/status/746822054029168640
;2016-06-25 23:47;0;0;"Im guessing the producers will pull a Jon snow because I dont understand what went on in episode 12 https:// twitter.com/samirawiley/st atus/746399418253991936 …";;;;"746822045435039745";https://twitter.com/Amaka_Ege/status/746822045435039745
;2016-06-25 23:46;0;3;"Just witnessed a Chinese girl on the train watching the scene where Jon Snow dies in game of thrones, she's sobbing.";;;;"746821790329090049";https://twitter.com/RynTrr/status/746821790329090049
;2016-06-25 23:45;0;0;"Jon Snow 's Valyrian Steel Sword Is Actually Rubber And It's Hilarious You know nothing, Valyrian Steel. If you h… http:// ift.tt/29a0U7i";;;;"746821571717832705";https://twitter.com/Dani3Rojo/status/746821571717832705
;2016-06-25 23:45;0;0;"I think Jon Snow is my favorite tv show character of all time...";;;;"746821563438096384";https://twitter.com/AlexTooEasy/status/746821563438096384
;2016-06-25 23:44;0;0;"must be! Although Jon Snow 's from GOT is growing on me too. Thought I'd HATE it but...who knew?";;;;"746821307753324544";https://twitter.com/lbrass3/status/746821307753324544
;2016-06-25 23:42;0;2;"does Jon snow know nothing?";;;;"746820992173957120";https://twitter.com/manofsteele66/status/746820992173957120
;2016-06-25 23:42;0;0;"Slowly unpacking, eating everything, and catching up on GOT. Ramsey is a monster and Jon snow is bae.";;;;"746820964596473856";https://twitter.com/Sakeenabobeena/status/746820964596473856
;2016-06-25 23:42;0;0;"Dude looks like Jon snow . https:// twitter.com/FFUnderground/ status/739285538876821504 …";;;;"746820851891310593";https://twitter.com/Givenofucksxxxl/status/746820851891310593
;2016-06-25 23:42;0;3;"Jon Snow turns into super swole gay-ass wolf boy. Huffpo headline: THIS NEW GAME OF THRONES THEORY HAS US REELING";;;;"746820842802163713";https://twitter.com/itmecarol/status/746820842802163713
;2016-06-25 23:41;0;0;"Jon Snow punches Ramsay Bolton (1 hour extended version) https:// youtu.be/Xb3Wi7moBbI";;;;"746820718055297024";https://twitter.com/Espen_vdH/status/746820718055297024
;2016-06-25 23:41;0;0;"Then asked for a photo and and a snapchat where his wife says 'you know nothing Jon snow '";;;;"746820643648376832";https://twitter.com/leathr_racket/status/746820643648376832
;2016-06-25 23:41;0;0;"@AngieMeader @jonsnowC4 @BBCNews @itvnews : Over 2.5M sign Petition: EU Referendum Rules triggering 2nd EU Referendum https:// petition.parliament.uk/petitions/1312 15 …";;@AngieMeader @jonsnowC4 @BBCNews @itvnews;;"746820584072429569";https://twitter.com/F1grimreaper/status/746820584072429569
;2016-06-25 23:41;0;0;"Jon Snow ’s Valyrian Steel Sword Is Actually Rubber And It’s Hilarious https://www. buzzfeed.com/erinlarosa/jon -snows-valyrian-steel-sword-is-actually-rubber-and-its-hi?utm_term=.tfeBe8DZqV … #GameofThrones #JonSnow";;;#GameofThrones #JonSnow;"746820520256012288";https://twitter.com/mrscarlettew/status/746820520256012288
;2016-06-25 23:40;0;0;"The sleaze and corruption of who?";;;;"746820494599524353";https://twitter.com/Diamond__Lights/status/746820494599524353
;2016-06-25 23:40;0;6;"Soñé que Ramsay Bolton seducía a Jon Snow , terminaban encamados. Ramsay le decía que no lo quería y Jon terminaba con el corazón roto. #GOT";;;#GOT;"746820462978568192";https://twitter.com/moskopolis/status/746820462978568192
;2016-06-25 23:40;0;0;"@LittleMix it's JON Snow , NOT JOHN Jade, please don't hurt my eyes";;@LittleMix;;"746820275354861569";https://twitter.com/aww_narry/status/746820275354861569
;2016-06-25 23:39;0;0;"Que a força esteja com você Jon Snow ! http:// fb.me/9rfhKmkEj";;;;"746820249098522624";https://twitter.com/deysejoyce/status/746820249098522624
;2016-06-25 23:39;0;1;"hey,check out this awesome #jonsnow #teamsnow tshirt https://www. amazon.com/dp/B01F3RJJ88 RT @FahadVita : @FahadVita #7 #JonSnow pic.twitter.com/QXPmcwRXRM";;@FahadVita @FahadVita;#jonsnow #teamsnow #7 #JonSnow;"746820179728928768";https://twitter.com/LazarovMartin7/status/746820179728928768
;2016-06-25 23:39;0;1;"21 unanswered head strikes on Ramsey Boulton by Jon Snow ... I am fucking disappointed. He needs to work on his defence from mount.";;;;"746820086254702593";https://twitter.com/Ruddy_1986/status/746820086254702593
;2016-06-25 23:38;0;3;"Entre semana hay que ir a la cremación. Mi abuelo demora más en terminar de morirse que Jon Snow .";;;;"746819989852856321";https://twitter.com/BaisontPower/status/746819989852856321
;2016-06-25 23:37;0;0;"'Game of Thrones,' NBA Game 7 to do battle on Sunday night #GameofThrones #winteriscoming #GoT #JonSnow #HBO http:// soco.space/TCy6Mh";;;#GameofThrones #winteriscoming #GoT #JonSnow #HBO;"746819706905038848";https://twitter.com/games_throne/status/746819706905038848
;2016-06-25 23:37;0;0;"beselflessbebrave: I love that Jon Snow , after being murdered and resurrected, was essentially like fuck... https:// tmblr.co/Zb5q-t28QJ_Ro";;;;"746819601154056193";https://twitter.com/leakeeing/status/746819601154056193
;2016-06-25 23:37;0;0;"Jon Snow es proclamado Rey de Winterfell gracias a la niña Mormont.";;;;"746819577921798144";https://twitter.com/victoormsa/status/746819577921798144
;2016-06-25 23:36;0;0;"|| Also kinda wanna make a Jon Snow account, though, so...";;;;"746819502914969600";https://twitter.com/SeenItsTrueFace/status/746819502914969600
;2016-06-25 23:36;0;0;"Jon Snow votre arguments sont invalides";;;;"746819468161089536";https://twitter.com/BlubluKing/status/746819468161089536
;2016-06-25 23:36;1;3;"#RoseLeslie #KitHarington #Rosit #Ygritte #JonSnow #Jogritte #OTP #Love #Kiss #GameOfThrones pic.twitter.com/hqbSJoaTXM";;;#RoseLeslie #KitHarington #Rosit #Ygritte #JonSnow #Jogritte #OTP #Love #Kiss #GameOfThrones;"746819414088114176";https://twitter.com/LaYgrose19/status/746819414088114176
;2016-06-25 23:36;0;1;"i think jon snow will most likely end up as my favorite character #gameofthrones";;;#gameofthrones;"746819304956493824";https://twitter.com/scottsinstinct/status/746819304956493824
;2016-06-25 23:35;0;0;"We'll add it to our list. So far we have: - Jon Snow & Dany - Harley Q & Joker - Veronica & JD @QueenOfMuchWow";;@QueenOfMuchWow;;"746819229710716930";https://twitter.com/MsSelenaRenee/status/746819229710716930
;2016-06-25 23:35;0;2;"Jon Snow . The pincushion of the north.";;;;"746819195246092288";https://twitter.com/PuppyRufus/status/746819195246092288
;2016-06-25 23:34;0;0;"lembrando sempre que é jon snow e não john snow";;;;"746818867889061890";https://twitter.com/ishakeit_/status/746818867889061890
;2016-06-25 23:34;0;5;"my dog crippled my jon snow pocket pop #GameofThrones pic.twitter.com/SNyHtCaM38";;;#GameofThrones;"746818770681761792";https://twitter.com/wargingstark/status/746818770681761792
;2016-06-25 23:33;0;0;"Hemos conocido a Jon Snow de juego de tronos!!!";;;;"746818606328127488";https://twitter.com/SaraM__10/status/746818606328127488
;2016-06-25 23:32;0;0;"Curiosities: Jon Snow 's Valyrian Steel Sword Is Actually Rubber And It's Hilarious http:// ow.ly/IZvh501LyhQ";;;;"746818326102425601";https://twitter.com/In2Geek/status/746818326102425601
;2016-06-25 23:32;0;0;"Jon Nieve, que sos gallego? Jon Snow boludo";;;;"746818309333590019";https://twitter.com/JoaquinBessone/status/746818309333590019
;2016-06-25 23:31;0;0;"#LearningEnglish Jon Snow looked taken aback when Olly told him that Benjen Stark is alive.";;;#LearningEnglish;"746818193658781697";https://twitter.com/Febriasop/status/746818193658781697
;2016-06-25 23:31;0;0;"Kit Harington In 'Call of Duty: Infinite Warfare', Jon Snow Featured? http:// sh.st/DVzJy #CallofDuty";;;#CallofDuty;"746818056232394752";https://twitter.com/GamerGuideUS/status/746818056232394752
;2016-06-25 23:28;0;0;"Bet you didn't notice this goofy error on the last 'Game of Thrones' episode http:// goo.gl/fb/ZilB2t #jonsnow";;;#jonsnow;"746817480673329153";https://twitter.com/wittich/status/746817480673329153
;2016-06-25 23:28;0;0;"Eu bati no Ramsay junto com o Jon Snow";;;;"746817413140877312";https://twitter.com/TheMathsVictor/status/746817413140877312
;2016-06-25 23:27;0;0;"@BorisJohnson @GiselaStuart @Nigel_Farage : EU funding of science being withdrawn already #BrexitReality @jonsnowC4 https:// twitter.com/Vordio/status/ 746786163210457088 …";;@BorisJohnson @GiselaStuart @Nigel_Farage @jonsnowC4;#BrexitReality;"746817199474610176";https://twitter.com/F1grimreaper/status/746817199474610176
;2016-06-25 23:27;0;0;"Jon Snow está en una peli en HBO right now... No digan que no avisé";;;;"746817167123943424";https://twitter.com/Soy_TanYo/status/746817167123943424
;2016-06-25 23:27;0;0;"@jonsnowC4 they can think, but to cry and ask what old people have 'done' to them?";;@jonsnowC4;;"746817164414418944";https://twitter.com/janepontefract/status/746817164414418944
;2016-06-25 23:27;0;3;"If Jon Snow is Rhaegar's son, yeah, Dani would be his aunt.";;;;"746817123511480321";https://twitter.com/auturgist/status/746817123511480321
;2016-06-25 23:26;0;3;"Someone well versed in #GoT lore/ history. Question for you -- if Jon Snow is a Targaryen, does that mean Daenerys would be his aunt?";;;#GoT;"746816884209684480";https://twitter.com/Lil_SJL/status/746816884209684480
;2016-06-25 23:26;0;7;"I searched up pictures of jon snow smiling and literally only 3 came up the bitch should've stayed dead";;;;"746816847899557888";https://twitter.com/glittrhoe/status/746816847899557888
;2016-06-25 23:25;0;0;"Bet you didn't notice Jon Snow 's floppy fake sword on 'Game of Thrones' http:// mashable.com/2016/06/25/gam e-of-thrones-jon-snow-sword/#VSepk3gfG05O … via @mashable";;@mashable;#VSepk3gfG05O;"746816722934464512";https://twitter.com/SandyAWilson/status/746816722934464512
;2016-06-25 23:24;0;0;"Jade en snapchat haciendo de Jon Snow contra Ramsay me meo de la risa";;;;"746816459653922816";https://twitter.com/jadecastairs/status/746816459653922816
;2016-06-25 23:24;1;2;"It's less self serving than that @jonsnowc4 - young people care more about fairness, internationalism, openness https:// twitter.com/jonsnowc4/stat us/746340303527903232 …";;@jonsnowc4;;"746816287473537024";https://twitter.com/robbell1970/status/746816287473537024
;2016-06-25 23:22;1;0;"Jon Snow parce que c'est le Boss. https:// twitter.com/jamespecialone /status/746813052583043073 …";;;;"746815866608693249";https://twitter.com/baroubad_/status/746815866608693249
;2016-06-25 23:22;0;0;"Bet you didn't notice Jon Snow 's floppy fake sword on 'Game of Thrones' - Mashable https:// apple.news/A1teXSNT9Oo-7K Jst7jCfig …";;;;"746815820488183808";https://twitter.com/jaberard/status/746815820488183808
;2016-06-25 23:22;0;0;"El líder de la EZLN, el subcomandante Galeano comparó a Aurelio Nuño con Ramsay Bolton de #GameofThrones ... Entonces, ¿AMLO es Jon Snow ?";;;#GameofThrones;"746815816755093504";https://twitter.com/luisgranou/status/746815816755093504
;2016-06-25 23:22;0;0;"Jon Snow 's Valyrian Steel Sword Is Actually Rubber And It's Hilarious: You know nothing, Valyrian Steel. ... http:// ln.is/www.buzzfeed.c om/eri/1O5fb …";;;;"746815814410584064";https://twitter.com/KushalShahh/status/746815814410584064
;2016-06-25 23:21;1;1;"Favorite male characters in order: Jon Snow , Reese Bolton, Tyrion Lannister";;;;"746815703487938560";https://twitter.com/MaddsMellow/status/746815703487938560
;2016-06-25 23:19;0;0;"can we like do something with "you know nothing Jon snow "?! Lol tell opposing pitchers they know nothing about our snows? Lol";;;;"746815141405167617";https://twitter.com/froseph25/status/746815141405167617
;2016-06-25 23:19;0;1;"Jon snow does know something https:// twitter.com/kit_updates/st atus/746792151091134464 …";;;;"746815117489233921";https://twitter.com/Caitlineve_/status/746815117489233921
;2016-06-25 23:19;1;0;"Jon snow , quel charisme";;;;"746815057674309632";https://twitter.com/TheRealDSV1/status/746815057674309632
;2016-06-25 23:18;0;1;"calls himself Jon snow lol probably wanks himself over GOT";;;;"746814958655123457";https://twitter.com/76maulz/status/746814958655123457
;2016-06-25 23:18;0;3;"Never mind, here's #JonSnow and the dire wolf puppies #GameofThrones #EUref #CROPOR #REGREXIT pic.twitter.com/AI3hWQh3fO";;;#JonSnow #GameofThrones #EUref #CROPOR #REGREXIT;"746814888442466305";https://twitter.com/LizJarvisUK/status/746814888442466305
;2016-06-25 23:18;0;0;"This #GameofThrones Theory About Jon Snow Is So Insane It Might... http:// dlvr.it/LfRRww";;;#GameofThrones;"746814882276794368";https://twitter.com/florespards/status/746814882276794368
;2016-06-25 23:18;0;1;"C.S. Lewis and i were just discussing how you and Jon Snow both know nothing";;;;"746814836953202689";https://twitter.com/armitagetrash/status/746814836953202689
;2016-06-25 23:17;0;0;"Morte des gens qui font le décompte de l'arrivée de MJ, c'est pas Jon Snow";;;;"746814687979913217";https://twitter.com/Noctashino/status/746814687979913217
;2016-06-25 23:17;0;0;"@jonsnow sad watching the giant succumb to Lord Bolton's men's arrows";;@jonsnow;;"746814504600805376";https://twitter.com/patspatoh/status/746814504600805376
;2016-06-25 23:16;2;2;"#ifGOTwasinHindi CID team would had special entry to investigate Jon Snow 's death and a cross over with all Ekta Kapoor awful daily soaps";;;#ifGOTwasinHindi;"746814418093117440";https://twitter.com/deepak_kumar13/status/746814418093117440
;2016-06-25 23:16;0;8;"Just ordered some #gameofthrones cake toppers for my work b/day cakes. I'm defo having the #JonSnow one";;;#gameofthrones #JonSnow;"746814406118506497";https://twitter.com/clairelahughes/status/746814406118506497
;2016-06-25 23:16;0;1;"I like northerners man, Jon snow and shit!";;;;"746814305534881792";https://twitter.com/LDN_BOX/status/746814305534881792
;2016-06-25 23:15;0;0;""You know nothing, Jon Snow ." @LordSnow pic.twitter.com/IoTQxrVcCt";;@LordSnow;;"746814022289231873";https://twitter.com/FredIskandar/status/746814022289231873
;2016-06-25 23:14;0;1;"@mara_yamauchi whilst 75% of voting 18-24's were for Remain only 36% of all 18-24's actually voted.";;@mara_yamauchi;;"746813751706411008";https://twitter.com/jhnclrk1/status/746813751706411008
;2016-06-25 23:13;1;2;"As long as you bring @jonsnowC4 . X";;@jonsnowC4;;"746813692776484864";https://twitter.com/neilburgh/status/746813692776484864
;2016-06-25 23:13;0;0;"Dizem que os roteristas protegem a Dany mas esquecem q o maior protegido tem sido o Jon Snow .";;;;"746813616087769088";https://twitter.com/grangerlisbon/status/746813616087769088
;2016-06-25 23:13;0;0;"Bet you didn't notice Jon Snow 's floppy fake sword on 'Game of Thrones' http:// goo.gl/fb/gqNV7V #jonsnow";;;#jonsnow;"746813499381284864";https://twitter.com/DHQLounge/status/746813499381284864
;2016-06-25 23:12;0;1;"We voted for THEIR future.";;;;"746813423443451904";https://twitter.com/h1066_mat/status/746813423443451904
;2016-06-25 23:12;0;5;"#L6Nelecciones26J Lacalle tiene que ser hijo de Fraga con ese pedazo frente neoliberal, el Jon Snow de la derecha más rancia";;;#L6Nelecciones26J;"746813422138982402";https://twitter.com/RobGarPal/status/746813422138982402
;2016-06-25 23:11;0;0;"@JonSnow _18 my sister drew this pic.twitter.com/Q3RmP6anlD";;@JonSnow;;"746813203443679234";https://twitter.com/HannahAlthaus/status/746813203443679234
;2016-06-25 23:11;0;2;"Tormund par contre il est dans la série (le sauvageon roux qui veut pécho Jon Snow )";;;;"746813018663698432";https://twitter.com/LadyLuciole/status/746813018663698432
;2016-06-25 23:10;0;1;"What "facts" are you reporting? Which war in Europe are we part of?";;;;"746812832730255360";https://twitter.com/GeordieFalthful/status/746812832730255360
;2016-06-25 23:09;0;0;"For a sec there (before I actually read the tweet) I thought it was a beardless Jon Snow before the Bolton army. #GoT";;;#GoT;"746812459432828928";https://twitter.com/Katiepult/status/746812459432828928
;2016-06-25 23:08;1;0;"@jonsnowC4 https:// twitter.com/redmelisandree /status/732658413004591105 …";;@jonsnowC4;;"746812455448363008";https://twitter.com/JonSnowBrexit/status/746812455448363008
;2016-06-25 23:08;0;0;"Tak w ogole to kocham te spekulacje o tym ze Jon Snow jest synem szalonego króla i bratem Danki";;;;"746812281296723968";https://twitter.com/mybaeSangster/status/746812281296723968
;2016-06-25 23:07;0;4;"Quello scudo appartiene alla sola e unica #LyannaMormont , fans di Jon Snow . È bene ricordarlo. #GameOfThrones pic.twitter.com/I3L3sk9jOl";;;#LyannaMormont #GameOfThrones;"746812198102634496";https://twitter.com/Wanderfuss/status/746812198102634496
;2016-06-25 23:06;0;1;"O direito ao Norte é da Sansa. Se Jon Snow for homem mesmo dirá q a Sansa é quem deve ser nomeada Lady Protetora do Norte. #GameofThrones";;;#GameofThrones;"746811934402547712";https://twitter.com/grangerlisbon/status/746811934402547712
;2016-06-25 23:06;0;0;"Only 31% of 18-24 year olds voted. You weren't so upset when only 36% of voters put Tories back in power last year? Faux radical";;;;"746811932972294144";https://twitter.com/mpalmond/status/746811932972294144
;2016-06-25 23:06;0;0;"mrsdayne: It is a good song, though. My mother used to sing it to me. She was a woman too, Jon Snow .... https:// tmblr.co/ZXMW4x28QFRRS";;;;"746811896003702784";https://twitter.com/JanesPrincess/status/746811896003702784
;2016-06-25 23:06;1;0;"Inglaterra deveria ter ouvido Jon snow https:// twitter.com/ruivastark/sta tus/746717622398500864 …";;;;"746811870196170756";https://twitter.com/zhongyixing/status/746811870196170756
;2016-06-25 23:06;0;0;"Então, sonhei mesmo... huhu #Jon Snow #GameofThrones https:// twitter.com/nanacastro/sta tus/746810971872706560 …";;;#Jon #GameofThrones;"746811717859016705";https://twitter.com/fanficast/status/746811717859016705
;2016-06-25 23:05;0;1;"@simontheowl6 apologies for my ignorance I've been blinded by so many lies of late need some truth. Hope u/some1 can reply. Thx";;@simontheowl6;;"746811545548652544";https://twitter.com/LeeChez73/status/746811545548652544
;2016-06-25 23:05;1;2;"watching jon snow take winterfell has been the best part of my entire week";;;;"746811514498211840";https://twitter.com/muehlbowser/status/746811514498211840
;2016-06-25 23:05;0;2;"apaixonada pelo jon snow estou";;;;"746811494638161921";https://twitter.com/queenblesses/status/746811494638161921
;2016-06-25 23:04;0;1;"Tub Jon Snow ye3mel hair bun w yehlaw aktar leh?!!!! pic.twitter.com/tzLCqcd8py";;;;"746811247526567936";https://twitter.com/RehamEissaa/status/746811247526567936
;2016-06-25 23:04;0;1;"@simontheowl6 why a European company can't/won't employ him. Would he not be able to teach English in a Euro country???";;@simontheowl6;;"746811222885019651";https://twitter.com/LeeChez73/status/746811222885019651
;2016-06-25 23:04;0;0;"Vini, lindo >> Inspirado por vinho de Jon Snow , estudante cria canal de receitas medievais via @UOLEntrete @UOL http:// tvefamosos.uol.com.br/noticias/redac ao/2016/06/25/inspirado-por-vinho-de-jon-snow-estudante-cria-canal-de-receitas-medievais.htm …";;@UOLEntrete @UOL;;"746811218552324096";https://twitter.com/eubetomaciel/status/746811218552324096
;2016-06-25 23:03;0;0;"aryajon: Because Jeor Mormont and Jon Snow both understood that the real war isn’t between a few... https:// tmblr.co/ZXMW4x28QF21H";;;;"746811198901993472";https://twitter.com/JanesPrincess/status/746811198901993472
;2016-06-25 23:03;0;0;"Bet you didn't notice Jon Snow 's floppy fake sword on 'Game of Thrones' http:// goo.gl/fb/Tu90wN #jonsnow";;;#jonsnow;"746811164429017088";https://twitter.com/DHQLounge/status/746811164429017088
;2016-06-25 23:03;0;0;"I'm not ready for when Jon Snow dies...";;;;"746811113761869824";https://twitter.com/Nicolai1st/status/746811113761869824
;2016-06-25 23:03;0;1;"@simontheowl6 dear Jon, please could I ask you why? If my son now aged 12 multilingual when he's 18 is there any reason cont..";;@simontheowl6;;"746810977258246144";https://twitter.com/LeeChez73/status/746810977258246144
;2016-06-25 23:03;0;5;"Acho que, só essa semana, sonhei umas 3 vezes com Jon Snow . Atualização de crush completada com sucesso.";;;;"746810971872706560";https://twitter.com/nanacastro/status/746810971872706560
;2016-06-25 23:03;0;0;"Jeg fikk Jon Snow på Which Game of Thrones Character Are You? på Qzzr! Hva med deg? http:// variety.com/2015/tv/featur es/quiz-which-game-of-thrones-character-are-you-1201470853/ … #quizer via @Qzzr_";;@Qzzr_;#quizer;"746810965258305536";https://twitter.com/omicronmoen/status/746810965258305536
;2016-06-25 23:02;0;1;"Gostei de um vídeo @YouTube de @lucicopata http:// youtu.be/VDrtuDsxF2w?a 2 IDIOTAS MEDIEVAIS E O JON SNOW ! | Chivalry";;@YouTube @lucicopata;;"746810911671918592";https://twitter.com/teteuag/status/746810911671918592
;2016-06-25 23:01;0;0;"Avec une armure pareille elles sont plus prêtes pour la bataille que Jon Snow";;;;"746810607928762369";https://twitter.com/JusticeForVitaa/status/746810607928762369
;2016-06-25 23:01;0;0;"@landloulou @BBCBreaking @BBCNews @SkyNews @Channel4News @jonsnowC4 some one call the cops ... its laughable really LOSERS";;@landloulou @BBCBreaking @BBCNews @SkyNews @Channel4News @jonsnowC4;;"746810532347392002";https://twitter.com/jackamundo77/status/746810532347392002
;2016-06-25 23:00;2;3;"#GameOfThrones - In the wake of #BattleOfTheBastards - 5 Defining #JonSnow Developments | http:// hiddenremote.com/2016/06/24/gam e-thrones-5-defining-jon-snow-developments/ … #GoT @HiddenRemote";;@HiddenRemote;#GameOfThrones #BattleOfTheBastards #JonSnow #GoT;"746810358870999040";https://twitter.com/EclecticPop/status/746810358870999040
;2016-06-25 23:00;0;0;"One of the bartenders looks like a boyband version of Jon Snow XD he's so adorable";;;;"746810267397459968";https://twitter.com/MissZombieCake/status/746810267397459968
;2016-06-25 22:58;0;0;"@jonsnowC4 You need to interview @MayorofLondon and ask if will declare #londonpendence";;@jonsnowC4 @MayorofLondon;#londonpendence;"746809790521810946";https://twitter.com/Hishiv/status/746809790521810946
;2016-06-25 22:57;0;1;"@TheSoldatM @EmmaAnuata slt moi c Jon snow";;@TheSoldatM @EmmaAnuata;;"746809546052599809";https://twitter.com/Tomy_Zede/status/746809546052599809
;2016-06-25 22:56;0;1;"I am predicting 22:30 for #EURef2 @StrongerIn petition to hit 2.5m signatures. @jonsnowC4 https:// twitter.com/chrisash1978/s tatus/746805518166016000 …";;@StrongerIn @jonsnowC4;#EURef2;"746809342884741120";https://twitter.com/ChrisAsh1978/status/746809342884741120
;2016-06-25 22:55;0;1;"Kit Harington ( Jon Snow from #GoT ) shows his devastation with the #Brexit win in the #EUreferendum https:// youtu.be/eZxnvonT3_4";;;#GoT #Brexit #EUreferendum;"746809131911233536";https://twitter.com/LadyWolverine1/status/746809131911233536
;2016-06-25 22:55;1;1;"Jon Snow se afeitó la barba y el Internet está profundamente ofendido ¡Míralo! http:// bit.ly/1UjKyrs pic.twitter.com/2xvaTJpUY9";;;;"746808956073345024";https://twitter.com/BenditoOcio/status/746808956073345024
;2016-06-25 22:54;1;0;"Bet you didn't notice Jon Snow 's floppy fake sword on 'Game of Thrones' http:// buff.ly/28UHSU3";;;;"746808810514354180";https://twitter.com/MicrotekCorp/status/746808810514354180
;2016-06-25 22:54;3;4;""Kill the boy Jon Snow , winter is almost upon us. Kill the boy and let the man be born." Thanks @Antoine_Online pic.twitter.com/6hrqAe65ix";;@Antoine_Online;;"746808779144986624";https://twitter.com/bentelmasri/status/746808779144986624
;2016-06-25 22:54;0;0;"Va_shali: UnRealMohit: Shubvashisht: UnRealMohit: AVsyntax: RT geeksntwits: #TECH Bet you didn't notice Jon Snow 's… http:// Mashable.com";;;#TECH;"746808706764050436";https://twitter.com/UnRealMohit/status/746808706764050436
;2016-06-25 22:52;0;0;"JAJAJAJJAJAJA NO SABES HACERLO PORQUE ERES JON SNOW https:// twitter.com/JuegoDeTronosT M/status/701514008734494721 …";;;;"746808388143681536";https://twitter.com/Piijashton/status/746808388143681536
;2016-06-25 22:51;0;1;"migo em 2025 nem vivo tu vai ta. Tu atenta tanto o povo q um dia te matam";;;;"746808172208336896";https://twitter.com/larbacasi/status/746808172208336896
;2016-06-25 22:51;0;0;"@ProfRHarris age effect is misleading. Educational attainment more explanatory. Age & EA correlated - age is confounding error";;@ProfRHarris;;"746808067900203009";https://twitter.com/GrahamMedley/status/746808067900203009
;2016-06-25 22:51;1;0;"Jon Snow didn't come back to life for this #PORCRO";;;#PORCRO;"746808032588271616";https://twitter.com/David_Ely/status/746808032588271616
;2016-06-25 22:51;0;0;"#socialmedia #itcd Bet you didn't notice Jon Snow 's floppy fake sword on 'Game of Thrones' http:// goo.gl/fb/268Vak";;;#socialmedia #itcd;"746807951571226624";https://twitter.com/yojedesign/status/746807951571226624
;2016-06-25 22:50;0;1;"@wilde Those old people probably fought and some gave their lives for those ungrateful sods to live in a democracy.";;@wilde;;"746807909917523968";https://twitter.com/ditsy_chick/status/746807909917523968
;2016-06-25 22:50;0;0;"UnRealMohit: Shubvashisht: UnRealMohit: AVsyntax: RT geeksntwits: #TECH Bet you didn't notice Jon Snow 's floppy fa… http:// Mashable.com";;;#TECH;"746807908210479105";https://twitter.com/Suneeetkaur/status/746807908210479105
;2016-06-25 22:50;0;0;"This is the price we have to pay for the ambitions of an unprincipled man to be Prime Minister.";;;;"746807813184294912";https://twitter.com/ProfRayTallis/status/746807813184294912
;2016-06-25 22:50;0;1;"Jon Snow ganó la batalla... Y vos seguís sin darme bola,,,, Para reflexionar chiks~~";;;;"746807799766720512";https://twitter.com/RednaxelA_G/status/746807799766720512
