username;date;retweets;favorites;text;geo;mentions;hashtags;id;permalink
;2016-06-26 00:54;0;0;"Gosh, how did we EVER manage to have you lot, raise you, care for you. Bloody miracle, I guess...";;;;"746838892549148672";https://twitter.com/LizzieCornish/status/746838892549148672
;2016-06-26 00:53;0;1;"JON SNOW NO SABE NADA!";;;;"746838714765221888";https://twitter.com/MaryanlovesJLR/status/746838714765221888
;2016-06-26 00:52;2;0;"Jon Snow jlui fais des choses aussi";;;;"746838511278559232";https://twitter.com/SorayaToz/status/746838511278559232
;2016-06-26 00:51;0;0;"more articles like this, less "hey, jon snow is kinda like leeroy jenkins when u think about it" articles please https:// twitter.com/TheAVClub/stat us/746829119992795137 …";;;;"746838362745638912";https://twitter.com/Hobotron2000/status/746838362745638912
;2016-06-26 00:51;0;0;"Gostei de um vídeo @YouTube de @ascaniofranca http:// youtu.be/o5jdWwlzSNw?a Jon Snow - Teoria Comprovada nos Livros";;@YouTube @ascaniofranca;;"746838294483320832";https://twitter.com/marioclivati/status/746838294483320832
;2016-06-26 00:51;0;0;"Gostei de um vídeo @YouTube de @ascaniofranca http:// youtu.be/1mCzM1WED5Q?a 6º Temporada de Game of Thrones: Jon Snow é Herdeiro de Robb";;@YouTube @ascaniofranca;;"746838273717329921";https://twitter.com/marioclivati/status/746838273717329921
;2016-06-26 00:51;0;1;"*You know nothing, Jon Snow . * https:// twitter.com/LordSanguijuel a/status/746837958720892930 …";;;;"746838238803927040";https://twitter.com/Commander_JSnow/status/746838238803927040
;2016-06-26 00:50;1;0;"el personaje mas subestimado es jon snow ; osea es mitad stark y targaryen y me ponen toda la temporada a la boluda de daenerys";;;;"746838126346309633";https://twitter.com/lordjuancho97/status/746838126346309633
;2016-06-26 00:50;0;1;"" Jon Snow . Congratulations on your victory against the Boltons!"";;;;"746838121011109890";https://twitter.com/QueenSnowBitch/status/746838121011109890
;2016-06-26 00:49;0;1;"I liked a @YouTube video http:// youtu.be/q01g0LrYfsQ?a Jon Snow Is A Terrible Military Commander - Winter is Taking Forever";;@YouTube;;"746837863757668352";https://twitter.com/RohanJason/status/746837863757668352
;2016-06-26 00:49;1;0;"#WeR48 % Demography evolves, we'll be back... pic.twitter.com/83A23a3nmI";;;#WeR48;"746837819444854784";https://twitter.com/JeremyJoseDean/status/746837819444854784
;2016-06-26 00:49;0;0;"I have a giant Jon snow funko at my mall pic.twitter.com/UU4bKx8J6b";;;;"746837668634333185";https://twitter.com/uItratae/status/746837668634333185
;2016-06-26 00:46;0;0;"jon_snow _420 Congrats on your 250 tweet! https:// favstar.fm/t/689608064895 291392 … https:// twitter.com/jon_snow_420/s tatus/689608064895291392 …";;;;"746837039488864256";https://twitter.com/favstar_bot_2/status/746837039488864256
;2016-06-26 00:46;0;0;"No full stops in that tweet. Also, why bother invoking prospect of a GE in this context unless you see a link?";;;;"746836990906208257";https://twitter.com/justified_left/status/746836990906208257
;2016-06-26 00:46;0;0;"Jon Snow é pisciano né??? Só pode.......";;;;"746836925030473728";https://twitter.com/BreKyu/status/746836925030473728
;2016-06-26 00:45;0;0;"Sério... POR QUE DIABOS dedicaram essa guerra dos bastardos ao Jon Snow se quem definiu a vitoria dessa batalha foi a Sansa????";;;;"746836754502647808";https://twitter.com/BreKyu/status/746836754502647808
;2016-06-26 00:45;0;1;"#NightsWatch #Magheramorne Quarry Northern Ireland #CastleBlack #TheWall #GameofThrones @DiscoverNI #GoT #JonSnow pic.twitter.com/7BCUp4Q1Rn";;@DiscoverNI;#NightsWatch #Magheramorne #CastleBlack #TheWall #GameofThrones #GoT #JonSnow;"746836661372227584";https://twitter.com/gNomad_travel/status/746836661372227584
;2016-06-26 00:45;127;141;"Anche Jon Snow ve lo sta dicendo (e di solito lui non sa niente). pic.twitter.com/cik0qbTHZN";;;;"746836638358183936";https://twitter.com/hiddlestovn/status/746836638358183936
;2016-06-26 00:45;0;0;"jon_snow _420 Congrats on your 250 tweet! https:// favstar.fm/t/689608064895 291392 … https:// twitter.com/jon_snow_420/s tatus/689608064895291392 …";;;;"746836626421260289";https://twitter.com/somiyi/status/746836626421260289
;2016-06-26 00:44;1;3;"Top story: Bet you didn't notice Jon Snow 's floppy fake sword on 'Game of Thron… http:// mashable.com/2016/06/25/gam e-of-thrones-jon-snow-sword/ … , see more http:// tweetedtimes.com/franzrusso?s=t np …";;;;"746836591520387072";https://twitter.com/franzrusso/status/746836591520387072
;2016-06-26 00:42;0;0;"What the latest 'Game of Thrones' episode may mean for the future of Jon Snow - Tech Insider http:// dlvr.it/LfSPrg";;;;"746835893386780673";https://twitter.com/GameofThrones24/status/746835893386780673
;2016-06-26 00:41;0;0;"hahahaha graças a deus, amanhã vai ser a veneração a Jon Snow se isso rolar https:// twitter.com/_bubblejungle/ status/746834658525069312 …";;;;"746835798423638016";https://twitter.com/MadelinhaRf/status/746835798423638016
;2016-06-26 00:40;0;0;"ainda bem que eu já sabia que jon snow ia ressuscitar pq ver esse s06ep2 até o final não foi fácil";;;;"746835562456317952";https://twitter.com/merawki/status/746835562456317952
;2016-06-26 00:40;0;0;"Jon Snow is so fine. Like dayum.";;;;"746835556127019008";https://twitter.com/Sawyer_Deja/status/746835556127019008
;2016-06-26 00:40;0;0;"and i want the closing shot to be ned stark taking a newborn baby from lyanna's arms and calling him jon snow";;;;"746835361347801088";https://twitter.com/ljkaram/status/746835361347801088
;2016-06-26 00:39;0;0;"You know nothing jon snow";;;;"746835300811321346";https://twitter.com/Alex_fgz/status/746835300811321346
;2016-06-26 00:37;0;2;"Si Jon Snow peut faire des U avec sa langue, je peux feuilleter un bouquin de jdr douteux avec ma moue.";;;;"746834761293889536";https://twitter.com/elnikow/status/746834761293889536
;2016-06-26 00:37;0;0;"Jon Snow será un personaje admirable, pero él solito en más cliché que todos los estereotipos de protagonistas en novelas adolescentes.";;;;"746834608197632000";https://twitter.com/Grow_Stark/status/746834608197632000
;2016-06-26 00:36;0;0;"Man, those punches Jon Snow gets in are so outstandingly satisfying";;;;"746834409488285696";https://twitter.com/Just_Ge0/status/746834409488285696
;2016-06-26 00:35;0;0;"Jon Snow pulled a Leeroy Jenkins: https://www. youtube.com/watch?v=Q0dA9e UP85s … Hahahahaah";;;;"746834285936672768";https://twitter.com/afiestas/status/746834285936672768
;2016-06-26 00:34;0;1;"Top story: Bet you didn't notice Jon Snow 's floppy fake sword on 'Game of Thron… http:// mashable.com/2016/06/25/gam e-of-thrones-jon-snow-sword/ … , see more http:// tweetedtimes.com/3DPrinting_W?s =tnp …";;;;"746834064133525504";https://twitter.com/3DPrinting_W/status/746834064133525504
;2016-06-26 00:34;2;0;"jon snow has graduated but he wasn't prom king so he's rightfully angry about it";;;;"746833949582823425";https://twitter.com/softdemons/status/746833949582823425
;2016-06-26 00:33;0;0;"OK, yes. Sometimes Jon Snow gets paid to go to dinner with giant clients, but what happens after dinner is just gross.";;;;"746833846671384577";https://twitter.com/jimhigdon/status/746833846671384577
;2016-06-26 00:33;0;1;"#GameofThrones spoiler: Jon Snow will be traded to the New York Knicks.";;;#GameofThrones;"746833745341087744";https://twitter.com/Christeregis/status/746833745341087744
;2016-06-26 00:33;0;0;"C'est Jon Snow ils essayent de m'amadouer pour que je l'achète plus tôt que Bf 1 mdr";;;;"746833708745953280";https://twitter.com/DovaElix/status/746833708745953280
;2016-06-26 00:33;2;1;"pic.twitter.com/IB9ZBtUcdk";;;;"746833699287760896";https://twitter.com/djiwebster/status/746833699287760896
;2016-06-26 00:32;1;0;"E come per incanto... Jon Snow #winteriscoming #youknownothingjonsnow #london @Duke of York's… https://www. instagram.com/p/BHGCdBMD7dW/";;@Duke;#winteriscoming #youknownothingjonsnow #london;"746833574704316416";https://twitter.com/LizBusiness/status/746833574704316416
;2016-06-26 00:32;0;2;"The moment Jon Snow getting out from the crowd really change my perspective abt war. It's scary https:// twitter.com/gameofthrones/ status/746810209432047618 …";;;;"746833530433396736";https://twitter.com/MrAlpha29/status/746833530433396736
;2016-06-26 00:32;0;0;"ben şeyde yoktum ya onu bir daha yapalım JON SNOW YAŞIYOMUŞ OLUM ÖLMEMİŞ YAŞIYOMUŞ BEN DEDİM SİZE BAK BAK https:// twitter.com/itszayniefect/ status/746832614984716288 …";;;;"746833508191059968";https://twitter.com/itszayniefect/status/746833508191059968
;2016-06-26 00:32;0;0;"so u are the media! what a surprise. What's it like to work for Lord murdoch?";;;;"746833397469818880";https://twitter.com/shikaka007/status/746833397469818880
;2016-06-26 00:31;0;0;"giusto, anche Jon Snow (anche se non capisco tutti questi memes su di lui?? like??)";;;;"746833329199194112";https://twitter.com/poetsofswift/status/746833329199194112
;2016-06-26 00:31;0;0;"Heart-breaking Jon Snow tweet sums up despair many young people feel after Brexit vote http://www. huffingtonpost.co.uk/entry/jon-snow -tweet-eu-referendum_uk_576e477fe4b0232d331dfdd2 … via @HuffPostUK";;@HuffPostUK;;"746833256952127488";https://twitter.com/ETHarshLight/status/746833256952127488
;2016-06-26 00:31;0;0;"you spoke on behalf of the ENTIRE country! And that isn't arrogant?";;;;"746833185611350016";https://twitter.com/shikaka007/status/746833185611350016
;2016-06-26 00:31;0;0;"jon snow is dead and i wanna die too";;;;"746833147678105600";https://twitter.com/bishopsuns/status/746833147678105600
;2016-06-26 00:28;0;0;"Game of Thrones: la oración de Melisandre para revivir a Jon Snow en valyrio http:// laprensa.peru.com/espectaculos/n oticia-game-of-thrones-temporada-6-melisandre-oracion-jon-snow-traduccion-60608#.V28FoZhpYj0.twitter …";;;#;"746832572597014529";https://twitter.com/alejandrinabuja/status/746832572597014529
;2016-06-26 00:28;1;2;"#ifGOTwasinHindi Jon Snow would have been played by a Pakistani actor. and yes, he would come back with plastic surgery.";;;#ifGOTwasinHindi;"746832436147806208";https://twitter.com/Siddhantmt/status/746832436147806208
;2016-06-26 00:27;0;0;"@Juliet777777 I do not believe you. This is a made up story. Tell us where these people were and their names. No? Thought not!";;@Juliet777777;;"746832314571853826";https://twitter.com/roderickadieu/status/746832314571853826
;2016-06-26 00:27;0;1;"I like snow but I like Jon Snow more";;;;"746832250310901760";https://twitter.com/RUF2T/status/746832250310901760
;2016-06-26 00:27;1;0;"Jon Snow se afeitó la barba y el Internet está profundamente ofendido ¡Míralo! http:// bit.ly/1UjKyrs pic.twitter.com/2xvaTJpUY9";;;;"746832097378074628";https://twitter.com/BenditoOcio/status/746832097378074628
;2016-06-26 00:26;0;0;"Ideal ending to Game of Thrones: all enemies of Dany and Jon Snow die off. Then they marry and rule Westeros together. #GameOfThrones";;;#GameOfThrones;"746831957653397504";https://twitter.com/EvanJ_B_/status/746831957653397504
;2016-06-26 00:25;2;6;"PRIMO GIORNO A LONDRA E ABBIAMO BECCATO JON SNOW PORCA TROIA pic.twitter.com/RBgMJRrvJI";;;;"746831817152536576";https://twitter.com/lallasixx22/status/746831817152536576
;2016-06-26 00:24;0;11;"JON SNOW NEFES ALAMADIĞINDA BENDE NEFESSİZ KALDIM AQ";;;;"746831471671906304";https://twitter.com/gitgeber/status/746831471671906304
;2016-06-26 00:24;0;1;"You no knowthing Jon Snow .";;;;"746831457893523456";https://twitter.com/richburroughs/status/746831457893523456
;2016-06-26 00:23;1;1;"Casual game of risk ending up with a Jon snow moment for the North. #GameOfThrones #risk @Shereen_Thomas @ShameezThomas";;@Shereen_Thomas @ShameezThomas;#GameOfThrones #risk;"746831191110717440";https://twitter.com/Naeempachino/status/746831191110717440
;2016-06-26 00:23;0;2;"#BattleOfTheBarstards be like... http:// 9gag.com/gag/a84jMo3?re f=android.s.tw … #JonSnow #Winterfell #Starks #worldofwarcraft";;;#BattleOfTheBarstards #JonSnow #Winterfell #Starks #worldofwarcraft;"746831181736468480";https://twitter.com/sfo0naki/status/746831181736468480
;2016-06-26 00:22;0;0;"Prepare for tomorrow's season finale with BATTLE OF THE BASTARDS http:// buff.ly/28WUXgH #GameofThrones #JonSnow pic.twitter.com/178uI9naF1";;;#GameofThrones #JonSnow;"746830859618099200";https://twitter.com/drinkwhen/status/746830859618099200
;2016-06-26 00:21;113;155;"Agarrate, hicieron enojar a Jon Snow pic.twitter.com/cskCUTrAFJ";;;;"746830825371615233";https://twitter.com/cristianbaelish/status/746830825371615233
;2016-06-26 00:21;0;0;"my best scene on the #got was when jon snow said "my watch is ended"";;;#got;"746830688930963460";https://twitter.com/GaaJohnPaul3/status/746830688930963460
;2016-06-26 00:20;0;2;"You know nothing, Jon Snow";;;;"746830540880355328";https://twitter.com/valbu98/status/746830540880355328
;2016-06-26 00:19;0;0;"Image Ramsey Bolton beat Jon Snow . Yeah....that's Britain leaving the EU #Brexit #euref #EURefResults #EUreferendum #got #GameofThrones";;;#Brexit #euref #EURefResults #EUreferendum #got #GameofThrones;"746830259862052864";https://twitter.com/KarlMcLean8/status/746830259862052864
;2016-06-26 00:18;0;0;"Apparently Jon Snow 's fake sword was floppy on Game of Thrones. Was that meant as a euphemism? I don't watch, I just heard.";;;;"746830055607775232";https://twitter.com/BodyworkStudio/status/746830055607775232
;2016-06-26 00:18;0;0;"It means I'd have something in common with Jon Snow , WHICH I'M OKAY WITH.";;;;"746829831028019201";https://twitter.com/_ronarch/status/746829831028019201
;2016-06-26 00:18;0;0;"jon snow sou eu andando de ônibus dia de sexta-feira pic.twitter.com/ssk3HxXkuR";;;;"746829825055330304";https://twitter.com/davimood/status/746829825055330304
;2016-06-26 00:16;0;0;"c pire que si jon snow crevait une 2e fois ou Sansa ou Daenerys c PIRE que ça";;;;"746829400432320512";https://twitter.com/getdoawn/status/746829400432320512
;2016-06-26 00:15;0;0;"A Jade dando uma de Jon Snow no Snap. Palhaça";;;;"746829190368997376";https://twitter.com/Alvesdinh/status/746829190368997376
;2016-06-26 00:15;0;3;"Khaleesi ve Jon Snow , lütfen bari siz sevgili olun.";;;;"746829151647182848";https://twitter.com/PelinSarsan/status/746829151647182848
;2016-06-26 00:15;0;0;"@janepontefract Hi John why is there this "with hunt " about old people I am 65 and voted to stay and all my friends did too??";;@janepontefract;;"746829125449572353";https://twitter.com/lindarobson65/status/746829125449572353
;2016-06-26 00:15;0;0;"Now popular: Bet you didn't notice Jon Snow 's floppy fake sword on 'Game of Thr… http:// mashable.com/2016/06/25/gam e-of-thrones-jon-snow-sword/ … , see more http:// tweetedtimes.com/Forga05?s=tnp";;;;"746829082550222848";https://twitter.com/Forga05/status/746829082550222848
;2016-06-26 00:14;0;0;"Não sei quem foi o mais burro Rickon correndo em linha reta p/ fugir das flechas ou Jon Snow caindo na provocação do Bolton... mas enfim";;;;"746828889373184000";https://twitter.com/BreKyu/status/746828889373184000
;2016-06-26 00:14;0;0;"Je viens avec ma figurine Jon Snow";;;;"746828852475879429";https://twitter.com/leahaulnaay/status/746828852475879429
;2016-06-26 00:13;0;1;"She One Upped Jon Snow . Now he'll never have the right to claim Winterfell though it was her idea to bring him there.";;;;"746828801548615680";https://twitter.com/SegaOwnsBaghdad/status/746828801548615680
;2016-06-26 00:13;0;0;"Literally every scene with Jon Snow makes me want to commit";;;;"746828785383768064";https://twitter.com/bethsimpsonyo/status/746828785383768064
;2016-06-26 00:13;0;0;"Sansa se reencuentra con Jon Snow | Juego de Tronos Español HD https:// youtu.be/Vw1qs0w25I0 vía @YouTube";;@YouTube;;"746828672523505664";https://twitter.com/ElenaVallejo_/status/746828672523505664
;2016-06-26 00:13;0;0;"When we saw jon snow back in the game.. pic.twitter.com/7tpU3wHO4M";;;;"746828587387465733";https://twitter.com/yilmaz_fatmaa/status/746828587387465733
;2016-06-26 00:12;0;2;"jon snow is a better warrior than he is a dinner guest";;;;"746828537865244672";https://twitter.com/jellafizh/status/746828537865244672
;2016-06-26 00:12;0;4;"jon snow bir, sen iki be pic.twitter.com/eroWW1AQos";;;;"746828498438881280";https://twitter.com/ozeliif/status/746828498438881280
;2016-06-26 00:10;0;0;"#KeianhWasHere #PDX #GameOfThrones #twins #TargaryenBlood #MeeraReed #JonSnow … https://www. instagram.com/p/BHF1AtGD5O7/";;;#KeianhWasHere #PDX #GameOfThrones #twins #TargaryenBlood #MeeraReed #JonSnow;"746827977736982528";https://twitter.com/Keianh/status/746827977736982528
;2016-06-26 00:10;0;0;"Kafayat Motilewa Quadri wrote: Presently the highest Fan-Grossing TV Hero - Jon Snow";;;;"746827827358609408";https://twitter.com/Gochu75/status/746827827358609408
;2016-06-26 00:07;0;0;"Howland Reed is the last man alive that knows R+L=J. Will Jon Snow no longer know nothing? http:// bit.ly/294QGXa pic.twitter.com/CJrvAh6mcO";;;;"746827182996070400";https://twitter.com/idigitaltimes/status/746827182996070400
;2016-06-26 00:06;3;4;"#ifGOTwasinhindi then in scene when Jon Snow is resurectd,there wuld've been a thnderstorm &100 temple bells ringing wit clse up of Agni dev";;;#ifGOTwasinhindi;"746826905358237696";https://twitter.com/Bawla_panchi/status/746826905358237696
;2016-06-26 00:06;0;0;"Jon snow ,what other way will I pass to leave ?? https:// twitter.com/muhdlawali/sta tus/746826183426347008 …";;;;"746826892427333632";https://twitter.com/Toritse__/status/746826892427333632
;2016-06-26 00:06;0;0;"#LordSnow#JonSnow #KitHarrington#GameOfThrones#GOT#HBO#BOOM#YouCantSitWithUs#BangBang#PowPow#Satur… https://www. instagram.com/p/BHF_YuLjvbD/";;;#LordSnow #JonSnow #KitHarrington #GameOfThrones #GOT #HBO #BOOM #YouCantSitWithUs #BangBang #PowPow #Satur;"746826864317108224";https://twitter.com/crrox420/status/746826864317108224
;2016-06-26 00:05;0;4;"Ese Jon Snow , bueno pa' los madrazos y pa' mamar panocha.";;;;"746826678345732098";https://twitter.com/Mr_Bukowski/status/746826678345732098
;2016-06-26 00:05;0;1;"When you as stressed as Jon Snow .. that's when you know it's real https:// twitter.com/oshimakesmusic /status/746826210202640385 …";;;;"746826569960742912";https://twitter.com/santedubois/status/746826569960742912
;2016-06-26 00:04;0;0;"Pra uma noção de como eu tava: Minha mãe veio perguntar se eu tava bem de tanto que eu gritei quando o Jon Snow começou a espancar o Ramsay";;;;"746826373927407616";https://twitter.com/TheMathsVictor/status/746826373927407616
;2016-06-26 00:03;0;0;"Han quemado a Jon snow y el nuevo protagonista es el príncipe Caspian seguiremos informando";;;;"746826176014999552";https://twitter.com/sparsilee/status/746826176014999552
;2016-06-26 00:03;0;0;"#TIGoT jon snow";;;#TIGoT;"746826140988280832";https://twitter.com/Ro_Beltran24/status/746826140988280832
;2016-06-26 00:03;0;1;"Parents adopted a cat and dad wants to name it Jon Snow - I'm so proud of him <3 (didn't watch past 4th season yet, please don't tell me)";;;;"746826097535377409";https://twitter.com/JoRaskoph/status/746826097535377409
;2016-06-26 00:02;0;0;""My father told me big men fall just as quick as little ones, if you put a sword through their hearts. " - Jon Snow pic.twitter.com/DCXv8sWM6C";;;;"746826037464469506";https://twitter.com/DallegoJazzel/status/746826037464469506
;2016-06-26 00:01;0;0;"#news #TheVoiceBrasil http:// bit.ly/1PoMwsy Jon Snow 's Valyrian Steel Sword Is Actually Rubber And It's Hilar... http:// ow.ly/hnQ4501LA4z";;;#news #TheVoiceBrasil;"746825620634636292";https://twitter.com/AliexpressX/status/746825620634636292
;2016-06-26 00:00;0;0;"Jon Snow https:// twitter.com/seenarj/status /746823858901098496 …";;;;"746825476832956416";https://twitter.com/PerepelkineGS/status/746825476832956416
;2016-06-26 00:00;0;0;"@jonsnowC4 What I don't understand is why so many people are saying now they voted out but didn't like the final result. People are stupid";;@jonsnowC4;;"746825452505997316";https://twitter.com/telstar511/status/746825452505997316
;2016-06-26 00:00;1;1;"Jon Snow seulement https:// twitter.com/Jamespecialone /status/746813052583043073 …";;;;"746825419983306752";https://twitter.com/__Stevenson__/status/746825419983306752
;2016-06-26 00:00;0;0;"New post on my blog: Jon Snow 's Valyrian Steel Sword Is Actually Rubber And It's Hilarious Update News http:// ift.tt/28W8OFQ";;;;"746825410403536897";https://twitter.com/gomovie24/status/746825410403536897
;2016-06-26 00:00;0;0;". @ShaunMMcCrary Great show but most of the characters are reprehensible. I like Tyrian, Jon Snow & Brianne of Tarth.";;@ShaunMMcCrary;;"746825360042491906";https://twitter.com/jonesinginsc/status/746825360042491906
;2016-06-26 00:00;0;0;"Cuando nos veamos irás todo de negro ~El negro es mi color Genial soy Jon Snow";;;;"746825359669272576";https://twitter.com/LadyVeggie/status/746825359669272576
;2016-06-26 00:00;0;0;"Bet you didn't notice Jon Snow 's floppy fake sword on 'Game of Thrones' http:// fb.me/1a9z8yXQn";;;;"746825336894087168";https://twitter.com/Insureteck/status/746825336894087168
;2016-06-26 00:00;0;0;"How I imagined it when Jon Snow didn't even get hit once. Admin SU http:// fb.me/80WPPIj1j";;;;"746825303419297792";https://twitter.com/D2International/status/746825303419297792
;2016-06-25 23:59;0;0;"Well said. The alternate views are coming from Jon Snow , CounterPunch, Medialens, The Canary etc. Not Guardian/Indy https:// twitter.com/johnpilger/sta tus/746753851936628737 …";;;;"746825166844497920";https://twitter.com/neilsalmon2/status/746825166844497920
;2016-06-25 23:59;0;0;"RT: You Cannot Unsee Jon Snow 's Rubber Sword http:// bit.ly/294PlPP pic.twitter.com/OMLGNlg3OO https:// twitter.com/PopMech/status /746823042362408961 …";;;;"746825085265281024";https://twitter.com/futuraptorr/status/746825085265281024
;2016-06-25 23:58;0;1;"Really hope Jon Snow from Game Of Thrown's makes an appearance. pic.twitter.com/89WY5hxi2x";;;;"746824857879404544";https://twitter.com/jackilee06/status/746824857879404544
;2016-06-25 23:58;0;1;"ausserdem is Jon Snow viel hübscher!";;;;"746824810500620288";https://twitter.com/knuspermagier/status/746824810500620288
;2016-06-25 23:57;0;0;"Jon Snow 's Valyrian Steel Sword Is Actually Rubber And It's Hilarious: You know nothing… http:// goo.gl/fb/PRpH5t";;;;"746824708738416640";https://twitter.com/funnyvideoaz/status/746824708738416640
;2016-06-25 23:57;0;0;"vi un gif donde la espada de jon snow se dobla al subir al caballo, estoy viendo el capitulo y si, se dobla jajajajaja";;;;"746824599757799424";https://twitter.com/Ferdinandonv/status/746824599757799424
;2016-06-25 23:56;0;1;"el mejor momento del capitulo es cuando Jon Snow se pasa de parada en el metro porque no le dejan salir";;;;"746824509852946432";https://twitter.com/LfilodelabrechA/status/746824509852946432
;2016-06-25 23:55;0;0;"Jon Snow Babe https:// twitter.com/_khbae/status/ 735932021021790209 …";;;;"746824247503364096";https://twitter.com/xSonnper/status/746824247503364096
;2016-06-25 23:55;0;0;"@oasisnick @jonsnowC4 don't disagree but their turnout was lower than older voters. Strong message there for political parties";;@oasisnick @jonsnowC4;;"746824212162220032";https://twitter.com/Mick4Pallister/status/746824212162220032
;2016-06-25 23:55;0;0;"Jon Snow , Aria Stark and Tyrion Lannister https:// twitter.com/cordeliakepner s/status/706242731308425216 …";;;;"746824124971028480";https://twitter.com/givemecats96/status/746824124971028480
;2016-06-25 23:55;0;0;"Imagina a Daenerys junto com a galera do Jon Snow numa guerra contra os White Walkers. Meu Deus, mano, que delícia vai ser";;;;"746824101961031680";https://twitter.com/TheMathsVictor/status/746824101961031680
;2016-06-25 23:55;0;1;"Jon snow , rien que ça pic.twitter.com/CRf76ZDqfu";;;;"746824056155029505";https://twitter.com/MarieSko_MP/status/746824056155029505
;2016-06-25 23:52;0;0;"Jon Snow n'est pas le fils de Ned Stark, R+L=J";;;;"746823507401650178";https://twitter.com/Warren_Epps/status/746823507401650178
;2016-06-25 23:52;2;0;"Bet you didn't notice Jon Snow 's floppy fake sword on 'Game of Thrones' http:// gameofthronessnowbound.blogspot.com/2016/06/bet-yo u-didnt-notice-jon-snows-floppy.html … entertainment, entertainment news, game of…";;;;"746823465693487105";https://twitter.com/JonSnowbound/status/746823465693487105
;2016-06-25 23:52;1;0;"JON SNOW";;;;"746823434282409984";https://twitter.com/coffeshopgrunge/status/746823434282409984
;2016-06-25 23:52;1;7;"The amount of times people call me/have called me Jon Snow is outrageous";;;;"746823325091979264";https://twitter.com/dillonchang/status/746823325091979264
;2016-06-25 23:51;5;8;"You Cannot Unsee Jon Snow 's Rubber Sword http:// bit.ly/294PlPP pic.twitter.com/qcCKQb5n8y";;;;"746823042362408961";https://twitter.com/PopMech/status/746823042362408961
;2016-06-25 23:50;0;3;"jon snow é virgem repassem";;;;"746822797406670848";https://twitter.com/rckmbch/status/746822797406670848
;2016-06-25 23:49;0;0;"Meu primeiro infarto. #HeartAttack #GameofThrones #JonSnow #YouKnowEverythingJonSnow #BattleOfTheBarstards pic.twitter.com/crxOaLjCz5";;;#HeartAttack #GameofThrones #JonSnow #YouKnowEverythingJonSnow #BattleOfTheBarstards;"746822542875332608";https://twitter.com/CamilaPaulos/status/746822542875332608
;2016-06-25 23:47;0;0;"I was unsure, you weren't clear. But two wrongs don't make a right.";;;;"746822173944385537";https://twitter.com/Diamond__Lights/status/746822173944385537
;2016-06-25 23:47;0;0;"Or Jon Snow , whatever";;;;"746822164607709184";https://twitter.com/samuelchuuu/status/746822164607709184
;2016-06-25 23:47;0;0;"pela glória de jon snow a prova de física foi adiada";;;;"746822156609294337";https://twitter.com/sailorsansa/status/746822156609294337
