username;date;retweets;favorites;text;geo;mentions;hashtags;id;permalink
;2016-06-25 22:49;1;0;"You do know something, Jon Snow ! https:// twitter.com/ruivastark/sta tus/746717622398500864 …";;;;"746807671093866498";https://twitter.com/julesbae_/status/746807671093866498
;2016-06-25 22:49;4;5;"Hasta Jon Snow sabe que el nesquik es mejor que el cola cao y pensad que estamos hablando de alguien que no sabe nADA.";;;;"746807458606252032";https://twitter.com/freefandoom/status/746807458606252032
;2016-06-25 22:48;0;7;"Five episodes into Game of Thrones and Jon Snow is GOALS";;;;"746807219816005632";https://twitter.com/AshaMarieP/status/746807219816005632
;2016-06-25 22:48;0;0;"Même Jon Snow le dit #Brexit Vidéo de got_insider https:// instagram.com/p/BHFnx2rAOeh/";;;#Brexit;"746807205266132992";https://twitter.com/RandySandie/status/746807205266132992
;2016-06-25 22:47;2;0;"Bet you didn't notice Jon Snow 's floppy fake sword on 'Game of Thrones' http:// ift.tt/28XgBBy #tech #technology #gadgets #news";;;#tech #technology #gadgets #news;"746807081773182976";https://twitter.com/Hydra_Tech_/status/746807081773182976
;2016-06-25 22:47;0;1;"pfff darling you know nothing yet, like Jon Snow";;;;"746806976869507072";https://twitter.com/BiilalAkbas/status/746806976869507072
;2016-06-25 22:47;2;0;"You know something, Jon Snow . https:// twitter.com/ruivastark/sta tus/746717622398500864 …";;;;"746806951166672896";https://twitter.com/ZenMonkey/status/746806951166672896
;2016-06-25 22:47;1;3;"help jon snow win for Starr https:// twitter.com/rtorfav_1/stat us/744228347081801728 …";;;;"746806929771593728";https://twitter.com/reggiemanstle/status/746806929771593728
;2016-06-25 22:45;0;3;"What's the name of the bakery then Jon?";;;;"746806655246082049";https://twitter.com/Zoompad/status/746806655246082049
;2016-06-25 22:45;0;0;"‘Game of Thrones’ Season 7 Spoilers, Return Date: Jon Snow Might Be Next Night’s King? - http://www. movienewsguide.com/game-thrones-s eason-7-spoilers-return-date-jon-snow-might-next-nights-king/235380 … pic.twitter.com/iTzAQOvB8d";;;;"746806555249512448";https://twitter.com/mngtrends/status/746806555249512448
;2016-06-25 22:45;0;0;"Hahaha facts like 350m per week on the NHS?";;;;"746806554075271168";https://twitter.com/Diamond__Lights/status/746806554075271168
;2016-06-25 22:45;0;0;"I have never read or watched GOT but Jon Snow and Sansa Stark are my favs.";;;;"746806449465102336";https://twitter.com/katie_bellle/status/746806449465102336
;2016-06-25 22:45;0;0;"The Media Chart for June 24: W&#039;s for LeBron James and Jon Snow #adagecom https:// dragplus.com/post/id/364360 88 …";;;#039 #adagecom;"746806443429531648";https://twitter.com/Advertising__a/status/746806443429531648
;2016-06-25 22:44;0;1;"Bet you didn't notice Jon Snow 's floppy fake sword on 'Game of Thrones' http:// ift.tt/28XgBBy";;;;"746806277565726722";https://twitter.com/RevezNexus/status/746806277565726722
;2016-06-25 22:44;0;4;". @jonsnowC4 @wilde So here's what's happening: our elite-serving media, having grotesquely misled the population, now attacks the proles...";;@jonsnowC4 @wilde;;"746806274344509440";https://twitter.com/MarkJDoran/status/746806274344509440
;2016-06-25 22:43;0;0;"@thronecast Why was Jon Snow involved in the EU referendum when he has enough going on with the north? #priorities pic.twitter.com/oNY3AkAvBe";;@thronecast;#priorities;"746806107885150208";https://twitter.com/lyonesshanski/status/746806107885150208
;2016-06-25 22:43;0;0;"Líbí se mi video @YouTube http:// youtu.be/_ypvCv3Tl_g?a Jon Snow - Wildlings ft. Ygritte (Flo Rida / Game of Thrones Parody)";;@YouTube;;"746806052440641536";https://twitter.com/LHirschova/status/746806052440641536
;2016-06-25 22:42;0;0;"He soñado con Jon Snow , huehue.";;;;"746805849935454208";https://twitter.com/IsabelaMariSwan/status/746805849935454208
;2016-06-25 22:41;0;0;"What the latest 'Game of Thrones' episode may mean for the future of Jon Snow : Tech Insider spoke with Liam C... http:// bit.ly/28YwnuZ";;;;"746805576928104449";https://twitter.com/techoverride/status/746805576928104449
;2016-06-25 22:41;0;1;"Quand Jon Snow a retrouvé Fantome annw c'est adorable "Tu m'as manqué" #GameofThrones";;;#GameofThrones;"746805569789562881";https://twitter.com/pizzaynod/status/746805569789562881
;2016-06-25 22:41;0;0;"A happy ending for Jon Snow . And for too long, a terrible ending for Ramsay.";;;;"746805546079117312";https://twitter.com/Megavolt1/status/746805546079117312
;2016-06-25 22:41;0;0;"stopped you from ever buying authentic French croissants? The level of ageism from you and your like is a true shocker old boy.";;;;"746805426965086208";https://twitter.com/namagoy/status/746805426965086208
;2016-06-25 22:40;3;5;"Actor Kit Harrington getting mobbed outside #DrFaustus tonight in #London #JonSnow @GameOfThrones pic.twitter.com/mCrl7D76p1";;@GameOfThrones;#DrFaustus #London #JonSnow;"746805241161654272";https://twitter.com/MrG48/status/746805241161654272
;2016-06-25 22:40;0;0;"@jonsnowC4 Jon I used to rate you as an anchor.Professional and impartial.Now you're high drama, peddling bread and circuses.What happened?";;@jonsnowC4;;"746805210408960000";https://twitter.com/jarvissa/status/746805210408960000
;2016-06-25 22:39;0;0;"Bet you didn't notice Jon Snow 's floppy fake sword on 'Game of Thrones' http:// goo.gl/fb/AI0ZQo #jonsnow";;;#jonsnow;"746805128414502913";https://twitter.com/Panoss_64/status/746805128414502913
;2016-06-25 22:39;0;0;"This GIF of Jon Snow ’s rubber sword on “Game of Thrones” will ruin you for life http:// hellogiggles.com/this-gif-of-jo n-snows-rubber-sword-on-game-of-thrones-will-ruin-you-for-life/ … via @hellogiggles";;@hellogiggles;;"746804963372838912";https://twitter.com/shawnstalter/status/746804963372838912
;2016-06-25 22:38;0;0;"Meme si j'aimais pas sa façon de traiter Jon Snow , c'est une mere qui s'est sacrifiée pour ses enfants https:// twitter.com/clarkemiiias/s tatus/746657781177024512 …";;;;"746804822444118016";https://twitter.com/didiaryaa/status/746804822444118016
;2016-06-25 22:38;0;0;"Leo ahora que El Picure es familia de Jon Snow ... qué clase de vaina es esa";;;;"746804690063589376";https://twitter.com/Santixs/status/746804690063589376
;2016-06-25 22:37;1;0;"Shubvashisht: UnRealMohit: AVsyntax: RT geeksntwits: #TECH Bet you didn't notice Jon Snow 's floppy fake sword on '… http:// Mashable.com";;;#TECH;"746804584727851008";https://twitter.com/UnRealMohit/status/746804584727851008
;2016-06-25 22:37;1;1;"Jon Snow is died.... #GOT";;;#GOT;"746804544072474624";https://twitter.com/Lucas_prrn/status/746804544072474624
;2016-06-25 22:37;1;1;"Bet you didn't notice Jon Snow 's floppy fake sword on 'Game of Thrones' http:// mashable.com/2016/06/25/gam e-of-thrones-jon-snow-sword/#iT2wmeWri05S … via @mashable #ValyrianRubber";;@mashable;#iT2wmeWri05S #ValyrianRubber;"746804511784611840";https://twitter.com/ThumbsBlue/status/746804511784611840
;2016-06-25 22:37;0;0;"I know nothing about the #gameofthrones #tv show. I'm waiting for the next #book . #jonsnow … https://www. instagram.com/p/BHF1PAuDbds/";;;#gameofthrones #tv #book #jonsnow;"746804506134982656";https://twitter.com/AJRobertsWebGuy/status/746804506134982656
;2016-06-25 22:35;0;1;"@malentaqui @estatua_rxn @correatiago @RenatoCamara1 Jon Snow on a bike https:// twitter.com/9gaggifs/statu s/746800011967668224 …";;@malentaqui @estatua_rxn @correatiago @RenatoCamara1;;"746804059231879168";https://twitter.com/pott77/status/746804059231879168
;2016-06-25 22:35;75;82;"Bet you didn't notice Jon Snow 's floppy fake sword on 'Game of Thrones' http:// on.mash.to/28T2Voy pic.twitter.com/yrV5EfS9vN";;;;"746803960451858432";https://twitter.com/mashable/status/746803960451858432
;2016-06-25 22:34;0;2;"Jon Snow angry as he grills Theresa Villiers on repercussions #Leave #Brexit #NorthernIreland http:// youtube.com/watch?v=P5w0Rm … via @youtube";;@youtube;#Leave #Brexit #NorthernIreland;"746803736467611648";https://twitter.com/IRELANDreporter/status/746803736467611648
;2016-06-25 22:33;1;2;"mellissandre de got qui débarque comme ça j'ramène lincoln comme jon snow et @hairofkev_ arrête de pleurer https:// twitter.com/the100fr_/stat us/746793758059003904 …";;@hairofkev_;;"746803471999991808";https://twitter.com/thesillyninja/status/746803471999991808
;2016-06-25 22:33;0;0;"Ygritte and Jon Snow are dating in real life how adorable yes";;;;"746803403959959552";https://twitter.com/reqless_/status/746803403959959552
;2016-06-25 22:32;0;0;"Bet you didn't notice Jon ... - https:// wp.me/p55gzU-17yN - #GameOfThrones #JonSnow #Watercooler #Tech pic.twitter.com/JE29Vm3Ifu";;;#GameOfThrones #JonSnow #Watercooler #Tech;"746803266386825217";https://twitter.com/sonething_news/status/746803266386825217
;2016-06-25 22:32;0;0;"What the latest '<b>Game of Thrones</b>' episode may mean for the future of Jon Snow : "Game of Thrones," as the… http:// goo.gl/fb/ZHQTXL";;;;"746803185554235392";https://twitter.com/AlMaradon/status/746803185554235392
;2016-06-25 22:31;1;1;"Bet you didn't notice Jon Snow 's floppy fake sword on 'Game of Thrones' http:// ow.ly/6TFP501LtUC";;;;"746803029685444608";https://twitter.com/MeloniFulvio/status/746803029685444608
;2016-06-25 22:31;0;0;"fair enough, any age can have their views taken into account, understand.";;;;"746802960278110208";https://twitter.com/Bluewurst1875/status/746802960278110208
;2016-06-25 22:30;0;0;"Bet you didn't notice Jon Snow 's floppy fake sword on 'Game of Thrones' http:// ift.tt/28XgBBy #startup #Dubai #GCC";;;#startup #Dubai #GCC;"746802867307225088";https://twitter.com/silverbacklive/status/746802867307225088
;2016-06-25 22:30;0;0;"#GameofThrones Jon Snow Battle Fallout! http://www. buzzchomp.com/jon-snow-battl e-fallout-game-thrones-season-6-reaction/ … What does Littlefinger want from Sansa - The North and her! #Vlog";;;#GameofThrones #Vlog;"746802832150519809";https://twitter.com/BuzzzChomp/status/746802832150519809
;2016-06-25 22:30;1;3;"Jon Snow muy enojado por el resultado del #Brexit #GameofThrones pic.twitter.com/hQ18B9xsb4";;;#Brexit #GameofThrones;"746802671974232066";https://twitter.com/__Matta__/status/746802671974232066
;2016-06-25 22:30;0;1;"so a 65 year who thinks voting out is best for grandkids isn't allowed that choice?";;;;"746802648066760704";https://twitter.com/claretmurger/status/746802648066760704
;2016-06-25 22:29;0;0;"@PlanetComicon Do you remember artist with prints of character faces made from quotations? Joker, Spider Jerusalem, Chewbacca, Jon Snow ?";;@PlanetComicon;;"746802639527018497";https://twitter.com/jondresner/status/746802639527018497
;2016-06-25 22:29;0;1;"Picked up our Boston butt for tomorrow's #got party. #jonsnow #tyrionlannister @brianwright https://www. instagram.com/p/BHF0U2cBbqC/";;@brianwright;#got #jonsnow #tyrionlannister;"746802511198093312";https://twitter.com/ThomasLamey1/status/746802511198093312
;2016-06-25 22:29;0;0;"i'm not a great jon snow fan ...";;;;"746802437185486849";https://twitter.com/Serpentine202/status/746802437185486849
;2016-06-25 22:28;0;0;"Bet you didn't notice Jon Snow 's floppy fake sword on 'Game of Thrones' http:// ift.tt/28XgBBy via Chloe Bryan";;;;"746802337251991552";https://twitter.com/All_Trends_IT/status/746802337251991552
;2016-06-25 22:28;0;1;"I liked a @YouTube video from @smokescreenvids http:// youtu.be/mDjtAH2soiA?a Game of Thrones Season 6 Episode 9 Review / Recap | Jon Snow";;@YouTube @smokescreenvids;;"746802299713036288";https://twitter.com/eenbeen3131/status/746802299713036288
;2016-06-25 22:26;0;0;"What the latest 'Game of Thrones' episode may mean for the future of Jon Snow - http://www. ajayadas.com/what-the-lates t-game-of-thrones-episode-may-mean-for-the-future-of-jon-snow/ … pic.twitter.com/aQJvK1qY2M";;;;"746801883222777856";https://twitter.com/ajayadas/status/746801883222777856
;2016-06-25 22:26;0;0;"Bet you didn't notice Jon Snow 's floppy fake sword on 'Game of Thrones' via mashable http:// ift.tt/28ZyQaP";;;;"746801774313480192";https://twitter.com/dea_tabs/status/746801774313480192
;2016-06-25 22:26;0;0;"#SuryaRay #Surya Nice Blog @suryaray Bet you didn't notice Jon Snow 's floppy… http:// dlvr.it/LfQs1Z #SuryaRay #Indian @suryaray @suryaray3";;@suryaray @suryaray @suryaray3;#SuryaRay #Surya #SuryaRay #Indian;"746801706952859648";https://twitter.com/Toyota_Venza/status/746801706952859648
;2016-06-25 22:26;0;1;"Bet you didn't notice #JonSnow 's floppy fake sword on ' #GameofThrones ' http:// dlvr.it/LfQs6D pic.twitter.com/QJtixQYSTP";;;#JonSnow #GameofThrones;"746801699931623424";https://twitter.com/atulaugust/status/746801699931623424
;2016-06-25 22:26;0;0;"#SOCIALMEDIA Bet you didn't notice Jon Snow 's floppy fake sword… http:// goo.gl/hWHmhU via @mashable #Followback pic.twitter.com/IlbzC7kvcF";;@mashable;#SOCIALMEDIA #Followback;"746801695598878720";https://twitter.com/bloggerg/status/746801695598878720
;2016-06-25 22:26;0;1;"Bet you didn't notice #JonSnow 's floppy fake sword on ' #GameofThrones ' http:// dlvr.it/LfQrpk pic.twitter.com/BaClKWgQUY";;;#JonSnow #GameofThrones;"746801684983099393";https://twitter.com/atulaugust/status/746801684983099393
;2016-06-25 22:26;0;1;"Really good meta about #JonSnow #JustWow #MakesSoMuchSense #GameofThrones https:// m.reddit.com/r/gameofthrone s/comments/4pndkb/everything_jons_story_in_battle_of_the_bastards/?utm_source=mweb_redirect&compact=true …";;;#JonSnow #JustWow #MakesSoMuchSense #GameofThrones;"746801678901452805";https://twitter.com/AbaraiAnn/status/746801678901452805
;2016-06-25 22:26;0;1;"SL+TH Bet you didn't notice Jon Snow 's floppy fake sword on 'Game of Thrones' http:// mashable.com/2016/06/25/gam e-of-thrones-jon-snow-sword/?utm_campaign=Mash-Prod-RSS-Feedburner-All-Partial&utm_cid=Mash-Prod-RSS-Feedburner-All-Partial&utm_source=dlvr.it&utm_medium=twitter … #JonSnow #GameOfThrones #Watercooler";;;#JonSnow #GameOfThrones #Watercooler;"746801668465917952";https://twitter.com/complex_roolz/status/746801668465917952
;2016-06-25 22:26;0;0;"#SOCIALMEDIA Bet you didn't notice Jon Snow 's floppy fake sword… http:// goo.gl/H2u1e9 via @mashable #Followback pic.twitter.com/sPVosk8oAs";;@mashable;#SOCIALMEDIA #Followback;"746801667127947264";https://twitter.com/bloggerg/status/746801667127947264
;2016-06-25 22:25;9;1;"50. jon snow - cara de bobo mas eh um anjo - nao sabe de nada - injustiçado pic.twitter.com/7wijomfFUR";;;;"746801618683838464";https://twitter.com/rapmsnster/status/746801618683838464
;2016-06-25 22:25;0;5;"Jon Snow out here tryna get his face sat on.";;;;"746801584005226497";https://twitter.com/CaramelMama2010/status/746801584005226497
;2016-06-25 22:25;0;0;"Bet you didn't notice Jon Snow 's floppy fake sword on 'Game of Thrones': During the Bat... http:// on.mash.to/28VaQ33 #Branding #Marketing";;;#Branding #Marketing;"746801455101710337";https://twitter.com/WhitneyMullings/status/746801455101710337
;2016-06-25 22:25;0;0;"#SuryaRay #Surya #SuryaRay #Surya Bet you didn't notice Jon Snow 's floppy fake sword… http:// dlvr.it/LfQrSz @suryaray @suryaray @suryaray3";;@suryaray @suryaray @suryaray3;#SuryaRay #Surya #SuryaRay #Surya;"746801431286448128";https://twitter.com/Toyota_Venza/status/746801431286448128
;2016-06-25 22:24;0;0;"you have spent years drumming up support for Islam English people know C4 news is aimed at destroying them Our time is now";;;;"746801344078557184";https://twitter.com/mincheryfarmer/status/746801344078557184
;2016-06-25 22:24;0;0;"Bet you didn't notice Jon Snow 's floppy fake sword on 'Game of Thrones': During the Bat... http:// on.mash.to/28ZyXmM #Top #Blog #Resource";;;#Top #Blog #Resource;"746801329415151617";https://twitter.com/nikhilhmakwana/status/746801329415151617
;2016-06-25 22:24;0;1;"Bet you didn't notice Jon Snow 's floppy fake sword on 'Game of Thrones' http:// mashable.com/2016/06/25/gam e-of-thrones-jon-snow-sword/?utm_campaign=Mash-Prod-RSS-Feedburner-All-Partial&utm_cid=Mash-Prod-RSS-Feedburner-All-Partial&utm_source=dlvr.it&utm_medium=twitter … #Jon_Snow";;;#Jon_Snow;"746801301124612096";https://twitter.com/MartinStojkov/status/746801301124612096
;2016-06-25 22:24;2;1;"Bet you didn't notice Jon Snow 's floppy fake sword on 'Game of Thrones' http:// dlvr.it/LfQr2Y";;;;"746801281981784064";https://twitter.com/LoriMoreno/status/746801281981784064
;2016-06-25 22:24;1;1;"best character on Game Of Thrones jon snow is trash";;;;"746801261828157440";https://twitter.com/walkofatonement/status/746801261828157440
;2016-06-25 22:24;0;0;"@Maisie_Williams Joel dressed as JON SNOW FROM THE GAME OF THRONES at Tough Guy Event 2016 https://www. youtube.com/watch?v=40mVzY gyrSc … http://www. alwayswithasmile.com";;@Maisie_Williams;;"746801192102141953";https://twitter.com/bad_baz555/status/746801192102141953
;2016-06-25 22:23;2;1;"Bet you didn't notice Jon Snow 's floppy fake sword on 'Game of Thrones' http:// mashable.com/2016/06/25/gam e-of-thrones-jon-snow-sword/?utm_campaign=Mash-Prod-RSS-Feedburner-All-Partial&utm_cid=Mash-Prod-RSS-Feedburner-All-Partial …";;;;"746801124359831552";https://twitter.com/EmperorDarroux/status/746801124359831552
;2016-06-25 22:23;0;1;"Bet you didn't notice Jon Snow 's floppy fake sword on 'Game of Thrones': During the Battle of the Basta... http:// bit.ly/299PNv4 | M!";;;;"746801063060111361";https://twitter.com/terriferic/status/746801063060111361
;2016-06-25 22:23;2;0;"Bet you didn't notice Jon Snow 's floppy fake sword on 'Game of Thrones' http:// on.mash.to/28VaRE9";;;;"746801028025171970";https://twitter.com/TheMehulPatel/status/746801028025171970
;2016-06-25 22:23;0;0;"Tech Update: Bet you didn't notice Jon Snow 's floppy fake sword on 'Game of Thrones': During the Battle of t... http:// bit.ly/28YuWNa";;;;"746801027895046144";https://twitter.com/tomsoul1234/status/746801027895046144
;2016-06-25 22:23;1;1;"Jon Snow coming back from the dead in Game Of Thrones 6 got me like.....'Am getting me a witch....i ain't dying at all....'";;;;"746800975319470081";https://twitter.com/Alexmoney305/status/746800975319470081
;2016-06-25 22:23;0;0;"@FanofThrones Joel dressed as JON SNOW FROM THE GAME OF THRONES at Tough Guy Event 2016 https://www. youtube.com/watch?v=40mVzY gyrSc … http://www. alwayswithasmile.com";;@FanofThrones;;"746800925210193920";https://twitter.com/bad_baz555/status/746800925210193920
;2016-06-25 22:20;0;1;"@jonsnowC4 this is getting a lot of support in NI just now. It's only been opened for a couple of hours 1200 signed. https:// twitter.com/happylou84/sta tus/746795587081748480 …";;@jonsnowC4;;"746800368688955392";https://twitter.com/happylou84/status/746800368688955392
;2016-06-25 22:20;0;1;"Yeah I'm Jon Snow trash and I'm Daryl Dixon trash";;;;"746800358882742272";https://twitter.com/alina_ambitious/status/746800358882742272
;2016-06-25 22:19;0;0;"Game Of Thrones son bölümü 1333788.. Kez izleyip her defasında ramsey in yıkılısında sırıtmak jon snow";;;;"746800086655569920";https://twitter.com/elifofficiall/status/746800086655569920
;2016-06-25 22:18;0;1;"On dirait Jon Snow sur celles la";;;;"746799774821720065";https://twitter.com/Nicolaslebillan/status/746799774821720065
;2016-06-25 22:18;0;0;"Jon Snow Is A Terrible Military Commander - Winter is Taking Forever https:// youtu.be/q01g0LrYfsQ";;;;"746799702671298561";https://twitter.com/Chrisworldpeace/status/746799702671298561
;2016-06-25 22:16;0;4;"but Jon Snow knows nothing! wait ... neither does Trump. yeah, it might work ... https:// twitter.com/brendakeating3 /status/746799030189989888 …";;;;"746799365767987204";https://twitter.com/Serpentine202/status/746799365767987204
;2016-06-25 22:16;0;1;"So very true!!";;;;"746799326723215360";https://twitter.com/baileys1990/status/746799326723215360
;2016-06-25 22:14;0;1;"Esta tarde he visto una figura de Jon Snow y he llorado un poco.";;;;"746798743538835456";https://twitter.com/jiwoonderland/status/746798743538835456
;2016-06-25 22:14;1;0;"Jon Snow was the 1st to step forward for his team, while Ramsay Bolton was the last for his. #leadership @GameOfThrones #GameOfThrones #GoT";;@GameOfThrones;#leadership #GameOfThrones #GoT;"746798707899654144";https://twitter.com/poochmusicdan/status/746798707899654144
;2016-06-25 22:14;0;2;"Jon Snow : *comes back to life* @messylifemandi : I see a PENIS!!";;@messylifemandi;;"746798706939203584";https://twitter.com/sistersadeyes/status/746798706939203584
;2016-06-25 22:14;0;0;"Bir @YouTube videosu beğendim: http:// youtu.be/OU7ztXgS95s?a Jon Snow 's Play of the Game";;@YouTube;;"746798671971360768";https://twitter.com/zahidhakimov/status/746798671971360768
;2016-06-25 22:13;0;0;"¿Será que en el episodio 10 sabremos si Lyanna Stark es la madre de Jon Snow ?";;;;"746798509614108672";https://twitter.com/Virggy01/status/746798509614108672
;2016-06-25 22:13;0;0;"My fav #GoT characters so far (in no order) a little over 2 seasons in: Arya Tyrion Jaqen Dany Sandor Ned Sam Margaery Jon Snow Renly";;;#GoT;"746798404437573632";https://twitter.com/JenniferLVance/status/746798404437573632
;2016-06-25 22:12;0;1;". @jonsnowC4 @wilde Who wants to work in these 'other countries'? Don't forget the famous patriotic song: "There'll always be a Poundland..."";;@jonsnowC4 @wilde;;"746798342395564032";https://twitter.com/MarkJDoran/status/746798342395564032
;2016-06-25 22:12;0;5;"Chui un peu trop amoureuse de Jon Snow c'est genant";;;;"746798325052088320";https://twitter.com/PetitNemAuRiz/status/746798325052088320
;2016-06-25 22:12;0;0;"Game Of Thrones season 6 finale spoilers: Will Sansa Stark turn on Jon Snow ? http://www. unrealitytv.co.uk/tv/game-throne s-season-6-finale-spoilers-will-sansa-stark-turn-jon-snow/ … pic.twitter.com/L1IV63t39H";;;;"746798303971401728";https://twitter.com/unrealitytv/status/746798303971401728
;2016-06-25 22:12;0;0;"I want to warg into Jon snow";;;;"746798289639510016";https://twitter.com/Weirddpoet/status/746798289639510016
;2016-06-25 22:12;0;0;"GAME OF THRONES: SANSA LUCHARA A LADO DE JON SNOW ? http:// blogsofthrones.blogspot.com/2015/11/game-o f-thrones-sansa-luchara-lado-de.html … pic.twitter.com/hiUribMnQH";;;;"746798260677971968";https://twitter.com/RocioHerreraYT/status/746798260677971968
;2016-06-25 22:11;0;2;"Ramsey Snow, beginning of season 4 - "Who the fuck is Jon Snow ?" Me - heh heh heh heh!";;;;"746798031291490304";https://twitter.com/writersblock08/status/746798031291490304
;2016-06-25 22:11;1;2;"'You know nothing Jon Snow ' https:// twitter.com/jonsnowc4/stat us/746307838792826881 …";;;;"746798024693809152";https://twitter.com/KulganofCrydee/status/746798024693809152
;2016-06-25 22:11;0;1;"It's lucky Jon Snow was stabbed and not beheaded cause that would have been a nasty af resurrection";;;;"746797954959278080";https://twitter.com/Gab_r_iel/status/746797954959278080
;2016-06-25 22:09;0;0;"apologies if shortage of chars made unclear:the elderly blocked the youth aspiration for EU citizenship by #VoteLeave";;;#VoteLeave;"746797539928702976";https://twitter.com/BobBaunsbak/status/746797539928702976
;2016-06-25 22:08;0;1;"#CROPOR Ivan Rakitic versus Jon Snow . Who is surviving trampling like a real boss?";;;#CROPOR;"746797272504147968";https://twitter.com/Asx3t0s/status/746797272504147968
;2016-06-25 22:08;0;2;"There he go that's Jon snow #JonDoeRemix baby #FuckBolton";;;#JonDoeRemix #FuckBolton;"746797163431231488";https://twitter.com/JamesBradley35/status/746797163431231488
;2016-06-25 22:08;0;0;"You make my point for me. We are caretakers for the youth, who want EU citizenship, but you disagree.";;;;"746797145001431040";https://twitter.com/BobBaunsbak/status/746797145001431040
;2016-06-25 22:07;0;3;"Donc ouais, headcannon grandissant que Jon Snow (et possiblement tous les Stark et/ou Targaryen) savent faire un U avec la langue.";;;;"746797100671864832";https://twitter.com/elnikow/status/746797100671864832
;2016-06-25 22:07;0;1;"I love this, but Jon and Arya's reunion will outdo it. #JonSnow #AryaStark #GameofThrones https:// youtu.be/lzHj-LrhwBc";;;#JonSnow #AryaStark #GameofThrones;"746797071529816064";https://twitter.com/clarry_8/status/746797071529816064
;2016-06-25 22:05;0;0;"Esto es solo para fans #Got ... Eres el mejor #jonsnow , ya estaba… https://www. instagram.com/p/BHFxjRfDygTz hOZ5p8wGwOxxxvP8VLcz9azyCk0/ …";;;#Got #jonsnow;"746796410536927232";https://twitter.com/monica0392/status/746796410536927232
;2016-06-25 22:04;0;0;"I love how Jon Snow is turning into an even better version of Ned; and Ned was pretty amazing.";;;;"746796263866269696";https://twitter.com/Gooner_dC/status/746796263866269696
;2016-06-25 22:04;0;0;"Game of Thrones' Season 7 Will Be Shorter #GameofThrones #winteriscoming #GoT #JonSnow #HBO http:// soco.space/FPd_p . pic.twitter.com/QXZdSInPyt";;;#GameofThrones #winteriscoming #GoT #JonSnow #HBO;"746796144836108288";https://twitter.com/games_throne/status/746796144836108288
;2016-06-25 22:02;0;1;"yes";;;;"746795847568994305";https://twitter.com/gawdyhall/status/746795847568994305
;2016-06-25 22:02;0;0;"The dirtier, bloodier and more savage #JonSnow gets, the more I want him. I think that's how you know it's true love. #got #gameofthrones";;;#JonSnow #got #gameofthrones;"746795842967744512";https://twitter.com/_bobbilou/status/746795842967744512
;2016-06-25 22:02;0;0;"I knew it! Bayou know nothing Jon snow ! http:// fb.me/1isftEVih";;;;"746795818691203072";https://twitter.com/LadyHunterMoon/status/746795818691203072
;2016-06-25 22:02;0;1;"TORIES TRYING TO SELL IT OFF!!";;;;"746795695282266113";https://twitter.com/BENEFITS_NEWS/status/746795695282266113
;2016-06-25 22:02;0;0;"yes, but problem is if youth see themselves as european citizens and elderly see that as bad, think best to block that";;;;"746795639149830144";https://twitter.com/BobBaunsbak/status/746795639149830144
