username;date;retweets;favorites;text;geo;mentions;hashtags;id;permalink
;2016-06-26 01:58;0;0;"Here's why we didn't see Jon Snow 's direwolf, Ghost, during 'Battle of the Bastards' http:// mashable.com/2016/06/22/no- ghost-direwolf-game-of-thrones/#SXMLFUgJP05h … via @mashable // I miss Ghost";;@mashable;#SXMLFUgJP05h;"746855033396989952";https://twitter.com/MariRocha/status/746855033396989952
;2016-06-26 01:57;0;1;"you know nothing, Jon Snow";;;;"746854899204358144";https://twitter.com/cristomato/status/746854899204358144
;2016-06-26 01:56;0;7;"honestly is there anything in the world more emo than jon snow in season 2 pic.twitter.com/CyoFfKyzOv";;;;"746854637278461952";https://twitter.com/kelronhubbard/status/746854637278461952
;2016-06-26 01:53;0;0;"@ZealousAffix Jon Snow had heard about the Mother of Dragons and was finally sailing across the world to get an audience with her.--";;@ZealousAffix;;"746853759347724288";https://twitter.com/WatchfulSnow/status/746853759347724288
;2016-06-26 01:51;0;3;"Jon Snow still hot covered in mud and blood tho";;;;"746853256652029953";https://twitter.com/AnnaHerdRulez/status/746853256652029953
;2016-06-26 01:50;0;1;"Jon snow 's sword baby pic.twitter.com/seYQ8XhwlO";;;;"746853162565382144";https://twitter.com/mynikesaregray/status/746853162565382144
;2016-06-26 01:49;0;1;"yeah don't you know Jon snow has to cut his ears every now and then?";;;;"746852959124742144";https://twitter.com/Ayyrika/status/746852959124742144
;2016-06-26 01:49;1;0;"altho I would let muddy Jon Snow in my bed...and I would never wash the sheets again. #realtalk";;;#realtalk;"746852806519308288";https://twitter.com/GarySilver/status/746852806519308288
;2016-06-26 01:48;0;1;"jon snow and hodor have sex in season 7 btw";;;;"746852689418555392";https://twitter.com/aqambar_/status/746852689418555392
;2016-06-26 01:48;1;0;"I just realize I'm Jon Snow . https:// twitter.com/lordsnow/statu s/746729158030594048 …";;;;"746852621797982208";https://twitter.com/Samishied/status/746852621797982208
;2016-06-26 01:46;1;1;"Can we invite Nicola Sturgeon to be our PM? Jon Snow ? David Attenborough? OK - what's Lisa Simpson doing right now? Anyone ...?";;;;"746852210789724160";https://twitter.com/joannalayton/status/746852210789724160
;2016-06-26 01:46;0;0;"Jon Snow 's Valyrian Steel Sword Is Actually Rubber And It's Hilarious http://www. buzzfeatured.com/jon-snows-valy rian-steel-sword-is-actually-rubber-and-its-hilarious/ …";;;;"746852138542833664";https://twitter.com/BuzzFeaturedInc/status/746852138542833664
;2016-06-26 01:46;0;0;"Kara kale de Jon Snow 'a bile ihanet ettiler ben nasıl insanlara güveneyim? pic.twitter.com/QYQC5w5le0";;;;"746852051016159232";https://twitter.com/Selambentpa/status/746852051016159232
;2016-06-26 01:46;0;0;"#Tofunmidisu Scoops: Will Jon Snow have to kill Melisandre in the #GameofThrones finale? M… pic.twitter.com/NmWGZMQmuU pic.twitter.com/q3L4pmQh8a";;;#Tofunmidisu #GameofThrones;"746851992618868736";https://twitter.com/TofunmiDisu/status/746851992618868736
;2016-06-26 01:45;0;3;"alright jon snow HAS to find out about his lineage in the finale tmrw and Dany BETTER be sailing her ass to westeros";;;;"746851915351236608";https://twitter.com/Macamirani/status/746851915351236608
;2016-06-26 01:45;2;3;"Jon Snow a deja baiser l'game en revenant à la vie pk pas Mickael Jackson ? #beliaive";;;#beliaive;"746851903745712129";https://twitter.com/valentineghrd/status/746851903745712129
;2016-06-26 01:45;0;1;"Will Jon snow ever know something? https:// twitter.com/justabxbygirl/ status/746849981378756613 …";;;;"746851735969345536";https://twitter.com/abdulqaadirCFC/status/746851735969345536
;2016-06-26 01:43;1;1;"@_wonderfrankie theory lead to believe that he is actually. Jon Snow is a major key in GoT.";;@_wonderfrankie;;"746851386780954624";https://twitter.com/ayoJUVY/status/746851386780954624
;2016-06-26 01:43;0;0;"Why tf did they kill Jon Snow ?!?!";;;;"746851253511032832";https://twitter.com/spencer_loren/status/746851253511032832
;2016-06-26 01:42;0;0;"Article 50 was only given the go-ahead after correctly guessing who Jon Snow 's mother is #Article50facts";;;#Article50facts;"746851172649156608";https://twitter.com/Reid4Will/status/746851172649156608
;2016-06-26 01:42;0;0;"Game of Thrones - Why Sansa Betrayed Jon Snow https:// youtu.be/o7WmsR6VxCs via @YouTube";;@YouTube;;"746851125110812672";https://twitter.com/apoulson/status/746851125110812672
;2016-06-26 01:42;0;1;"I seem to have done rather well for myself thanks. Educated & rich, yet voted out. Oh dear.";;;;"746851115338129408";https://twitter.com/jparrie/status/746851115338129408
;2016-06-26 01:42;0;1;"Why wouldn't #jonsnow give won-won the Giant armor or a weapon? #gameofquestions #got";;;#jonsnow #gameofquestions #got;"746851080919715840";https://twitter.com/CalebDrenth/status/746851080919715840
;2016-06-26 01:41;0;0;"My last weekend off for many moons. Nurse life with the weekend option. At least I can spend Sunday with Jon Snow @GameOfThrones #finale";;@GameOfThrones;#finale;"746850875717492736";https://twitter.com/darkdefender66/status/746850875717492736
;2016-06-26 01:41;0;2;"when wildling meets the Lord Commander #kitharington #jonsnow #gameofthrones @Duke of York's… https://www. instagram.com/p/BHGKSMwBmru/";;@Duke;#kitharington #jonsnow #gameofthrones;"746850800324861952";https://twitter.com/hUnKied0Ry/status/746850800324861952
;2016-06-26 01:41;0;0;"Go to bed, cheeky!";;;;"746850733660737536";https://twitter.com/LizzieCornish/status/746850733660737536
;2016-06-26 01:40;0;0;"queria que as cobertas e o jon snow pudessem aparecer na foto p vcs terem 1 noção clara e completa da minha alegria pic.twitter.com/OVkyvJ25j3";;;;"746850685090660352";https://twitter.com/pietrardrgs/status/746850685090660352
;2016-06-26 01:39;0;2;"Is it just me or does Jon Snow look like @vancejoy ? I can't be the only one who thinks this.";;@vancejoy;;"746850248266440704";https://twitter.com/splendid_Steph/status/746850248266440704
;2016-06-26 01:38;0;0;"Go to bed, it's WAY past your bedtime! No breakfast for you in the morning. ;0)";;;;"746850131966857216";https://twitter.com/LizzieCornish/status/746850131966857216
;2016-06-26 01:37;0;2;"I liked a @YouTube video http:// youtu.be/OU7ztXgS95s?a Jon Snow 's Play of the Game";;@YouTube;;"746849750146768897";https://twitter.com/juzzy84/status/746849750146768897
;2016-06-26 01:37;0;1;"You talk too much. Try something more productive.";;;;"746849749416841217";https://twitter.com/jparrie/status/746849749416841217
;2016-06-26 01:37;1;2;"The night is dark and full of terrors Jon Snow pic.twitter.com/FafMh8Zm2f";;;;"746849720157474816";https://twitter.com/Vickbass/status/746849720157474816
;2016-06-26 01:36;0;2;"#an_to_got_htan_elliniko ο Μαρινάκης θα υποστήριζε πέναλτι για τον Jon Snow .";;;#an_to_got_htan_elliniko;"746849661898604544";https://twitter.com/maroulakipro/status/746849661898604544
;2016-06-26 01:36;0;0;"Game of Thrones season 6: Kit Harington all but admits Jon Snow isn’t dead, will be in the show for seasons to come";;;;"746849638481805312";https://twitter.com/CarlieNemet619/status/746849638481805312
;2016-06-26 01:36;0;0;"Oh, just lock me up and throw key away..after all, I'm a Dangerous Ol' Woman, you know...";;;;"746849504721264641";https://twitter.com/LizzieCornish/status/746849504721264641
;2016-06-26 01:34;0;0;"Mañana es la gran final y si pensas que hablo de fútbol no sabes nada Jon snow";;;;"746849022061719553";https://twitter.com/maximoverduri/status/746849022061719553
;2016-06-26 01:33;0;3;"no apoyo a la perraca de sansa, jon snow presidente";;;;"746848843023650817";https://twitter.com/PabloToledo98/status/746848843023650817
;2016-06-26 01:33;0;0;"Porque o Jon Snow não pediu para a Melisandre ressuscitar o Rickon Stark? @hey_mika @carolmoreira3 #MIKAROL";;@hey_mika @carolmoreira3;#MIKAROL;"746848795728687104";https://twitter.com/douglas89sonne1/status/746848795728687104
;2016-06-26 01:33;0;1;"Sans oublier Jon Snow et Daenerys Targaryen ! La Khaleesi ! La Mère des Dragons #LT";;;#LT;"746848744524685313";https://twitter.com/NIRVANESQUE__/status/746848744524685313
;2016-06-26 01:31;0;1;"Pahahahahah descrição do Jon Snow : "He's prettier than both my daughters, but he knows how to fight." Não podia ter dito melhor.";;;;"746848365166608384";https://twitter.com/Mystery_Weapon/status/746848365166608384
;2016-06-26 01:31;0;0;"Don't do 'friends' with those who want to remove old folks...Odd that, eh? ;0)";;;;"746848310112194561";https://twitter.com/LizzieCornish/status/746848310112194561
;2016-06-26 01:31;0;0;"You no nothing jon snow";;;;"746848209402728448";https://twitter.com/CesarAzpii/status/746848209402728448
;2016-06-26 01:30;6;19;"Will Jon Snow have to kill Melisandre in the #GameofThrones finale? Maybe! http:// tvgd.co/28VprQY pic.twitter.com/aYwAXRfgow";;;#GameofThrones;"746847969161318400";https://twitter.com/TVGuide/status/746847969161318400
;2016-06-26 01:30;0;0;"Tengo de fondo un vídeo de Jon Snow golpeando a Ramsay por una hora.";;;;"746847964065259520";https://twitter.com/Zergark/status/746847964065259520
;2016-06-26 01:29;0;0;"hahahah spoiler alert: Jon Snow comes back from death for the 1000th time";;;;"746847769818701825";https://twitter.com/Uneasy_lies/status/746847769818701825
;2016-06-26 01:29;0;0;"I left out a second 'have', as in 'have to have me voting'";;;;"746847736713056256";https://twitter.com/LizzieCornish/status/746847736713056256
;2016-06-26 01:28;0;0;"nossa falam tanto you know nothing jon snow q eu espera uma cena pica das galaxias pic.twitter.com/k3iLba4WFC";;;;"746847563026948096";https://twitter.com/breackingbad/status/746847563026948096
;2016-06-26 01:28;0;0;"By the way, I sure ain't no Dumb Ol' Babe, so you can shove your patronizing bunkum up your arse.";;;;"746847557465280512";https://twitter.com/LizzieCornish/status/746847557465280512
;2016-06-26 01:28;1;2;"Jon Snow and Vincent Vega. This is one of the best things I done ever seen. #GameofThrones pic.twitter.com/VxGx2w2E4C";;;#GameofThrones;"746847447436001280";https://twitter.com/PinkLuke1991/status/746847447436001280
;2016-06-26 01:26;0;1;"I know it like I knew that Jon Snow would beat Ramsey :D";;;;"746847143420395520";https://twitter.com/kiGzzLoL/status/746847143420395520
;2016-06-26 01:26;2;4;"Jon Snow might actually b a Targaryen.";;;;"746847086012960769";https://twitter.com/_wonderfrankie/status/746847086012960769
;2016-06-26 01:26;0;1;"I call it sovereignty, democracy + accountability. Don't accuse me of xenophobia when you have no basis.";;;;"746847009043267585";https://twitter.com/Elenski55/status/746847009043267585
;2016-06-26 01:26;0;2;"pa los freaks de juego de tronos, sobre la madre de jon snow , no soy el único que piensa lo mismo https://www. youtube.com/watch?v=qU38ku 8gwX0 …";;;;"746846949727477760";https://twitter.com/ChavalinDelRizu/status/746846949727477760
;2016-06-26 01:25;0;0;"J'ai vu plus de fois Jon Snow que d gens à qui je parle tous les jours ptdr parfait";;;;"746846836326076417";https://twitter.com/Wildfireedus/status/746846836326076417
;2016-06-26 01:25;1;3;"Kasım Şeren ft Jon Snow ( Kit Harington ) - Aşk Benimle bu ne Lan lgkajahskxjahahha https://www. youtube.com/watch?v=7tSZVb VFajc&feature=share …";;;;"746846789299482624";https://twitter.com/egunsayar/status/746846789299482624
;2016-06-26 01:25;0;0;"When Jon Snow charged to go and save Rickon, his sword becomes rubber. I have never felt more betrayed.";;;;"746846756604944384";https://twitter.com/iAm_WyzEST/status/746846756604944384
;2016-06-26 01:20;0;0;"dexter sonunda ölüyor,game of thrones desen ölen ölene en son jon snow kazandıydı,spartacus özgür olarak ölüyor romayı alamıyorlar";;;;"746845572183826432";https://twitter.com/ulkayass/status/746845572183826432
;2016-06-26 01:20;0;1;"The North remembers #JonSnow #RobbStark #KitHarington #RichardMadden #GameOfThrones @Leicester… https://www. instagram.com/p/BHGH4_ZjQ5f/";;@Leicester;#JonSnow #RobbStark #KitHarington #RichardMadden #GameOfThrones;"746845531029180416";https://twitter.com/andrex89/status/746845531029180416
;2016-06-26 01:20;0;2;"Bet you didn't notice #JonSnow 's floppy fake sword on #GameofThrones http:// buff.ly/28ZCjpO via @mashable #GOT pic.twitter.com/kXsqKsEayu";;@mashable;#JonSnow #GameofThrones #GOT;"746845475660271616";https://twitter.com/JeffGoesSocial/status/746845475660271616
;2016-06-26 01:20;1;3;"We sing and cheer with delight at Jon Snow 's sadness, we get our pleasure witnessing it. https:// twitter.com/Arron_banks/st atus/746726466470187008 …";;;;"746845427362897920";https://twitter.com/Stephy31uk/status/746845427362897920
;2016-06-26 01:19;0;0;"Gostei de um vídeo @YouTube de @ascaniofranca http:// youtu.be/DuEN8r58pwQ?a Jon Snow - Teorias Comprovadas nos Livros - Part. 2";;@YouTube @ascaniofranca;;"746845238992449536";https://twitter.com/marioclivati/status/746845238992449536
;2016-06-26 01:18;0;3;"Fueron contra Jon Snow y JKR. Hicieron todo mal los ingleses. https:// twitter.com/cristianbaelis h/status/746830825371615233 …";;;;"746844938306977792";https://twitter.com/lorenind/status/746844938306977792
;2016-06-26 01:17;12;2;"Jon is a Christian. Jon comes around every Christmas. Jon is from the north. Jon Snow";;;;"746844844996366337";https://twitter.com/JosephWodo_/status/746844844996366337
;2016-06-26 01:17;0;1;"Top story: Bet you didn't notice Jon Snow 's floppy fake sword on 'Game of Thron… http:// mashable.com/2016/06/25/gam e-of-thrones-jon-snow-sword/ … , see more http:// tweetedtimes.com/twiScoopis?s=t np …";;;;"746844778499805185";https://twitter.com/twiScoopis/status/746844778499805185
;2016-06-26 01:16;0;0;"Well, please, don't hold back...I mean, come ON, let rip with How To Remove Old People...All Ears.";;;;"746844501742850048";https://twitter.com/LizzieCornish/status/746844501742850048
;2016-06-26 01:16;0;0;"Gostei de um vídeo @YouTube http:// youtu.be/AwYZHZG9qYc?aG ame … of Thrones 6x09 " Jon Snow Victory/Wins the Fight" Season 6 Episode 9 Scene";;@YouTube;;"746844494839058432";https://twitter.com/Davidiii23/status/746844494839058432
;2016-06-26 01:15;1;2;"King in the North on sale on Etsy: http:// bit.ly/dcvaetsy #JonSnow #winteriscoming #battleofthebastards #got pic.twitter.com/PSIqcFf0Do";;;#JonSnow #winteriscoming #battleofthebastards #got;"746844219659141120";https://twitter.com/DC_VisualArts/status/746844219659141120
;2016-06-26 01:13;6;14;"#an_to_got_htan_elliniko ο Jon Snow θα ήταν από τις δυτικές συνοικίες & θα είχε πειραγμένο Subaru Impreza, Carrera γυαλιά & χαίτη.";;;#an_to_got_htan_elliniko;"746843708981547008";https://twitter.com/Emmanouelita10/status/746843708981547008
;2016-06-26 01:12;4;5;"#GameofThrones theory: Has Jon Snow been damned with immortality? #JonSnow http:// go.zap2.it/vFDhb pic.twitter.com/A593Fm6BuM";;;#GameofThrones #JonSnow;"746843515284525057";https://twitter.com/screenertv/status/746843515284525057
;2016-06-26 01:12;0;3;"Can't be just me who thought Jon Snow died and came back when he got crushed?";;;;"746843418131824640";https://twitter.com/LilyDuignan/status/746843418131824640
;2016-06-26 01:11;0;1;"You know nothing, Jon Snow pic.twitter.com/NBpLQ2L5Oi";;;;"746843250191900672";https://twitter.com/Anchorcake/status/746843250191900672
;2016-06-26 01:10;0;3;"Jon Snow and Arya are my favorite";;;;"746843159167066112";https://twitter.com/xanderdanvers/status/746843159167066112
;2016-06-26 01:10;0;0;"@dr_alex_gates don't worry quite yet: after th Tory party stagger in2 a lampost, 1 GE & a 2nd referendum later we'll b back in Eu";;@dr_alex_gates;;"746843143853776897";https://twitter.com/SimmondsMills/status/746843143853776897
;2016-06-26 01:09;0;0;"Figure quoted by Louise Mensch when owning Jon Snow (not GoT one) on Twitter earlier.";;;;"746842902752526337";https://twitter.com/PrestonsWomble/status/746842902752526337
;2016-06-26 01:09;0;1;"Jon Snow knows this time. https:// twitter.com/gameofthronefr /status/746779271805419520 …";;;;"746842832292446208";https://twitter.com/batsflip/status/746842832292446208
;2016-06-26 01:09;0;1;"GOT spoiler!!! Jon snow ejderhaların birine binecek haberiniz olsun";;;;"746842819659239425";https://twitter.com/muharremkarkin/status/746842819659239425
;2016-06-26 01:07;0;1;"SPOILERS: Jon Snow went full Leroy Jenkins last week on 'Game of Thrones' http:// fb.me/8QDSczxsw";;;;"746842319786106880";https://twitter.com/nerdvolution/status/746842319786106880
;2016-06-26 01:06;0;0;"Jane's posts are eloquent and fair. She's almost being 'attacked' on here.";;;;"746842089867124736";https://twitter.com/LizzieCornish/status/746842089867124736
;2016-06-26 01:06;0;0;"King ina. Dala niya si rickon! Gago ka ramsay bolton! Mamatay ka sana sa kamay ni jon snow . Lintek.";;;;"746842044560089093";https://twitter.com/crystelleBB/status/746842044560089093
;2016-06-26 01:06;0;1;"En çokta sana ışık tanrısı... Jon Snow 'u dirilttiğin gibi beni de dirilt yarın...";;;;"746842022582050820";https://twitter.com/alicanglhsno/status/746842022582050820
;2016-06-26 01:06;0;1;"hauahaihaua mas Olha essa hauahaihaua";;;;"746841990801793029";https://twitter.com/raissalobato/status/746841990801793029
;2016-06-26 01:06;0;1;"*pulls you away from the Jon Snow poster*";;;;"746841951224340482";https://twitter.com/writerant/status/746841951224340482
;2016-06-26 01:06;0;0;"Horrendous that you've all fallen for the 'it's the old people's fault' new game of The Psychopaths";;;;"746841921105035265";https://twitter.com/LizzieCornish/status/746841921105035265
;2016-06-26 01:05;0;0;"Heureusement il me reste Jon Snow";;;;"746841896765501441";https://twitter.com/91Hoodlums/status/746841896765501441
;2016-06-26 01:05;0;3;"Jon Snow piçi bizden önce astı ya Kurt Başlı Tuğ çok ağrıma gitti.";;;;"746841800900509696";https://twitter.com/mhmtkcrr/status/746841800900509696
;2016-06-26 01:05;0;0;"Now THAT is very true, although Corbyn will help, given a chance, for he CARES about people.";;;;"746841741400084481";https://twitter.com/LizzieCornish/status/746841741400084481
;2016-06-26 01:05;0;0;"‘Game of Thrones’ theory: Has Jon Snow been damned with immortality?: When Melisandre perform... http:// bit.ly/291gjcD #MGWV #TFB #F4F";;;#MGWV #TFB #F4F;"746841682285518848";https://twitter.com/OuvrezLeChien/status/746841682285518848
;2016-06-26 01:04;1;2;"Why isn't anyone paying attention to this super crucial #GameofThrones moment with #JonSnow ? #GoT http:// spr.ly/6011BQq67";;;#GameofThrones #JonSnow #GoT;"746841401149820928";https://twitter.com/SheKnows/status/746841401149820928
;2016-06-26 01:03;0;0;"#SEO #socialmedia : Bet you didn't notice Jon Snow 's floppy fake sword on 'Game… http:// mashable.com/2016/06/25/gam e-of-thrones-jon-snow-sword/ … , see more http:// tweetedtimes.com/Themelis_Cuipe r?s=tnp …";;;#SEO #socialmedia;"746841313270767616";https://twitter.com/Themelis_Cuiper/status/746841313270767616
;2016-06-26 01:03;0;0;"So, accents on #GameofThrones - why does Jon Snow have a distinct accent when the rest of his Stark family don't, esp Sansa, Arya, & Bran?";;;#GameofThrones;"746841298783461377";https://twitter.com/Khushee/status/746841298783461377
;2016-06-26 01:03;0;1;"-No sabes nada Jon Snow -Calmáte sabiduría andante, mata del conocimiento, reina de la materia gris, Carlos Antonio Vélez.";;;;"746841282614530048";https://twitter.com/juampavelez/status/746841282614530048
;2016-06-26 01:03;1;1;"Of course they are as am I.This is an opportunity to work with Europe not be subsumed into a superstate,";;;;"746841259583639552";https://twitter.com/Elenski55/status/746841259583639552
;2016-06-26 01:03;0;0;"Jon snow =bae";;;;"746841247386636292";https://twitter.com/AmelElhamdi/status/746841247386636292
;2016-06-26 01:03;0;0;"Jon Snow 's parents fan theory https:// youtu.be/gLt_jD_V-ao";;;;"746841211403702272";https://twitter.com/sinanyuce/status/746841211403702272
;2016-06-26 01:03;0;2;"we all agree that jon snow should not be in charge of anything requiring strategy or intelligence, right?";;;;"746841153794760704";https://twitter.com/LusciousPear/status/746841153794760704
;2016-06-26 01:02;0;0;"Jon snow";;;;"746841102242680832";https://twitter.com/EboaAurelien/status/746841102242680832
;2016-06-26 01:02;0;0;"Top story: Bet you didn't notice Jon Snow 's floppy fake sword on 'Game of Thron… http:// mashable.com/2016/06/25/gam e-of-thrones-jon-snow-sword/ … , see more http:// tweetedtimes.com/JamaicaBreeze? s=tnp …";;;;"746841093166219264";https://twitter.com/ColinCesvette/status/746841093166219264
;2016-06-26 01:02;0;0;"You have been duped, Sweetheart, into hating the wrong folks by those who DID cause it all...";;;;"746840974056361984";https://twitter.com/LizzieCornish/status/746840974056361984
;2016-06-26 01:02;2;6;"#GameofThrones I don't ship them, but this is some impressive photoshop. #JonSnow #DanaerysTargaryen pic.twitter.com/racnsxk8PD";;;#GameofThrones #JonSnow #DanaerysTargaryen;"746840899485736960";https://twitter.com/Behindtheiron/status/746840899485736960
;2016-06-26 01:01;0;1;"it was like Ramsay laying a trap for Jon Snow TBH";;;;"746840894658088960";https://twitter.com/ScottHoward42/status/746840894658088960
;2016-06-26 01:01;12;16;"تعليق جون سنو عن انفصال بريطانيا من الأتحاد الأوربي ويصفه بالقرار الغبي #قيم_اوف_ثرونز #Gameofthrones #JonSnow #GOT https:// amp.twimg.com/v/68e03e3c-cea 7-472e-81ac-c4f4adb647a4 …";;;# #Gameofthrones #JonSnow #GOT;"746840769030295552";https://twitter.com/MrProsecutor/status/746840769030295552
;2016-06-26 01:01;0;0;"How accurate was Jon Snow 's revival from the dead? We asked a leading mortician. https:// twitter.com/vulture/status /746823821638967296 …";;;;"746840716920360960";https://twitter.com/CTDornan/status/746840716920360960
;2016-06-26 01:01;0;0;"And WHO took that away? NOT your parents, or grandparents, but your GOVERNMENT.";;;;"746840657424187392";https://twitter.com/LizzieCornish/status/746840657424187392
;2016-06-26 01:01;0;3;"I liked a @YouTube video from @twkingmckay http:// youtu.be/o7WmsR6VxCs?a Game of Thrones - Why Sansa Betrayed Jon Snow";;@YouTube @twkingmckay;;"746840646951002116";https://twitter.com/SenpaiSweetFTW/status/746840646951002116
;2016-06-26 01:00;0;1;"Is Kenny Chesney a big deal or something? " he's like one of the biggest names in country"- @campbellxsoup I'm Jon Snow in this situation";;@campbellxsoup;;"746840591246495745";https://twitter.com/dib279/status/746840591246495745
;2016-06-26 01:00;0;1;"Jon snow";;;;"746840575794618368";https://twitter.com/CharlezIngalls/status/746840575794618368
;2016-06-26 01:00;0;2;"DEJA DE SPOILEAR gran puta no se puede luego ver nada contame ahora que revive jon snow tambien";;;;"746840482681135104";https://twitter.com/verotalavera_/status/746840482681135104
;2016-06-26 00:59;0;1;"@jonsnowC4 John, were you never told the likeliest months for hailstones?";;@jonsnowC4;;"746840158952132608";https://twitter.com/ivan_opinion/status/746840158952132608
;2016-06-26 00:58;0;1;"¿Es normal que quiera lamer el móvil cuando veo una foto de Jon Snow ?";;;;"746840026437214208";https://twitter.com/lavozdetukbeza/status/746840026437214208
;2016-06-26 00:57;0;3;"The best looking beak in the House of Black and White. #JonSnowsNose #GameOfThrones #GoT #JonSnow #KitHarington pic.twitter.com/yqij1tDse3";;;#JonSnowsNose #GameOfThrones #GoT #JonSnow #KitHarington;"746839873584148480";https://twitter.com/JonSnowsNose/status/746839873584148480
;2016-06-26 00:57;0;1;"@jonsnowC4 Seriously, you need a break to recharge & synchronise your thoughts, because #LeaveEU Victory has affected you! @SuzanneEvans1";;@jonsnowC4 @SuzanneEvans1;#LeaveEU;"746839851849363456";https://twitter.com/UK999ers/status/746839851849363456
;2016-06-26 00:56;0;0;"Estoy leyendo A Storm of Swords y si Ygritte vuelve a decir "you know nothing, Jon Snow " me meto en el libro y le arranco la lengua.";;;;"746839629551308800";https://twitter.com/femisassy/status/746839629551308800
;2016-06-26 00:56;0;2;"Even from this angle. #JonSnowsNose #GameOfThrones #GoT #JonSnow #KitHarington pic.twitter.com/NOKLSN2E35";;;#JonSnowsNose #GameOfThrones #GoT #JonSnow #KitHarington;"746839456519331840";https://twitter.com/JonSnowsNose/status/746839456519331840
;2016-06-26 00:55;1;1;"A tad condescending there? The younger generation r entitled to their view & I happen to agree with them";;;;"746839380485087232";https://twitter.com/doctpd/status/746839380485087232
;2016-06-26 00:55;0;1;"Pure Jon Snow si retwitta da solo (ho paura). pic.twitter.com/k4s7laOGBf";;;;"746839326227578881";https://twitter.com/OssiaLaura/status/746839326227578881
;2016-06-26 00:55;0;3;"I nose nothing. #JonSnowsNose #GameOfThrones #GoT #JonSnow #KitHarington pic.twitter.com/W3yQzIDuUw";;;#JonSnowsNose #GameOfThrones #GoT #JonSnow #KitHarington;"746839295617437696";https://twitter.com/JonSnowsNose/status/746839295617437696
;2016-06-26 00:55;0;1;"I read a spoiler written by George R R Martin about who Jon Snow 's mother is and its huge...";;;;"746839288004808705";https://twitter.com/hannahspeakss/status/746839288004808705
;2016-06-26 00:54;0;0;"Would you like us to be killed off too? Any particular age in mind? 30? 40? 50? Pray, DO tell...";;;;"746839053824331776";https://twitter.com/LizzieCornish/status/746839053824331776
;2016-06-26 00:54;0;0;"@anthonyarnull brilliant result surrey celebrating with families of all ages, We have savedBritain for people of all ages";;@anthonyarnull;;"746839025328226308";https://twitter.com/sarahofsurrey/status/746839025328226308
;2016-06-26 00:54;0;1;"My cousin's lockscreen is jon snow ,,,";;;;"746838911930884096";https://twitter.com/micchyapologist/status/746838911930884096
