username;date;retweets;favorites;text;geo;mentions;hashtags;id;permalink
;2016-06-26 01:55;0;0;"Good question now that the Ramsey Bolton is dead and everyone lowkey rooting for the Lannisters. https:// twitter.com/VICE/status/74 6846945851826177 …";;;;"746854346554413056";https://twitter.com/DipILLMATIC/status/746854346554413056
;2016-06-26 01:19;1;1;"Ramsey Bolton from game of thrones https:// twitter.com/elalcenoruego/ status/746831027541319680 …";;;;"746845260102377472";https://twitter.com/ramannoodles19/status/746845260102377472
;2016-06-26 01:01;0;0;"@SpeakerRyan hey, do you think the dumbs would associate you with Ramsey Bolton if the notion were introduced? There's a resemblance, no?";;@SpeakerRyan;;"746840693134372864";https://twitter.com/mrMeenor/status/746840693134372864
;2016-06-26 00:57;58;9;"This guy deserves to be rated has one of the Top 3 fictional villains of all time! The Joker Bane Ramsey Bolton pic.twitter.com/pNNGbh4CKK";;;;"746839732374614016";https://twitter.com/TheJoshHimself/status/746839732374614016
;2016-06-26 00:49;0;0;"en son Ramsey Bolton la kavga ediyordum ama onun bundan haberi yoktu söyleyeceklerim bu kadar";;;;"746837672719704064";https://twitter.com/e_ckmk/status/746837672719704064
;2016-06-26 00:34;0;0;"Me hubiese gustado conocer a #RamseyBolton hubiesemos congeniado en seguida, teníamos tanto en común sobre como torturar a gente que odiamos";;;#RamseyBolton;"746834001189535752";https://twitter.com/aaylahurst/status/746834001189535752
;2016-06-26 00:20;0;0;"J'aime mes copines jusqu'à la lune le premier qui leur fait du mal et je me transforme en Ramsey Bolton . Haha vous faites moi les malins";;;;"746830513638367236";https://twitter.com/cpltlyalice/status/746830513638367236
;2016-06-26 00:19;0;1;"Penny nin bitmesi üzücü haber ama ramsey bolton un tahtalı köyü hakettiği gibi boylaması güzel haber,Game of Thrones a gelince;";;;;"746830188932108288";https://twitter.com/sisisimgesi/status/746830188932108288
;2016-06-25 23:53;57;11;"Ptdrrrr les gamins, ça subli Ramsey Bolton https:// twitter.com/Quotes_PS/stat us/746821536863092736 …";;;;"746823618433253376";https://twitter.com/Jaunehomme/status/746823618433253376
;2016-06-25 23:39;0;0;"Not this way Croatia. Not to Portugal. Well, like Ramsey Bolton , I guess the Portuguese have plot armor for a reason. Let's go Poland!";;;;"746820193721126912";https://twitter.com/KevlonDon21/status/746820193721126912
;2016-06-25 23:21;0;2;"Ramsey Bolton is actually Satan.";;;;"746815504430489600";https://twitter.com/HebaAbdel/status/746815504430489600
;2016-06-25 23:05;2;8;"Totalmente de acuerdo. Como Ramsey Bolton , de Game of Thrones. De los mejores malos q he visto!! Así da gusto! https:// twitter.com/elphie_green/s tatus/746794731212943360 …";;;;"746811462698602498";https://twitter.com/evalmaya/status/746811462698602498
;2016-06-25 22:34;0;1;"I KEEP THINKING UR TALKING ABOUT RAMSEY BOLTON";;;;"746803727433105408";https://twitter.com/aceariver/status/746803727433105408
;2016-06-25 22:26;0;8;"I'm opening my mulch Ramsey Bolton style #Winterfell pic.twitter.com/9MJOYZefOj";;;#Winterfell;"746801885638713345";https://twitter.com/harrisg/status/746801885638713345
;2016-06-25 22:26;0;2;"pfff gij moet Ramsey Bolton nog ontmoeten";;;;"746801753241325569";https://twitter.com/BiilalAkbas/status/746801753241325569
;2016-06-25 22:18;0;2;"I knew having a favourite character was a bad idea, missing him already #ramseybolton @iwanrheon #GameofThrones pic.twitter.com/oQI3R6Ood3";;@iwanrheon;#ramseybolton #GameofThrones;"746799699026415617";https://twitter.com/ejikinart/status/746799699026415617
;2016-06-25 21:13;2;4;"A large part of the problem is people think Boris is Tyrion Lannister. When actually he's Ramsey Bolton .";;;;"746783419322011648";https://twitter.com/david_hewson/status/746783419322011648
;2016-06-25 20:56;0;0;"Reminded me with what Jon Snow said to Ramsey Bolton https:// twitter.com/kokochenaDasht i/status/746770612287344640 …";;;;"746779232609669120";https://twitter.com/alaabenk98/status/746779232609669120
;2016-06-25 20:44;4;12;"Helen Thomas would've flayed him so badly Ramsey Bolton would get aroused. https:// twitter.com/georgefenneman /status/746761593426305025?s=09 …";;;;"746775970821046273";https://twitter.com/jaykirell/status/746775970821046273
;2016-06-25 20:32;0;3;"Carai, Ramsey Bolton morreu bonito";;;;"746773147907678208";https://twitter.com/renataraujos8/status/746773147907678208
;2016-06-25 20:13;0;2;"Donald Trump, ese Ramsey Bolton .";;;;"746768252638986242";https://twitter.com/antonlado/status/746768252638986242
;2016-06-25 20:02;0;1;"@MaverickMiss29 abhishek= ramsey Bolton ?";;@MaverickMiss29;;"746765462717923328";https://twitter.com/uniquechapdj/status/746765462717923328
;2016-06-25 19:51;0;0;"Jedes mal, wenn der Kommentator " Ramsey " sagt, zucke ich ängstlich zusammen. Bolton , wo?";;;;"746762655919149057";https://twitter.com/SPN_Suchti/status/746762655919149057
;2016-06-25 19:46;0;2;"Ramsey Bolton is just a hair less loathsome than Dolores Umbridge and that's saying something";;;;"746761583951413248";https://twitter.com/RachelWalker29/status/746761583951413248
;2016-06-25 19:44;0;0;"Someone created a Ramsey Bolton tribute video. https:// youtu.be/JAgIurld4ig #GameofThrones";;;#GameofThrones;"746761098414661632";https://twitter.com/SIDrunks/status/746761098414661632
;2016-06-25 19:35;0;2;"Ramsey joue à Bolton ? #WALNIR";;;#WALNIR;"746758823818436608";https://twitter.com/Binouite/status/746758823818436608
;2016-06-25 19:32;1;0;"lol the only Ramsey we acknowledge is Ramsey Bolton";;;;"746757862916001792";https://twitter.com/ike__jr/status/746757862916001792
;2016-06-25 19:31;0;0;"When you're watching footy and your brains playing a game lol.... Bale...Christian.... Ramsey .... Bolton .....dallas...cowboys etc";;;;"746757690043531264";https://twitter.com/coxyhockeychick/status/746757690043531264
;2016-06-25 19:24;1;0;"#WALNIR every time commentator says ' Ramsey ' I have to follow it with ' Bolton ' #EURO2016 #gameofthrones @iwanrheon";;@iwanrheon;#WALNIR #EURO2016 #gameofthrones;"746756014687535104";https://twitter.com/samalamaloo/status/746756014687535104
;2016-06-25 18:52;0;1;"I knew there was a reason I loved dogs!!! #RamseyBolton #CouldntHappenToANicerGuy #GOT";;;#RamseyBolton #CouldntHappenToANicerGuy #GOT;"746748016481177600";https://twitter.com/dieselkeds/status/746748016481177600
;2016-06-25 18:51;1;1;"Mn frr il a tapé un kill a l'arc from across the map, il a renommé son gamertag en " Ramsey _ Bolton _du72"";;;;"746747587156389888";https://twitter.com/dandydesdadas/status/746747587156389888
;2016-06-25 18:42;2;6;"I've just seen Ramsey Bolton at Glastonbury with the biggest gurn the north has ever seen #GoT #glastonbury";;;#GoT #glastonbury;"746745472199593984";https://twitter.com/fictiontwittson/status/746745472199593984
;2016-06-25 18:35;0;0;"Joffrey Baratheon, Ramsey Bolton , The Wraith, The Masters, The Khals.....pretty much sums it up... http:// fb.me/2dlrywZq2";;;;"746743535269863426";https://twitter.com/facepbb/status/746743535269863426
;2016-06-25 18:31;0;1;"So Ramsey Bolton just raped Sansa... Jesus. #GameofThrones Episode 7 next. BRB though.";;;#GameofThrones;"746742663479697408";https://twitter.com/Tehsupercow/status/746742663479697408
;2016-06-25 18:30;1;1;"Ramsay Bolton >>> aaron Ramsey";;;;"746742250219184128";https://twitter.com/TheIcemann7/status/746742250219184128
;2016-06-25 18:28;0;0;"¿Maduro necesita tal justicia divina como la de Ramsey Bolton o una redención al estilo Jammie Lannister? #GOT . https:// twitter.com/el_pais/status /746732082420908033 …";;;#GOT;"746741784139735040";https://twitter.com/marianohabla/status/746741784139735040
;2016-06-25 18:25;2;1;"Ramsey c'est pas le mec qui joue a Bolton ? #GALIRN";;;#GALIRN;"746741181275574273";https://twitter.com/Urawa_Red/status/746741181275574273
;2016-06-25 18:23;0;1;"Seria divertido se um dos Ramsey de País de Gales jogasse no Bolton . #GameofThrones #EURO2016";;;#GameofThrones #EURO2016;"746740714986442756";https://twitter.com/lukerider/status/746740714986442756
;2016-06-25 18:22;0;1;"Why is it every time I hear Ramsey I automatically think of Ramsay Bolton . What have you done to me GoT...";;;;"746740297036611584";https://twitter.com/ryfcb/status/746740297036611584
;2016-06-25 18:19;0;1;"Ramsey Bolton igra za Wales. Ma kad vam kažem!";;;;"746739485157769216";https://twitter.com/gaurmyrnnemanja/status/746739485157769216
;2016-06-25 18:01;4;2;"Ramsey Bolton and Brienne pic.twitter.com/yRm1QofStl";;;;"746735140026617856";https://twitter.com/iwanandniall/status/746735140026617856
;2016-06-25 18:00;7;7;"Ramsey Bolton est l'un des meilleurs personnages de Game Of Thrones";;;;"746734934086324224";https://twitter.com/gwadaveli/status/746734934086324224
;2016-06-25 17:53;2;0;"En tout cas dans la saison 6 de GOT mes persos préférés sont : - Ramsey Bolton - Jon Snow - Daenerys ou Cersei";;;;"746732968346009601";https://twitter.com/gwadaveli/status/746732968346009601
;2016-06-25 17:51;0;3;"But, Sansa never heard that, she left before Ramsey mentioned it (when she said "you're going to die tomorrow Lord Bolton , sleep well").";;;;"746732591311552513";https://twitter.com/TocinoSaurio/status/746732591311552513
;2016-06-25 17:49;0;2;"I really like Ramsey Bolton";;;;"746731932340281345";https://twitter.com/PilosopoDeo/status/746731932340281345
;2016-06-25 17:47;12;6;"L'acteur qui joue Ramsey Bolton va incarner le rôle d'Hitler j'ai hate de voir ça";;;;"746731675023978497";https://twitter.com/gwadaveli/status/746731675023978497
;2016-06-25 17:42;5;4;"#ifGOTwasinHindi Battle of Bastards like Salman Khan VS SRK and Guess Who Wins??? @LordSnow @RamseyBolton Cc: @DilliBelle @NeerajT4 #GOT";;@LordSnow @RamseyBolton @DilliBelle @NeerajT4;#ifGOTwasinHindi #GOT;"746730283697766400";https://twitter.com/iamTailor/status/746730283697766400
;2016-06-25 17:42;0;0;"Error: @aurelionuno nada tiene que ver con Ramsey Bolton ; en todo caso es más parecido a Jon Snow. #GameofThrones https:// twitter.com/emeequis/statu s/746712167177719808 …";;@aurelionuno;#GameofThrones;"746730215129243648";https://twitter.com/FMorenoMayoral/status/746730215129243648
;2016-06-25 17:23;0;1;"you mean to tell me Ramsey Bolton is spawn of Gollum? Seems legit";;;;"746725449305362432";https://twitter.com/Eboni_Burke/status/746725449305362432
;2016-06-25 16:57;0;1;"I rather like Ramsey Bolton . Does this make me a bad person? #GameofThrones CC: @iwanrheon";;@iwanrheon;#GameofThrones;"746719026915741696";https://twitter.com/Tehsupercow/status/746719026915741696
;2016-06-25 16:51;0;1;"He is marrying Ramsey Bolton .";;;;"746717336044994561";https://twitter.com/PHISHpointO/status/746717336044994561
;2016-06-25 16:47;1;1;"Mano.. bate uma fome maior que os cães de Ramsey Bolton depois de 7 dias sem comer..";;;;"746716381404598272";https://twitter.com/jerffesonDsilva/status/746716381404598272
;2016-06-25 16:31;1;2;"#GameofThrones #RamseyBolton #sansa #johnsnow Can't get enough ^^. Last episode already comming :( pic.twitter.com/TiKHlRDuaW";;;#GameofThrones #RamseyBolton #sansa #johnsnow;"746712513987895296";https://twitter.com/iJustBart/status/746712513987895296
;2016-06-25 16:26;0;0;"Ramsey Bolton في Game of thrones هو أكتر شخصية Villain اقنعتني و شدتني ليها بعد شخصية Joker في The Dark Knight ! أداء جميل جدا فعلا يعني !";;;;"746711052600115200";https://twitter.com/i4344/status/746711052600115200
;2016-06-25 16:10;1;1;"the UK deserves the bastard child of Joffrey and Ramsey Bolton (lol GoT reference)";;;;"746707229663985664";https://twitter.com/UKIPBIackpool/status/746707229663985664
;2016-06-25 16:09;0;1;"'s Bolton comment - I have a crush on Iwan Rheon because of Misfits, so naked Ramsey in GOT is confusing for me lol";;;;"746706852319100928";https://twitter.com/Megan_NerdNest/status/746706852319100928
;2016-06-25 16:08;5;21;"When you realise @iwanrheon clean up real nice #RamseyBolton #GameofThrones pic.twitter.com/0oNsPpiSjk";;@iwanrheon;#RamseyBolton #GameofThrones;"746706717400924160";https://twitter.com/Omzi_de/status/746706717400924160
;2016-06-25 16:03;0;1;"De game of thrones aprendí que no debo caer en las provocaciones de Ramsey Bolton , o puedo comprometer mi victoria.";;;;"746705482811838464";https://twitter.com/Le_Amayin/status/746705482811838464
;2016-06-25 15:59;1;1;"draw me Ramsey Bolton on a horse carrying the Bolton banner";;;;"746704384176840704";https://twitter.com/YeAlx/status/746704384176840704
;2016-06-25 15:10;0;2;"Ramsey Bolton gets the windings giant pregnant.";;;;"746692164093100032";https://twitter.com/kieronmurph/status/746692164093100032
;2016-06-25 14:35;7;4;"After MEPs denied a hearing on Article 50, it'll be like that scene with Ramsey Bolton and the starving dogs. https:// twitter.com/NvOndarza/stat us/746678801455812608 …";;;;"746683309644713984";https://twitter.com/tom_nuttall/status/746683309644713984
;2016-06-25 13:42;0;1;"At a gameofthrones party, we burn Joffrey and Ramsey . #gameofthrones #joffrey #ramseybolton … https://www. instagram.com/p/BHE4AFAAf4I/";;;#gameofthrones #joffrey #ramseybolton;"746669851498909696";https://twitter.com/Jessfrica/status/746669851498909696
;2016-06-25 13:31;0;0;"Joffrey Baratheon v Ramsey Bolton . #Who did you hate more? GAME OF THRONES";;;#Who;"746667087947505664";https://twitter.com/EamonMugalu/status/746667087947505664
;2016-06-25 13:28;0;0;"Can't even lie this June was freaking fast. Wasn't it just yesterday Ramsey Bolton was getting his face smashed in?";;;;"746666296775970816";https://twitter.com/Femidaime/status/746666296775970816
;2016-06-25 13:27;1;1;"In my book of shudders there will never be a more believable villain than Ramsey Bolton weuh! Mad mad acting.";;;;"746666033214328836";https://twitter.com/kenyanisa/status/746666033214328836
;2016-06-25 13:11;0;6;"Game of thrones spoiler alert, Ramsey bolton is alive, he strolled past me at glasto";;;;"746661984138059776";https://twitter.com/TomOwen93/status/746661984138059776
;2016-06-25 12:42;0;0;"Tokes should throw a party when Ramsey Bolton finally dies it really is something to celebrate";;;;"746654782056701952";https://twitter.com/Ge0rgieeL/status/746654782056701952
;2016-06-25 12:03;0;1;"Hammer Typ! #GameofThrones @iwanrheon #RamseyBolton #dogfood https:// twitter.com/iwanrheon/stat us/745216333269327872 …";;@iwanrheon;#GameofThrones #RamseyBolton #dogfood;"746645009965912065";https://twitter.com/MarvMaster94/status/746645009965912065
;2016-06-25 11:44;0;1;"TOMORROW NIGHT! Time to get as nerdy as Samwell Tarly and as ruthless as Ramsey Bolton , our Game of Thrones quiz! pic.twitter.com/ES2jVxcJpG";;;;"746640248315207680";https://twitter.com/FruitSpaceHull/status/746640248315207680
;2016-06-25 11:40;0;0;"@MarillaReich Wie endete der Bastard Ramsey Bolton ? Wer B sagt, propagiert daß Bastarde von den Hunden gefressen werden.";;@MarillaReich;;"746639139957784576";https://twitter.com/Hessenhenker/status/746639139957784576
;2016-06-25 10:20;0;1;"Ramsey scores, Ramsay bolton dies";;;;"746619106447753216";https://twitter.com/rijesh123456/status/746619106447753216
;2016-06-25 10:02;0;2;"I used to like Ramsey Bolton because of his craziness but episode 6.9 made me change my mind";;;;"746614539127488512";https://twitter.com/NathanielScz/status/746614539127488512
;2016-06-25 09:27;0;3;"I no Britain has gone to shit and all... But at least Ramsey Bolton is finally dead";;;;"746605713238138880";https://twitter.com/maisiewalsh/status/746605713238138880
;2016-06-25 08:59;0;1;"Oh, you've given away the fact that Ramsey Bolton cops a fatal face full of 7 day starved hounds! decorum please!";;;;"746598716493049856";https://twitter.com/thegregfleet/status/746598716493049856
;2016-06-25 08:48;0;0;"Ramsey Bolton for lunch anyone lol? Finally that jerk is dead! #GameofThrones Jon beat the crap out of him hahaha.";;;#GameofThrones;"746596029982662656";https://twitter.com/theespnhater/status/746596029982662656
;2016-06-25 07:03;0;1;"Never thought I could hate a human more than I hated Ramsey Bolton https:// twitter.com/nigganarration /status/746562593872052224 …";;;;"746569383628025857";https://twitter.com/Hai_Cheo/status/746569383628025857
;2016-06-25 06:33;0;3;"#GameofThrones In light of the season finale..may I ask that you bring Ramsey Bolton back to life just so he can be killed again? Please?";;;#GameofThrones;"746561810082340865";https://twitter.com/DianeBarvels/status/746561810082340865
;2016-06-25 06:30;1;4;"I could watch Ramsey Bolton die every day of my life";;;;"746561230601494528";https://twitter.com/tsartor12/status/746561230601494528
;2016-06-25 06:25;0;1;"I believe that would've been Ramsey Bolton . late of Winterfell's back yard. pic.twitter.com/BccqxTlcnB";;;;"746559819176382464";https://twitter.com/MorgonGrogg/status/746559819176382464
;2016-06-25 05:50;0;1;"As vezes eu entendo pq o Ramsey Bolton matava as pessoas";;;;"746551156634173440";https://twitter.com/wtfangi/status/746551156634173440
;2016-06-25 05:45;0;2;"Jon Snow kills Ramsey Bolton . Wun Wun dies. You're an idiot for not watching this show earlier.";;;;"746549741941489665";https://twitter.com/zweismiller9/status/746549741941489665
;2016-06-25 05:29;1;1;"I have the will power of Ramsey Bolton 's hungry dog when it comes to a night out xxxx";;;;"746545751027744768";https://twitter.com/joejth/status/746545751027744768
;2016-06-25 05:05;0;1;"Who do you hate more. King Joffery or Ramsey Bolton ?";;;;"746539877068603394";https://twitter.com/JasonCARDS/status/746539877068603394
;2016-06-25 04:57;0;4;"Oh god, why can't people differentiate between characters and actors. Ramsey Bolton fangirls...no...just...no...You mean Iwan Rheon is cool";;;;"746537750640340992";https://twitter.com/haleythewarrior/status/746537750640340992
;2016-06-25 04:53;0;1;"Omg I’m dying!!! Watching Ramsey Bolton all cheery and happy having to pretend to be a gymnast #vicious";;;#vicious;"746536655679537152";https://twitter.com/thekat0711/status/746536655679537152
;2016-06-25 04:40;0;0;"Omfg Ian Mckellon as a catty queen in Vicious is hysterical!! And OMFG Ramsey Bolton is nice!!!";;;;"746533519732670464";https://twitter.com/thekat0711/status/746533519732670464
;2016-06-25 04:35;0;2;"I don't know what to think of my being sad that a certain character doesn't die. Is Ramsey Bolton a part of me now as well??";;;;"746532207766867969";https://twitter.com/pausiu/status/746532207766867969
;2016-06-25 04:34;4;4;"#China to me is like #Bolton and will have same ending #BoycottChineseProducts #ChinaExposed #RamseyBolton #gameofthrones obstructing #INDIA";;;#China #Bolton #BoycottChineseProducts #ChinaExposed #RamseyBolton #gameofthrones #INDIA;"746531879663341568";https://twitter.com/viragpant/status/746531879663341568
;2016-06-25 04:12;0;0;"Like Jon Snow bastard or Ramsey Bolton bastard? Important.";;;;"746526560786743296";https://twitter.com/alexis_b82/status/746526560786743296
;2016-06-25 04:02;0;0;"Agora que assisti Ramsey Bolton morrer violentamente comido pelos próprios catioros, estou mais que pronta para ter uma óptima noite de sono";;;;"746524043193516032";https://twitter.com/Drosofilismo/status/746524043193516032
;2016-06-25 03:38;0;0;"and he looks like Ramsey Bolton from Game of Thrones and is probably just as evil and sadistic https:// twitter.com/igorvolsky/sta tus/746507374974820352 …";;;;"746517827046236160";https://twitter.com/themarin/status/746517827046236160
;2016-06-25 03:31;0;2;"Deseé una peor muerte para #RamseyBolton pero devorado por perros también fue gratificante #GameofThrones pic.twitter.com/r3HP2o2Fab";;;#RamseyBolton #GameofThrones;"746516088205250561";https://twitter.com/AndrekSure/status/746516088205250561
;2016-06-25 03:30;25;24;"El Subco Galeano compara a Nuño con Ramsey Bolton : “caerás y la memoria de ti desaparecerá” http:// goo.gl/DA5GQW pic.twitter.com/EoimIKoQvS";;;;"746515833959157760";https://twitter.com/emeequis/status/746515833959157760
;2016-06-25 02:27;0;0;"Si Ramsey Bolton gud raba akong favorite character pero namatay naman gud siya hahaha";;;;"746500086931173376";https://twitter.com/EsmenaErvin/status/746500086931173376
;2016-06-25 02:27;0;1;"oooooooh!!!! That was a good fight too but I think I liked this one because it was against Ramsey Bolton ! Dude had to go!";;;;"746500079758958593";https://twitter.com/Lucena21/status/746500079758958593
;2016-06-25 02:16;0;1;"Jon snow is boring. I love Ramsey Bolton !!!! Viva la bolts!!!!!";;;;"746497238738812928";https://twitter.com/markoshea03/status/746497238738812928
;2016-06-25 01:12;0;1;"Já einmitt, ég ætla bara láta einsog ekkert sé og hlusta tónlistina þín, Ramsey ! #GameofThrones #RamseyBolton https:// twitter.com/iwanrheon/stat us/743032055278243840 …";;;#GameofThrones #RamseyBolton;"746481065888473089";https://twitter.com/ingvirafn/status/746481065888473089
;2016-06-25 01:07;0;1;"When you and your sister both admit to having a crush on Ramsey Bolton oops";;;;"746479946688667649";https://twitter.com/_gwennie/status/746479946688667649
;2016-06-25 01:07;0;0;"There's something rly messed up about casting someone as beautiful as @iwanrheon as someone as awful as Ramsey Bolton";;@iwanrheon;;"746479906872233984";https://twitter.com/marg000/status/746479906872233984
;2016-06-25 01:07;1;0;"| Sean bonitos y tráiganle a Valeria un Ramsey Bolton !! https:// twitter.com/ohanarole/stat us/746478887215972353 …";;;;"746479770204934145";https://twitter.com/mysticxlwolf/status/746479770204934145
;2016-06-25 01:04;0;1;"ramsey bolton : um gato nao vou negar";;;;"746479097237377024";https://twitter.com/GiiSilveira/status/746479097237377024
;2016-06-25 01:01;0;1;". @iwanrheon ( Ramsey Bolton ) is a hell of a musician. His album "Dinard" is excellent. Well done bastard!";;@iwanrheon;;"746478340924637184";https://twitter.com/rtaff104/status/746478340924637184
;2016-06-25 00:58;0;1;"GOT 6.sezon 9.bölüm 'Piçlerin savaşı'ında John Snow ve Ramsey Bolton arasındaki savaş sahneleri en baba tarihi savaş filmlerinde yok,müthiş!";;;;"746477542413045760";https://twitter.com/Sbasbahcivan/status/746477542413045760
;2016-06-25 00:56;0;0;"Wore the wrong socks with my new shoes, and now my heels look like they got on the wrong side of Ramsey Bolton";;;;"746477075087892481";https://twitter.com/anthony9187/status/746477075087892481
;2016-06-25 00:53;0;1;"@lajefacoc jaja es puto ramsey bolton traidor @xenold10";;@lajefacoc @xenold10;;"746476369568108544";https://twitter.com/luis31z/status/746476369568108544
;2016-06-25 00:27;1;1;"That facial expression #GoT #RamseyBolton pic.twitter.com/SyI18t7OJO";;;#GoT #RamseyBolton;"746469808233906176";https://twitter.com/PeterBen/status/746469808233906176
;2016-06-25 00:25;0;2;"Uzun zamandır böyle coştuğum bir bölüm olmamıştı. Ayakta izledim AQ. OÇ Ramsey Bolton tam hak ettiği şekilde geberdi. #GameofThrones #S06E09";;;#GameofThrones #S06E09;"746469383950712836";https://twitter.com/dogan_kelleci/status/746469383950712836
;2016-06-25 00:22;1;0;"Quand Ramsey Bolton sourit juste avant de lâcher ses chiens sur qq, la vie jai des frissons dans le dos";;;;"746468640908845056";https://twitter.com/KenZbdn/status/746468640908845056
;2016-06-25 00:21;4;1;"Ça parle de psychopathe et il y a pas Ramsey Bolton ? Que Dieu vous pardonne cet offense... https:// twitter.com/ylodbrok/statu s/729370383246315526 …";;;;"746468334569390080";https://twitter.com/KenZbdn/status/746468334569390080
;2016-06-24 23:58;0;0;"Episode 9 of GOT!!! Lawd!!! Ramsey Bolton is a weist!! Worse dn jofrey! If Jon suffocates to death ehn!!! #GOT #gameofthrones #kitharrington";;;#GOT #gameofthrones #kitharrington;"746462582530244609";https://twitter.com/koaniichi/status/746462582530244609
;2016-06-24 23:53;0;0;"Ramsey Bolton was such a great character. @iwanrheon did such a fabulous job of making everyone hate his guts. Perfect fit for the role.";;@iwanrheon;;"746461261236416512";https://twitter.com/Lulunananaaaaaa/status/746461261236416512
;2016-06-24 23:41;0;3;"The Ramsey Bolton Pop figure was on clearance at Game Stop and I couldn't help but giggle.";;;;"746458342386606081";https://twitter.com/SamdestroysCs/status/746458342386606081
;2016-06-24 23:30;4;3;"...cambiando de tema: los Bolton son todos muy muy MUY MALOS, pero recordad siempre que Ramsey Bolton NO ES EL PEOR. http:// fb.me/16XDfMbIY";;;;"746455371653447680";https://twitter.com/jfcasasruiz/status/746455371653447680
;2016-06-24 23:06;0;2;"jean wyllys fez textão sobre a piada do MST - Jon Snow - Ramsey Bolton às vezes é difícil.";;;;"746449433638862848";https://twitter.com/ronnieromanini/status/746449433638862848
;2016-06-24 23:01;0;0;"Sentir paz es por fin darte cuenta, de repente, que Ramsey Bolton salía en Misfits.";;;;"746448185992699905";https://twitter.com/yosoysergio/status/746448185992699905
;2016-06-24 22:56;0;1;"i live your nose :) ps I now too fancy ramsey bolton";;;;"746446865630175232";https://twitter.com/Kimberleymakado/status/746446865630175232
;2016-06-24 22:55;0;2;"You'll hate me for this @SineadHus but I'd rather be fed to Ramsey Bolton 's dogs https:// twitter.com/sineadhus/stat us/746445673785081856 …";;@SineadHus;;"746446590093697024";https://twitter.com/paraicgallagher/status/746446590093697024
;2016-06-24 22:51;3;2;"Prima di pregare in aramaico per la morte di Ramsey Bolton e Joffrey Baratheon c'era lei, Lucrezia Van Necker. #elisadirivombrosa";;;#elisadirivombrosa;"746445645456805889";https://twitter.com/xWinterGirl/status/746445645456805889
;2016-06-24 22:40;0;0;"Ramsey Bolton là ! Il est terrrrriiible hein ! https:// twitter.com/jamjefraser/st atus/745601897608921088 …";;;;"746442880097595392";https://twitter.com/LaurianneTGF/status/746442880097595392
