username;date;retweets;favorites;text;geo;mentions;hashtags;id;permalink
;2016-06-24 22:35;1;0;"I would rather vote for Voldemort, Saruman AND Ramsey Bolton than anyone of the above!";;;;"746441598674821120";https://twitter.com/laurens19287/status/746441598674821120
;2016-06-24 22:28;0;0;"Trump, House, Mourinho, Ramsey Bolton .. My type of guys";;;;"746439881463848960";https://twitter.com/Bhheast/status/746439881463848960
;2016-06-24 22:19;0;1;"*spoiler alert* Ramsey Bolton "s death was beatiful #GameofThrones #BattleOfTheBastards";;;#GameofThrones #BattleOfTheBastards;"746437728234053632";https://twitter.com/MmililiM/status/746437728234053632
;2016-06-24 22:14;0;4;"So fitting what happens to Ramsey Bolton #GameofThrones";;;#GameofThrones;"746436335074951168";https://twitter.com/DeclanTonner/status/746436335074951168
;2016-06-24 22:06;0;2;"Did you guys know Ramsey Bolton has an acoustic album & it’s really cute";;;;"746434366377590784";https://twitter.com/MaeganDeeble/status/746434366377590784
;2016-06-24 22:04;0;0;"ramsey bolton trying to find a new job after got pic.twitter.com/I1RDnLBu3R";;;;"746433849878523904";https://twitter.com/forgatlas/status/746433849878523904
;2016-06-24 21:53;30;19;"El Subco Galeano compara a Nuño con Ramsey Bolton : “caerás y la memoria de ti desaparecerá” http:// goo.gl/DA5GQW pic.twitter.com/V00syPzSmj";;;;"746431011467177984";https://twitter.com/emeequis/status/746431011467177984
;2016-06-24 21:53;0;1;"Just watched Mondays Game of Thrones and I'm so gutted about Ramsey Bolton";;;;"746430968857255936";https://twitter.com/emmajanesmith4/status/746430968857255936
;2016-06-24 21:22;0;0;"Catching up on #GameofThrones . Jon Snow is fighting tooth and nail, meanwhile Ramsey Bolton 's manicure is still intact.";;;#GameofThrones;"746423268492484608";https://twitter.com/DanielIeBelisle/status/746423268492484608
;2016-06-24 21:20;0;5;"--fantasy that include Ramsey Bolton , but is legit one of the most adorable humans alive. I cannot handle his tiny little laugh.";;;;"746422678739812352";https://twitter.com/BriannaShrum/status/746422678739812352
;2016-06-24 21:11;0;4;"If uv seen Iwan Rheon in misfits u can't hate Ramsey Bolton";;;;"746420604799225856";https://twitter.com/ColmDaly/status/746420604799225856
;2016-06-24 21:08;0;1;"This week started off so well with the death of Ramsey Bolton . It ends in tragedy with the death of the EU. #BREXIT #GameofThrones";;;#BREXIT #GameofThrones;"746419713211662336";https://twitter.com/HappyHollows/status/746419713211662336
;2016-06-24 21:04;1;3;"@VampireHeart69 Ville is rockin #RamseyBolton locks lol";;@VampireHeart69;#RamseyBolton;"746418620889239552";https://twitter.com/StJaneen/status/746418620889239552
;2016-06-24 20:56;0;1;"Is it just me or has the world become game of thrones esque with Nigel farage the Ramsey Bolton character - maybe I'm just to obsessed!!";;;;"746416739739664385";https://twitter.com/CrawleyKenny/status/746416739739664385
;2016-06-24 20:47;0;3;"Just seen Ramsey Bolton";;;;"746414535607721984";https://twitter.com/_SophWright/status/746414535607721984
;2016-06-24 20:27;1;2;"I see #gameofthrones everywhere. This water bottle top is apparently loyal to Ramsey Bolton . #StarkForever pic.twitter.com/yENy7A2WMe";;;#gameofthrones #StarkForever;"746409536622190592";https://twitter.com/thenonconsumer/status/746409536622190592
;2016-06-24 20:27;0;6;"Quisiera ser Ramsey Bolton para que me eches los perros.";;;;"746409457240793088";https://twitter.com/El_Mayo_Monero/status/746409457240793088
;2016-06-24 20:23;6;12;"Not so scarry ! @iwanrheon @GameOfThrones @Vicious #got #GameofThrones #ramseybolton pic.twitter.com/GvqftIZ1jZ";;@iwanrheon @GameOfThrones @Vicious;#got #GameofThrones #ramseybolton;"746408334589296640";https://twitter.com/juliedltg/status/746408334589296640
;2016-06-24 20:20;0;0;"Extraño a Ramsey Bolton , ya lo dije, venga, dejen de seguirme.";;;;"746407767653519362";https://twitter.com/hadrianmo/status/746407767653519362
;2016-06-24 20:06;4;14;"Att: Ramsey Bolton . https:// twitter.com/_Duendecito/st atus/746403979123392512 …";;;;"746404241028358144";https://twitter.com/JulianDGH/status/746404241028358144
;2016-06-24 19:49;0;0;"Anyone else slowly realising that they're gonna miss Ramsey Bolton ? He was sick, twisted and evil. But I did love to hate him";;;;"746399761528389632";https://twitter.com/playwithfire_90/status/746399761528389632
;2016-06-24 19:28;1;5;"ramsey bolton öldü mü ıssız winterfell kaldı mı jon snow öcün aldı mı şimdi ürek yırtılır";;;;"746394660449492992";https://twitter.com/bernaltintepe/status/746394660449492992
;2016-06-24 19:28;0;1;"Oh and if anyone has forgotten, Ramsey Bolton is dead af finally...";;;;"746394609866006528";https://twitter.com/KKsquires2/status/746394609866006528
;2016-06-24 19:19;0;2;"The Philippine military could learn a great deal from Ramsey Bolton 's tactics ok";;;;"746392220043874307";https://twitter.com/vlthea/status/746392220043874307
;2016-06-24 19:14;1;3;"Damn bastard. #gamesofthrones #ramseybolton pic.twitter.com/kjUR9LWfGS";;;#gamesofthrones #ramseybolton;"746391001300799492";https://twitter.com/lotrgirl_305/status/746391001300799492
;2016-06-24 19:11;2;3;"it's calm anyway i'm going zambia to breed an army of weaponised hyenas like ramsey bolton";;;;"746390181247352832";https://twitter.com/griezmanni/status/746390181247352832
;2016-06-24 19:05;0;1;"We finally got shot of Ramsey Bolton at the weekend and now this. pic.twitter.com/IVwVqVcdvS";;;;"746388684535107584";https://twitter.com/Matt__Ray/status/746388684535107584
;2016-06-24 19:03;0;0;"Ever since Jon Snow beat Ramsey Bolton and LeBron won the championship, I've been living on cloud 9.";;;;"746388369375133696";https://twitter.com/Doc_Jedi/status/746388369375133696
;2016-06-24 19:01;0;0;"Ramsey Bolton na vida real parece o Marco Pigossi versão malvada";;;;"746387699997753344";https://twitter.com/amarialmeida/status/746387699997753344
;2016-06-24 18:59;0;0;"Awwwn.....sorry dear, get well soon. The pain will pass....just like ramsey bolton , something to cheer u up pic.twitter.com/1kF6VVOfCG";;;;"746387178276651012";https://twitter.com/ozemede/status/746387178276651012
;2016-06-24 18:37;1;4;"Remember when Ramsey Snow became Ramsey Bolton ? When Jon Snow becomes Jon Targaryen it's gonna be SO LIT. #GameOfThrones";;;#GameOfThrones;"746381724876079104";https://twitter.com/DRusso97/status/746381724876079104
;2016-06-24 18:30;1;0;"This is totally the kind of jerk move Ramsey Snow, er, Bolton , would have pulled. #WWTTMarketing http:// ow.ly/fOgs301B8hg";;;#WWTTMarketing;"746380007161860096";https://twitter.com/TargetMktg/status/746380007161860096
;2016-06-24 18:20;0;1;"Ramsey Bolton you will be missed..";;;;"746377531159363584";https://twitter.com/NazNosheen/status/746377531159363584
;2016-06-24 18:18;0;0;"Y Ramsey Boltón le partió la madre a Jon Snow (?) https:// twitter.com/hramosallup/st atus/746344315077668864 …";;;;"746376876642308096";https://twitter.com/sambeethoven/status/746376876642308096
;2016-06-24 18:17;0;0;"Ramsey Bolton absolutely smashing it here with his backing dancers @BBCR1 https:// twitter.com/BBCR1/status/7 46336568214884353 …";;@BBCR1;;"746376792613715968";https://twitter.com/RiseGuide/status/746376792613715968
;2016-06-24 18:16;0;1;"Ramsey Bolton is a dbag. How you gonna have arrows shot at where your own niggas be fighting? Dumbass #got";;;#got;"746376354963152896";https://twitter.com/caramel_anthony/status/746376354963152896
;2016-06-24 18:15;0;0;"Mum didn't buy enough candles for 19, so now my cake looks like Jon Snow being attacked by Ramsey Bolton 's cavalry. pic.twitter.com/lU9rBxT8FR";;;;"746376245026381825";https://twitter.com/issyrayner/status/746376245026381825
;2016-06-24 17:50;0;1;"So the Brexit passed and Trump is the Republican presidential candidate. Well, at least Ramsey Bolton is dead. #spoiler";;;#spoiler;"746369860331016192";https://twitter.com/JimZim534/status/746369860331016192
;2016-06-24 17:45;0;0;"and your own hounds killed you. may you not rest in peace, ramsey bolton";;;;"746368559312343040";https://twitter.com/krispilicious/status/746368559312343040
;2016-06-24 17:40;1;1;"True mate, doesnt look good. At least Ramsey Bolton got what he deserved";;;;"746367315520925696";https://twitter.com/beardo8/status/746367315520925696
;2016-06-24 17:33;0;0;"Haha Yes! This is awesome #GameofThrones / Spongebob Mashup - Ramsey Bolton https:// youtu.be/wVO2mCmSEPU #Got";;;#GameofThrones #Got;"746365601933758464";https://twitter.com/DanOFlorez/status/746365601933758464
;2016-06-24 17:28;2;5;"I WILL be the Ramsey Bolton of sports entertainment. Mark my words! #GoT #BattleOfTheBarstards #GetSome pic.twitter.com/nYAoglqOHk";;;#GoT #BattleOfTheBarstards #GetSome;"746364257890086912";https://twitter.com/The_KenDixon/status/746364257890086912
;2016-06-24 17:04;1;1;"Ramsey bolton cest un reubeu, ca lui propose un un contre un, il ramène une armé.";;;;"746358423814561796";https://twitter.com/sam_KMA/status/746358423814561796
;2016-06-24 16:44;0;0;"#GameOfThrones - Ramsey Bolton delves into singing... http:// bit.ly/28Vuq46 #hfmagazine";;;#GameOfThrones #hfmagazine;"746353210529439745";https://twitter.com/HF_Magazine/status/746353210529439745
;2016-06-24 16:33;1;1;"Nuño, con sed de sangre: EZLN https:// shar.es/1JM0Kq vía @¿Aurelio Ramsey Nuño Bolton ? Toda memoria de ti desaparecerá. #BuenViernes";;@;#BuenViernes;"746350516263784448";https://twitter.com/VipmpGm/status/746350516263784448
;2016-06-24 16:28;0;0;"Ramsey Bolton has to go down in tv history as one of the most savage beings ever #GoT";;;#GoT;"746349208936976384";https://twitter.com/madmadmaven/status/746349208936976384
;2016-06-24 16:02;0;0;"Game Of Thrones Villain, Ramsey Bolton Has A Music Career - http://www. hfmagazineonline.com/game-of-throne s-villain-ramsey-bolton-has-a-music-career/ … pic.twitter.com/NnajiqVNKg";;;;"746342680297246720";https://twitter.com/HF_Magazine/status/746342680297246720
;2016-06-24 15:58;1;4;"Sacarse matemáticas este año ha sido más duro que ser exclavo de Ramsey Bolton";;;;"746341691515342852";https://twitter.com/RocioCastillaa/status/746341691515342852
;2016-06-24 15:57;1;0;"Ramsey Bolton ukno https:// twitter.com/mrtitocee/stat us/746340518704062464 …";;;;"746341572120305665";https://twitter.com/KamLev_11/status/746341572120305665
;2016-06-24 15:53;1;0;"I like Ramsey Bolton . But then again I like @iwanrheon . I still miss Misfits. Bring it back please.";;@iwanrheon;;"746340589755576320";https://twitter.com/Tehsupercow/status/746340589755576320
;2016-06-24 15:52;0;1;"Buenos días a todos, menos a Ramsey Bolton , porque ya esta muerto... pic.twitter.com/K9fzF5ZZlz";;;;"746340098388590593";https://twitter.com/wbalderas/status/746340098388590593
;2016-06-24 15:50;9;39;"I actually think I'd rather have Ramsey Bolton in charge of the UK than Boris Johnson";;;;"746339679486750720";https://twitter.com/PED7/status/746339679486750720
;2016-06-24 15:20;1;1;"@soldierdrake @ZedKosnar La pregunta Por que? A quien le combiene? Lo hacen a proposito. Quien la produce, Ramsey Bolton ?";;@soldierdrake @ZedKosnar;;"746332073384828928";https://twitter.com/Caramonelblanco/status/746332073384828928
;2016-06-24 15:18;0;1;"Que alegriaaaa #GOT !!! Te odioooo Ramsey Bolton !!! Bastardooooo !!!";;;#GOT;"746331758774321152";https://twitter.com/enzo_rapetti/status/746331758774321152
;2016-06-24 15:18;0;1;"Reasoned debate? No, Cameron & Osborne came over all Ramsey Bolton on us. How did the attack dogs work out 4 Ramsey ? pic.twitter.com/hcbDhmmgK7";;;;"746331610929373184";https://twitter.com/whackfrost/status/746331610929373184
;2016-06-24 15:00;0;2;"WIP shots of inking Ramsey Bolton . #battleofthebastards #ramseybolton #gameofthrones #inking … https://www. instagram.com/p/BHCcMmkDg2t/";;;#battleofthebastards #ramseybolton #gameofthrones #inking;"746327238447075328";https://twitter.com/somsesh/status/746327238447075328
;2016-06-24 14:48;1;0;"And Ramsey Bolton has been humiliated and conquered by the stacks, welcome back bro https:// twitter.com/Bawz_D/status/ 746316242433228800 …";;;;"746324034690912256";https://twitter.com/Akolade99/status/746324034690912256
;2016-06-24 14:47;0;1;"@rsuds1310 now he reminds me of Ramsey Bolton , he sure was pissed the other day #jerk";;@rsuds1310;#jerk;"746323865207398400";https://twitter.com/kmfzzz/status/746323865207398400
;2016-06-24 14:47;0;2;"Ramsey Bolton 's not busy, maybe he could lead the tories?";;;;"746323743706845184";https://twitter.com/ElenCaldecott/status/746323743706845184
;2016-06-24 14:38;0;0;". @JuliaHB Yes, Cameron chose to go all Ramsey Bolton on us with his attack dogs, And, as we know, that didn't end well for Ramsey . #euref";;@JuliaHB;#euref;"746321545786761216";https://twitter.com/whackfrost/status/746321545786761216
;2016-06-24 14:37;2;2;"Hey, shame we are out the EU but at least Ramsey Bolton is dead and Hodor held the door. #everycloud #GoT #EUreferendum";;;#everycloud #GoT #EUreferendum;"746321360205520896";https://twitter.com/mike_madness06/status/746321360205520896
;2016-06-24 14:37;0;3;"Belki Ramsey Bolton değildik ama biz de parçalandık";;;;"746321302886162432";https://twitter.com/iyidikyaboyle/status/746321302886162432
;2016-06-24 14:36;0;0;"But the blows John Snow registered on Ramsey Bolton 's face.....Eih Eih Eih #GameofThrones";;;#GameofThrones;"746320997352112128";https://twitter.com/j_agwer9/status/746320997352112128
;2016-06-24 14:29;0;2;"With the Mountain as general enforcer and Ramsey Bolton as foreign secretary - bloody hell!";;;;"746319388672942080";https://twitter.com/NicParkerAuthor/status/746319388672942080
;2016-06-24 14:29;1;2;"At least Ramsey Bolton is dead.";;;;"746319330007203840";https://twitter.com/Shut_Up_Shaun/status/746319330007203840
;2016-06-24 14:16;0;6;"Ramsey Bolton would've voted for Trump. There you have it";;;;"746316088003072000";https://twitter.com/pupusa/status/746316088003072000
;2016-06-24 13:59;0;1;"#GameOfThrones Ramsey Bolton the all time annoying character . @GameOfThrones pic.twitter.com/FF7JrwhtoY";;@GameOfThrones;#GameOfThrones;"746311784890523648";https://twitter.com/Kwaguverah/status/746311784890523648
;2016-06-24 13:50;0;7;"Şöyle tatlış bir adam nasıl ramsey bolton gibi bi karakteri o kadar iyi canlandırabiliyor aklım almıyor pic.twitter.com/eI3yCnZwo6";;;;"746309446377299968";https://twitter.com/gamzelinurr/status/746309446377299968
;2016-06-24 13:45;19;14;"Replacing David Cameron with Boris Johnson is like replacing Joffrey with Ramsey Bolton #GoT pic.twitter.com/paBnCcBCVa";;;#GoT;"746308354591588352";https://twitter.com/MrFootyTips/status/746308354591588352
;2016-06-24 13:43;0;1;"I think I met Ramsey Bolton";;;;"746307863811923968";https://twitter.com/DannnW/status/746307863811923968
;2016-06-24 13:40;1;5;"#bringyourdogtoworkday in a Ramsey Bolton way?";;;#bringyourdogtoworkday;"746306990511689728";https://twitter.com/maryepworth/status/746306990511689728
;2016-06-24 13:30;0;0;"The #mets play with my emotions like they're Ramsey Bolton . Blowing the game and wasting 3 hours of my life which also deprive me of sleep";;;#mets;"746304522377637888";https://twitter.com/EK_III/status/746304522377637888
;2016-06-24 13:24;0;0;"I knew this week was too good to be true after seeing Ramsey Bolton eaten alive by dogs";;;;"746302999065137152";https://twitter.com/TheArtetaM0ney/status/746302999065137152
;2016-06-24 13:20;0;3;"Lady Mormont looking at Ramsey Bolton ! We all understand how she feels! #GameofThrones pic.twitter.com/w2nlymTNLA";;;#GameofThrones;"746302083410825217";https://twitter.com/WeaponXKP21/status/746302083410825217
;2016-06-24 13:13;1;1;"Para Ramsey Bolton el actualizador de Java. La madre que lo...";;;;"746300310738571265";https://twitter.com/hojaenblanco1/status/746300310738571265
;2016-06-24 12:59;0;0;"Conservative Leadership Shortlist: Boris Johnson, Michael Gove, Katie Hopkins, Ramsey Bolton , Kim Jong-un, Negan.";;;;"746296662096777216";https://twitter.com/SisyphusSmiling/status/746296662096777216
;2016-06-24 12:57;1;1;"Scotland leaves and our national flag will become the flayed man. Brexit delivers us into the arms of Ramsey Bolton pic.twitter.com/kGHmCiSV08";;;;"746296181077204992";https://twitter.com/rafiadd/status/746296181077204992
;2016-06-24 12:56;0;1;"Scotland, Donald trump has touched down, please pull a Ramsey Bolton move on him and get rid of the mofo once and for all!!!";;;;"746295944359120896";https://twitter.com/Dee_Tells/status/746295944359120896
;2016-06-24 12:45;0;0;"Ramsey Bolton died too easily. They should have devised about 20 ways to kill him.";;;;"746293069520248832";https://twitter.com/Q_e_w/status/746293069520248832
;2016-06-24 12:25;0;1;"#BattleoftheBastards . All said, Ramsey Bolton was t better strategist n had Jon Snow defeated before t battle began. Morality be damned.";;;#BattleoftheBastards;"746288117016109057";https://twitter.com/Kuldeepcs/status/746288117016109057
;2016-06-24 12:25;1;0;"Boris for PM? I'd rather have Ramsey Bolton , yes he's a psychotic killer but at least you know where you stand with him. #EUref";;;#EUref;"746288074028625921";https://twitter.com/carldogs/status/746288074028625921
;2016-06-24 12:22;0;0;"Feels like am in game of thrones with all this north south divide gonna have fucking Ramsey Bolton I charge of the country fucking the north";;;;"746287450696388609";https://twitter.com/pauldaniels200/status/746287450696388609
;2016-06-24 11:50;0;3;"Caught up with game of thrones and love island now. I'm so glad Ramsey Bolton got savaged and Malin has left";;;;"746279350673211392";https://twitter.com/jrashmore/status/746279350673211392
;2016-06-24 11:46;0;1;"Lol! Yes it is very good the #RamseyBolton is No Longer Holding #Winterfell";;;#RamseyBolton #Winterfell;"746278327883866113";https://twitter.com/sscalise88/status/746278327883866113
;2016-06-24 11:44;0;3;"I think I hate Piscatella and Humphrey as much as I hate Ramsey Bolton if not more";;;;"746277797669244928";https://twitter.com/Sam3ouuul/status/746277797669244928
;2016-06-24 11:30;0;0;"Kadına şiddet uygulayan erkekler Ramsey Bolton 'dan ibret alsınlar. O ne güzel ölümdü öyle yahu...";;;;"746274361632563200";https://twitter.com/komunix/status/746274361632563200
;2016-06-24 11:29;1;5;"Put the phone on Rickon Stark's back and let Ramsey Bolton shoot an arrow at him with the skin on it";;;;"746273998133166080";https://twitter.com/Zatte_Rene/status/746273998133166080
;2016-06-24 11:27;0;2;"I genuinely prefer Ramsey Bolton to Nigel Farage";;;;"746273445541978112";https://twitter.com/JackChatland/status/746273445541978112
;2016-06-24 11:27;1;1;"My late cousin Ramsey Bolton was an animal lover like me.";;;;"746273439892201472";https://twitter.com/rukutaneja/status/746273439892201472
;2016-06-24 11:22;0;1;"THE NORTH HAVE SPOKEN Ramsey Bolton made Winterfell vote out and now the night walkers are gonna fucking fuck us all";;;;"746272338199584768";https://twitter.com/THEPAGH/status/746272338199584768
;2016-06-24 11:20;0;0;"can I have a shout out please, just a 'hello' will do - Farage celebrating on my tv brings back Ramsey Bolton all over again";;;;"746271765777813504";https://twitter.com/ajmawas/status/746271765777813504
;2016-06-24 11:19;0;0;"When I felt happiness that Ramsey Bolton died, I realized how great of an actor @iwanrheon is! He was successful in delivering his character";;@iwanrheon;;"746271484520210433";https://twitter.com/LinahSofi/status/746271484520210433
;2016-06-24 11:13;0;0;"Johnson , gove , ian Duncan. Smith etc, going to smash the north just like the lannisters and Ramsey Bolton did .";;;;"746270087842271232";https://twitter.com/JosephScotland/status/746270087842271232
;2016-06-24 11:11;1;5;"Ramsey Bolton style feed em to the hounds for Nigel Farage please";;;;"746269512090140673";https://twitter.com/lukeytomo/status/746269512090140673
;2016-06-24 11:07;0;0;"It's hard to believe that evil right wing blowhards have the upper hand. It's like real life Ramsey Bolton .";;;;"746268592543531008";https://twitter.com/donaghob/status/746268592543531008
;2016-06-24 10:56;0;0;"I feel like Sansa Stark, going from Cameron to Johnson is like going from Joffrey to Ramsey Bolton #Brexit";;;#Brexit;"746265766417276928";https://twitter.com/AphidOverdo/status/746265766417276928
;2016-06-24 10:38;0;0;"I enjoyed Ramsey Bolton death more than http:// Geoffrey.Game of thrones just got more interesting.Season 6 episode 9.The Starks are back.";;;;"746261135414927360";https://twitter.com/MeoClark/status/746261135414927360
;2016-06-24 10:31;0;2;"If there is a remake please have Ramsey Bolton play Hannibal Lector";;;;"746259381503692800";https://twitter.com/gino_lorico/status/746259381503692800
;2016-06-24 10:29;0;2;"Well at least Ramsey Bolton didn't win";;;;"746258908751216640";https://twitter.com/Ste__r/status/746258908751216640
;2016-06-24 10:23;0;2;"Ramsey Bolton 'un kuzeyi kaybetmesinin hemen ardından ingilterenin AB den çekilmesi manidar bi zamanlama #Brexit";;;#Brexit;"746257455357755392";https://twitter.com/tanselkaracali/status/746257455357755392
;2016-06-24 10:21;0;1;"Quite so. Don't get me started on Ramsey Bolton #RIP All will be well @CoursgeisItsOwnReward";;@CoursgeisItsOwnReward;#RIP;"746256984098353153";https://twitter.com/DevonRanger/status/746256984098353153
;2016-06-24 10:19;2;5;"petition for Joffrey Baratheon or Ramsey Bolton to be the new PM opposed to boris johnson, george osborne or theresa may";;;;"746256472309366784";https://twitter.com/soyaslut/status/746256472309366784
;2016-06-24 10:18;1;1;"I Want 2Hide my head & watch #GameOfThornes instead of seeing these #RamseyBolton type Politicians Play it For Real! #Brexit";;;#GameOfThornes #RamseyBolton #Brexit;"746256222135910400";https://twitter.com/sscalise88/status/746256222135910400
;2016-06-24 10:16;1;1;"Ramsey Bolton running the country seems more appealing rn";;;;"746255592981991426";https://twitter.com/lizzymckibbin/status/746255592981991426
;2016-06-24 10:07;587;535;"Cameron resigning = when Joffrey died and you realise the alternative is Ramsey Bolton .";;;;"746253502964457472";https://twitter.com/JasonDike/status/746253502964457472
;2016-06-24 10:07;1;1;"I'd rather him than Boris. In fact, I'd rather anyone other than Boris, even Ramsey Bolton !";;;;"746253364846014464";https://twitter.com/simonjoshi/status/746253364846014464
;2016-06-24 10:05;0;2;"Oggi ho sognato Ramsey Bolton che mi chiedeva di sposarlo, tutto innamorato";;;;"746252971613298688";https://twitter.com/akvutagawa/status/746252971613298688
;2016-06-24 10:04;2;1;"Nigel Farage and Boris Johnson honestly deserve the same fate as Ramsey Bolton";;;;"746252614728290304";https://twitter.com/MichaelHD11/status/746252614728290304
;2016-06-24 10:02;0;1;"Just waiting for the Knights of the Vail to ride in and save us from Ramsey Johnson I mean Borris Bolton ohhh #Brexit #EURefResults #Boris";;;#Brexit #EURefResults #Boris;"746252088611573760";https://twitter.com/SnookMathew/status/746252088611573760
;2016-06-24 10:00;0;0;"UK leaves EU Pound falls to lowest in decades David Cameron retires Scotland N. Ireland want out Ramsey Bolton dies All in the same week";;;;"746251672314331136";https://twitter.com/SyedRizvi464/status/746251672314331136
;2016-06-24 09:57;0;0;"The thought of Boris Johnson as MP and Donald Trump as president is almost as bad as Ramsey Bolton 's death on game of thrones";;;;"746250990043693056";https://twitter.com/isher92/status/746250990043693056
;2016-06-24 09:48;0;2;"Boris is just like Ramsey Bolton - power at any cost, burn the past and no plan for the future. And he's a bastard. #Brexit";;;#Brexit;"746248733822689280";https://twitter.com/LyinFallon/status/746248733822689280
;2016-06-24 09:37;0;0;"I'd rather spend an evening with Ramsey Bolton than Farage. Guys hit smugness on a new level.";;;;"746245956367155200";https://twitter.com/HarryFrancis95/status/746245956367155200
;2016-06-24 09:22;0;1;"This is the Britain that Ramsey Bolton would've lived in. #Brexit";;;#Brexit;"746241950915796992";https://twitter.com/ColinFilm/status/746241950915796992
;2016-06-24 09:11;0;2;"u must've been a fan of Ramsey Bolton";;;;"746239282663174145";https://twitter.com/VanceNguyener/status/746239282663174145
;2016-06-24 09:02;0;0;"Ramsey Bolton morto Arya indo pra westeros Jon e Sansa em Winterfell Daenerys Bran E eu to igual o Rickon Mortinho #GameofThrones";;;#GameofThrones;"746237010608799744";https://twitter.com/renhique/status/746237010608799744
;2016-06-24 09:00;0;2;"Farage claiming victory is like me claiming victory over Ramsey Bolton";;;;"746236533749911552";https://twitter.com/TLindley91/status/746236533749911552
;2016-06-24 08:47;1;4;"#LikelySpendTooMuchTime imagining myself as Jon Snow and my old boss as Ramsey Bolton in last week's GOT. Let the hounds feed, ya douche!";;;#LikelySpendTooMuchTime;"746233145234599936";https://twitter.com/MatthewTheAmazo/status/746233145234599936
;2016-06-24 08:45;3;0;"I feel like Ramsey Bolton has just won the Battle of the Bastards #EUref";;;#EUref;"746232805126877185";https://twitter.com/louleyy/status/746232805126877185
;2016-06-24 08:38;1;1;"Only thing to make me smile so far today was this comment - "Nigel Farage has a face more punch-able than Ramsey Bolton 's!" #EUref";;;#EUref;"746231015979393024";https://twitter.com/Clive_Hill/status/746231015979393024
;2016-06-24 08:25;0;0;"amyepiscopo's photo https:// instagram.com/p/BHBtlKmgQF2/ Ramsey Bolton is an arse and even he knows #brexit is a bad idea! #EUref";;;#brexit #EUref;"746227790861590528";https://twitter.com/JohnEpiscopo/status/746227790861590528
;2016-06-24 08:19;1;12;"The whole country is looking to me like Ramsey Bolton 's smug face right now.";;;;"746226282875150336";https://twitter.com/zudensachen/status/746226282875150336
