username;date;retweets;favorites;text;geo;mentions;hashtags;id;permalink
;2016-06-24 08:05;0;1;"Racist Northerners meaning we now have an unstable country with an unstable future, I'd trust Ramsey Bolton in the north more";;;;"746222821949341696";https://twitter.com/JamesCook_1/status/746222821949341696
;2016-06-24 07:58;0;0;"Its about time that pecker wood, Ramsey Bolton died in game of thrones. Muhahaha, Sorry if I spoiled it for... http:// fb.me/1lumcR6u9";;;;"746220956301959168";https://twitter.com/JGBBaby/status/746220956301959168
;2016-06-24 07:55;0;4;"Hardly surprising most of the North voted out, the majority of them sided with Ramsey Bolton too #EURefResults #Brexit";;;#EURefResults #Brexit;"746220302690983937";https://twitter.com/MLASlaney/status/746220302690983937
;2016-06-24 07:52;0;1;"Ramsey Bolton is the poster child for fuckbois across the realm";;;;"746219342656770048";https://twitter.com/yokashaka/status/746219342656770048
;2016-06-24 07:51;1;4;"@UKIP and #Leave won it in the UK. @realDonaldTrump may win in the US. Crazy year! At least @RamseyBolton didn't win. #SilverLining";;@UKIP @realDonaldTrump @RamseyBolton;#Leave #SilverLining;"746219112305569792";https://twitter.com/BelalJafri/status/746219112305569792
;2016-06-24 07:45;0;2;"Ramsey Bolton deserved ALL of that. #GOT";;;#GOT;"746217596609953794";https://twitter.com/jnelleiz/status/746217596609953794
;2016-06-24 07:44;0;0;"How should the #UK sack Dave Cameron? I favor the Ramsey Bolton method personally. #Brexit #GameofThrones";;;#UK #Brexit #GameofThrones;"746217358432210944";https://twitter.com/AlistairAMoffat/status/746217358432210944
;2016-06-24 07:39;3;2;"It's like Ramsey Bolton won #Brexit";;;#Brexit;"746216077999235076";https://twitter.com/daithigorman/status/746216077999235076
;2016-06-24 07:34;0;2;"Every girl's dated a Ramsey Bolton . C'mon, we've all made that mistake!";;;;"746214975983624194";https://twitter.com/brokegirljay/status/746214975983624194
;2016-06-24 07:01;0;0;"Just when I thought Ramsey Bolton reminded me of Commodus in #Gladiator , he murders his father. #Coincidence #GameOfThrones #Ambition";;;#Gladiator #Coincidence #GameOfThrones #Ambition;"746206623991926786";https://twitter.com/paynchOm/status/746206623991926786
;2016-06-24 07:00;1;3;"A tepid sun dawns over our ginger beerish idyll of ye olde Albion BUT at least Ramsey Bolton did die. #brexit #got pic.twitter.com/26loCRJcOG";;;#brexit #got;"746206448187637760";https://twitter.com/Gerard_McDonagh/status/746206448187637760
;2016-06-24 06:30;0;5;"Ramsey Snow Bolton is the absolute worst character in all of Game of Thrones. Wow. Just wow.";;;;"746198686732951554";https://twitter.com/BigRoxie/status/746198686732951554
;2016-06-24 06:26;0;1;"Yes you might actually be right & that is what terrifies me tonight! Hate Reigns? I feel like #RamseyBolton has us captive!";;;#RamseyBolton;"746197808034676736";https://twitter.com/sscalise88/status/746197808034676736
;2016-06-24 06:10;2;25;"Britain about as popular as Ramsey Bolton right now";;;;"746193853921693696";https://twitter.com/eddythechump/status/746193853921693696
;2016-06-24 05:53;0;1;"Agree, after Sansa's speech about how Ramsey 's house would fade to nothing, I can't see her having a Bolton child.";;;;"746189362182950912";https://twitter.com/robinrescues/status/746189362182950912
;2016-06-24 05:34;0;0;"ramsey bolton was killed in the last episode of GoT *yawns";;;;"746184640411623424";https://twitter.com/logosXL/status/746184640411623424
;2016-06-24 05:25;0;1;"Bolton sigil was most prominent cause Tower shields so large. Love that Jon stopped Ramsey 's arrows with a Mormont shield!";;;;"746182513111011328";https://twitter.com/robinrescues/status/746182513111011328
;2016-06-24 05:22;1;1;"katie & corrine are seriously the joffrey lannister & ramsey bolton of twitter";;;;"746181747876986880";https://twitter.com/tajginyard/status/746181747876986880
;2016-06-24 05:21;0;1;"Our beloved country is now the equivalent of Ramsey Bolton , sitting and waiting to be fed to the dogs. Scotland get out now while you can!";;;;"746181441046847488";https://twitter.com/DevonDemocrat/status/746181441046847488
;2016-06-24 05:18;0;3;"I really enjoy Iwan Rheon's ( Ramsey Bolton ) music but I can't stop the mental image of him humming away while he's cutting bits off people";;;;"746180564231675905";https://twitter.com/blondetron2000/status/746180564231675905
;2016-06-24 05:14;0;1;"Always forget Ash in @Vicious has an evil alter ego in Ramsey Bolton in @GameOfThrones . Fantastic as always @iwanrheon !";;@Vicious @GameOfThrones @iwanrheon;;"746179745658744834";https://twitter.com/starfire00/status/746179745658744834
;2016-06-24 05:07;0;1;"As yes, that does make Nigel Farage Ramsey Bolton";;;;"746177896524349440";https://twitter.com/chlohoward/status/746177896524349440
;2016-06-24 05:06;0;1;"And for real, FUCK ramsey bolton";;;;"746177767318781952";https://twitter.com/smallbruise/status/746177767318781952
;2016-06-24 05:04;0;2;"#DespuesDelCaos guero se come a los gatos y a ramsey bolton";;;#DespuesDelCaos;"746177249091653632";https://twitter.com/Sebaxox/status/746177249091653632
;2016-06-24 05:02;0;0;"Dear Lord I hate Nigel Farage so much. I can't cope. I hope he gets ripped to shreds by dogs like Ramsey Bolton .";;;;"746176714716422144";https://twitter.com/Kirmataqaana/status/746176714716422144
;2016-06-24 05:02;0;0;"Ramsey Bolton died merely four days ago. Indeed, this week was too good to be true. The North remembers #Brexit";;;#Brexit;"746176711864131584";https://twitter.com/mariosauma/status/746176711864131584
;2016-06-24 04:47;1;1;"Scotland = Jon Snow. England, Wales = Ramsey Bolton . London will hopefully bring cavalry charge #GoT #EURef #Bastard http://www. theguardian.com/international";;;#GoT #EURef #Bastard;"746172884234579969";https://twitter.com/mikeygow/status/746172884234579969
;2016-06-24 04:38;0;0;"Mexico got killed, Colombia couldn't avenge us, and DRose got traded. But Ramsey Bolton got eaten by his hounds so I'm good";;;;"746170627065798656";https://twitter.com/mestizaxl/status/746170627065798656
;2016-06-24 04:36;1;6;"Piscatella is like OITNB's version of Ramsey Bolton . #getitaway #OITNB #GameofThrones";;;#getitaway #OITNB #GameofThrones;"746169992778027008";https://twitter.com/xmattmac/status/746169992778027008
;2016-06-24 04:23;0;2;"I don't think I've sworn as much in the past year as I did just now at Ramsey Bolton . #BattleOfTheBarstards";;;#BattleOfTheBarstards;"746166917702909953";https://twitter.com/KatelynRoney/status/746166917702909953
;2016-06-24 03:59;0;0;"Ramsey Bolton 's theme. May he rest in peace and pieces .... #GameofThrones . https://www. youtube.com/watch?v=0mgSCK XSp9M …";;;#GameofThrones;"746160797227769856";https://twitter.com/altondrew/status/746160797227769856
;2016-06-24 03:58;0;6;"ananı sikim ramsey bolton iyi ki öldün orospu evladı yaşasın starklar oley amq";;;;"746160543057182726";https://twitter.com/emrelaciin/status/746160543057182726
;2016-06-24 03:48;0;1;"Karstark was Ramsey Bolton 's main supporter. Seems odd no Karstark banners at battle & Harald was nowhere on battlefield?";;;;"746157957562404864";https://twitter.com/robinrescues/status/746157957562404864
;2016-06-24 03:32;0;1;"when I read this I thought it was game of thrones themed. Ramsey Bolton : battle of the bastards, etc";;;;"746153923388407808";https://twitter.com/dschneid12/status/746153923388407808
;2016-06-24 03:29;0;0;"And that, friends, is the end of Solomon Akpojiyorumeh Grundy Ramsey Bolton . Now I can say Finally! :-D — watching Game of Thrones";;;;"746153285187428352";https://twitter.com/koseemani/status/746153285187428352
;2016-06-24 03:28;0;1;"has anyone ever noticed the uncanny resemblance between George O'Malley and Ramsey Bolton ?";;;;"746152952679669761";https://twitter.com/liv_pish/status/746152952679669761
;2016-06-24 03:20;0;4;"Never been prouder to own a #CaneCorso then after watching one EAT RAMSEY BOLTON 'S F-ING FACE!!! #GameOfThrones #BastardBowl #GoT";;;#CaneCorso #GameOfThrones #BastardBowl #GoT;"746150878164377600";https://twitter.com/DRusso97/status/746150878164377600
;2016-06-24 03:04;0;0;"23 bajas confirmadas de Jon Snow 0 de Ramsey Bolton Ahora 1v1 sin camisa Partida de boca a Ramsey literalmente Y no hace las 24?";;;;"746147056868274177";https://twitter.com/chusi7x/status/746147056868274177
;2016-06-24 03:04;0;5;"Bu şey degil mi ya bizim hilal taktiği, valla Ramsey Bolton bizdense ben bizden degilim #GoT pic.twitter.com/RU7OrSjaaw";;;#GoT;"746146993144213504";https://twitter.com/uftanuhizan/status/746146993144213504
;2016-06-24 02:56;0;0;"The most recent episode of GoT could have been improved by casting Nigel Farage in the role of Ramsey Bolton #EUref #GameofThrones";;;#EUref #GameofThrones;"746144831399936005";https://twitter.com/FramptonMatthew/status/746144831399936005
;2016-06-24 02:50;0;1;"+++ JON SNOW VINCE LA BATTLE OF BASTARDS CONTRO RAMSEY BOLTON +++ #maratonamentana";;;#maratonamentana;"746143314567659521";https://twitter.com/Sara_LoPresti/status/746143314567659521
;2016-06-24 02:38;0;0;"Fun and joke aside ... Iwan Rheon's aka Ramsey Bolton display throughout GOT is the best acting I've seen in the series";;;;"746140355796471808";https://twitter.com/MccurdyRamone/status/746140355796471808
;2016-06-24 02:32;0;0;"Rickon Stark entrenando para las flechas de Ramsey Bolton https:// twitter.com/officerbigmac3 4/status/744514965483163648/video/1 …";;;;"746138938394447872";https://twitter.com/lechugaec/status/746138938394447872
;2016-06-24 02:29;0;0;"Cristina, vas a terminar como Ramsey Bolton .... estás tapada de sangre y tus perros santacruceños estan muy hambrientos...";;;;"746138213249585152";https://twitter.com/Andy4500/status/746138213249585152
;2016-06-24 02:09;4;6;"Ramsey Bolton sums up how I feel about the #EUref ..."If you think that this has a happy ending you haven't been paying attention".";;;#EUref;"746133051919450112";https://twitter.com/GeorgieH66/status/746133051919450112
;2016-06-24 02:06;0;1;"Ramsey Bolton is up there with one of my favourite characters of all time #unpopularopinion";;;#unpopularopinion;"746132335091916800";https://twitter.com/livcharlottte/status/746132335091916800
;2016-06-24 01:55;5;4;"Ramsey Bolton don't want it with Jon Snow what is wrong with this man";;;;"746129624158068736";https://twitter.com/Sicksteen_216/status/746129624158068736
;2016-06-24 01:50;3;1;"#gamesofthrones #RamseyBolton pic.twitter.com/uex4znSpG9";;;#gamesofthrones #RamseyBolton;"746128335844032512";https://twitter.com/DOSE_ROCKS/status/746128335844032512
;2016-06-24 01:33;0;4;"Paul Ryan low key reminds me of Ramsey Bolton from Game of Thrones.";;;;"746123968533364736";https://twitter.com/nycbrooke/status/746123968533364736
;2016-06-24 01:28;0;1;"RAMSEY BOLTON HES FUCKING EVIL AF";;;;"746122878987472897";https://twitter.com/lmlosingmyself/status/746122878987472897
;2016-06-24 01:20;2;3;"Hey yo @asanteV @xmalcolm09 it's dat muthaphukkin TRUMP ARMY biaatch!!Out tha way or get DEVOURED like ramsey bolton pic.twitter.com/jfItIxsIxv";;@asanteV @xmalcolm09;;"746120893940834304";https://twitter.com/_akshun_/status/746120893940834304
;2016-06-24 01:20;0;1;"This is a total Ramsey Bolton of a season.";;;;"746120795747848193";https://twitter.com/buckydoc/status/746120795747848193
;2016-06-24 01:17;0;2;"Fans saying I am the Ramsey Bolton of the roster. Assume he was well loved.";;;;"746120037497331712";https://twitter.com/TheJettWilder/status/746120037497331712
;2016-06-24 01:10;83;120;"Beginning to feel as Sansa did when contemplating a Ramsey Bolton win in the Battle of the Bastards";;;;"746118380994891777";https://twitter.com/JamesHorncastle/status/746118380994891777
;2016-06-24 01:09;0;0;"Ramsey Bolton confuses me so much like??? I got used to the character Simon Bellamy that @iwanrheon played, who was a precious cinnamon roll";;@iwanrheon;;"746118007907303424";https://twitter.com/amandamaryblack/status/746118007907303424
;2016-06-24 00:59;0;1;"Ramsey Bolton öldüğüne göre rahat uyuyabilirim.";;;;"746115524308930560";https://twitter.com/Leylkaptan/status/746115524308930560
;2016-06-24 00:54;0;2;"Donc Ramsey Bolton ... Eh Dieu, l'homme n'est rien hein...";;;;"746114194622255105";https://twitter.com/YannMoebius/status/746114194622255105
;2016-06-24 00:48;0;0;"Ramsey Bolton hayrani olmam psikolojik bi rahatsizligim oldugu anlamina gelmiyordur ins :(";;;;"746112724715835392";https://twitter.com/ozlemdoz/status/746112724715835392
;2016-06-24 00:19;0;1;"#GameofThrones goof..sansa had rode off before Ramsey Bolton said he hadn't fed his dogs for 7 days..how did she knw he said that.";;;#GameofThrones;"746105424127070208";https://twitter.com/standog100/status/746105424127070208
;2016-06-24 00:16;0;0;"Lord commander, hao no white walkers ama in Ramsey Bolton https:// twitter.com/doclewisville/ status/746064326851698688 …";;;;"746104786303520768";https://twitter.com/Malloy_Bryan/status/746104786303520768
;2016-06-24 00:14;1;5;"Ramsey Bolton is such a Cunt";;;;"746104199432249348";https://twitter.com/Nilstar1/status/746104199432249348
;2016-06-24 00:09;1;1;"Johns Snow beating up Ramsey Bolton is the best scene in this season #GameofThrones";;;#GameofThrones;"746102868495704065";https://twitter.com/dossaryhg/status/746102868495704065
;2016-06-24 00:03;0;1;"Se tem alguém desprezível e repugnante, esse é Ramsey Bolton";;;;"746101309108011008";https://twitter.com/pedro1fernandes/status/746101309108011008
;2016-06-24 00:01;0;0;"Ramsey Bolton has spoken to sources close to the family and confirmed Sansa is preggers innit";;;;"746100903565004800";https://twitter.com/Gappybond/status/746100903565004800
;2016-06-23 23:53;0;3;"lo que hizo caer la Casa Bolton y que Ramsey fuera devorado por perros fue una guerra, una violenta y sanguinaria guerra...";;;;"746098955088429056";https://twitter.com/PepeMontfort/status/746098955088429056
;2016-06-23 23:53;0;1;"F Ramsey Bolton";;;;"746098923304026112";https://twitter.com/_Bo_Knows/status/746098923304026112
;2016-06-23 23:52;0;2;"Thank god ramsey bolton is dead the little creepy kent #BattleOfTheBastards";;;#BattleOfTheBastards;"746098656537870336";https://twitter.com/Tyndallz/status/746098656537870336
;2016-06-23 23:42;0;0;"To the zookeeper that administered regular whippings to the tiger I'd like to suggest the ' Ramsey Bolton ... http:// fb.me/HpOFAvpV";;;;"746096197169987588";https://twitter.com/ToMPaSHKoV/status/746096197169987588
;2016-06-23 23:41;0;0;"My hounds won't hurt me...they are loyal beasts - Ramsey Bolton 553BC - 571BC";;;;"746095870714781696";https://twitter.com/colourMebadHaze/status/746095870714781696
;2016-06-23 23:36;0;0;"1st major battle of d season: Battle of the North (winterfell). Snow nd Stark vs Ramsey Bolton . Winner Snow nd Stark family.";;;;"746094515379789824";https://twitter.com/Badenabado/status/746094515379789824
;2016-06-23 23:36;1;6;"El que se puso mal después de la muerte de Ramsey fue Michael Bolton .";;;;"746094505212936192";https://twitter.com/C33_14O/status/746094505212936192
;2016-06-23 23:22;0;0;"Comunicado del EZLN para "Aurelio Ramsey Nuño Bolton " http:// enlacezapatista.ezln.org.mx/2016/06/23/la- hora-del-policia-4-del-cuaderno-de-spoilers-del-gato-perro/ …";;;;"746091203267964928";https://twitter.com/CosaPublica2/status/746091203267964928
;2016-06-23 23:07;0;0;"#got Ramseybolton raw steak dinner";;;#got;"746087401655664640";https://twitter.com/POPOGOM/status/746087401655664640
;2016-06-23 23:00;0;1;"Ha! Yes! ( Ramsey Bolton would've also worked) pic.twitter.com/w7sRwEhTW0";;;;"746085646813569024";https://twitter.com/boostfitnessmn/status/746085646813569024
;2016-06-23 22:59;1;3;"Ramsey Bolton is a bitch! I'm all caught up now. #GameofThrones";;;#GameofThrones;"746085372237492225";https://twitter.com/EnolaDesert/status/746085372237492225
;2016-06-23 22:54;0;0;"Ma ditemi se Ramsey Bolton non é uguale a Fabio De Luigi";;;;"746084019385819136";https://twitter.com/CVMBERBATCH76/status/746084019385819136
;2016-06-23 22:50;5;1;""Aurelio Ramsey Nuño Bolton ...Toda memoria de ti desaparecerá" Esperamos que también lo devoren sus propios perros https:// twitter.com/notienlacezap/ status/746061883032100868 …";;;;"746083060744077312";https://twitter.com/bosquenixticuil/status/746083060744077312
;2016-06-23 22:46;1;2;"I'm sat here listening to all this thoughtful commentary about Ramsey Bolton and how we lose our humanity when we hope for character death.";;;;"746082047089774592";https://twitter.com/paparatti/status/746082047089774592
;2016-06-23 22:45;0;1;"Ho letto un tweet su Gordon Ramsey , ho pensato a Ramsay Bolton e mi è partita la nostalgia tipo "It's been a long day without you my friend"";;;;"746081864570511360";https://twitter.com/yknownothing/status/746081864570511360
;2016-06-23 22:32;4;10;"#SuggestAJobForFarage Ramsey Bolton 's stunt double";;;#SuggestAJobForFarage;"746078508162646017";https://twitter.com/littlejudda/status/746078508162646017
;2016-06-23 22:26;1;3;"è morto Ramsey Bolton !!! @dajekevin";;@dajekevin;;"746076957243236352";https://twitter.com/Giovanni_N0/status/746076957243236352
;2016-06-23 22:21;1;2;"Ramsey bolton que personagem";;;;"746075744074350592";https://twitter.com/NetoMoraes01/status/746075744074350592
;2016-06-23 22:20;0;2;"Someone just needs to finish Ramsey Bolton what a flipping demon";;;;"746075584355254273";https://twitter.com/jacquifranco_/status/746075584355254273
;2016-06-23 22:18;0;0;"So @Twitch won't broadcast to chromecast solution HDMI cable...lmao you lose Ramsey Bolton My Sansa feeds you to the dogs #SpoilerAlert";;@Twitch;#SpoilerAlert;"746074991783878657";https://twitter.com/surfinpyr/status/746074991783878657
;2016-06-23 22:13;0;0;"Still love the irony of Ramsey Bolton getting eaten alive by his hounds, marvelous";;;;"746073622171648000";https://twitter.com/niles_blahblah/status/746073622171648000
;2016-06-23 22:01;0;3;"My dog is a savage! @GameOfThrones @RamseyBolton #GameofThrones #GOT7 #got #RamseyBolton #savage #dog pic.twitter.com/f3OOQ4BHC1";;@GameOfThrones @RamseyBolton;#GameofThrones #GOT7 #got #RamseyBolton #savage #dog;"746070632031485952";https://twitter.com/pphung/status/746070632031485952
;2016-06-23 21:47;0;0;"Donc, ramsey bolton aime chanter https://www. youtube.com/watch?v=dPuM5J XvD4w&feature=share …";;;;"746067261102915584";https://twitter.com/terodrel/status/746067261102915584
;2016-06-23 21:29;2;1;"A me comunque Ramsey Bolton piaceva.";;;;"746062739341254656";https://twitter.com/its_kaywhatever/status/746062739341254656
;2016-06-23 21:29;0;1;"Still super satisfied by Ramsey Bolton 's death";;;;"746062735880884225";https://twitter.com/LylemD/status/746062735880884225
;2016-06-23 21:29;0;2;"Maybe Ramsey Bolton was right, but I'm committed to trusting our new regime #Nets #GameOfZones pic.twitter.com/saye3wdvmn";;;#Nets #GameOfZones;"746062664439300097";https://twitter.com/dbearak/status/746062664439300097
;2016-06-23 21:28;0;0;"Y Ramsey Bolton le ganó a Jon snow (?) https:// twitter.com/MariaCorinaYA/ status/746042809208168448 …";;;;"746062376328269824";https://twitter.com/sambeethoven/status/746062376328269824
;2016-06-23 21:25;0;2;"I've been waiting for something like that to happen to Ramsey Bolton for so long now. #FreeHouseStark";;;#FreeHouseStark;"746061729558298624";https://twitter.com/bslowbro/status/746061729558298624
;2016-06-23 21:22;0;0;"Jon Snow got out maneuvered so effortlessly and easily by Ramsey Bolton . Can't even say it was chess move 'cause it was too easy.";;;;"746060833810112518";https://twitter.com/YoungEauxG/status/746060833810112518
;2016-06-23 21:20;0;0;"Ramsey Bolton ? Where's The 'Lord'.. Where's The Respek ? https:// twitter.com/buksberry01/st atus/746035318806163456 …";;;;"746060412655894528";https://twitter.com/Isah_manfu/status/746060412655894528
;2016-06-23 20:55;0;4;"He needs the same fate as Ramsey Bolton ! #NastyBastard";;;#NastyBastard;"746054162362802176";https://twitter.com/bigcentrehalf/status/746054162362802176
;2016-06-23 20:48;0;0;"My friend says Aaron Ramsey every time he wants to say Ramsay Bolton . You already know which club he supports";;;;"746052362566012928";https://twitter.com/BragginRightz/status/746052362566012928
;2016-06-23 20:33;0;0;"aka Ramsey Bolton . Dude is talented. https:// m.youtube.com/watch?v=Rv_nBE gwCaw …";;;;"746048476409004032";https://twitter.com/lordstoney/status/746048476409004032
;2016-06-23 20:29;0;1;"Que lindo como se lo devoran sus propios perros de caza a Ramsey Bolton #GOT";;;#GOT;"746047603540955137";https://twitter.com/LeanLigotti/status/746047603540955137
;2016-06-23 20:28;0;3;"Ramsey Bolton works at Super Weenie Hut Jr.";;;;"746047329220714496";https://twitter.com/AbbeyInLalaLand/status/746047329220714496
;2016-06-23 20:21;1;0;"Ramsey Bolton should've been tortured (skinned alive, cut off genitals, break all bones) by Sansa & Jon 1st before feeding him to the dogs";;;;"746045609853915136";https://twitter.com/camilleveee/status/746045609853915136
;2016-06-23 20:19;0;1;"Ramsey Bolton #lickmyface pic.twitter.com/ILZqzIHyvk";;;#lickmyface;"746045144621846528";https://twitter.com/iHarbonaut/status/746045144621846528
;2016-06-23 20:15;0;2;"Just took #93yrMum to vote, she's registered blind. In a very loud voice she said "Is Ramsey Bolton single now?" A cheer went up.";;;#93yrMum;"746043982711525377";https://twitter.com/DJSPWELLY/status/746043982711525377
;2016-06-23 20:02;0;1;"Plot twist, Sansa is pregnant with Ramsey 's kid and the Bolton name lives on. #GoT #GameOfThrones";;;#GoT #GameOfThrones;"746040852233977857";https://twitter.com/shaningwaF/status/746040852233977857
;2016-06-23 19:46;0;0;"Esta caraja es más mala que Regina George, Ramsey Bolton , Dolores Umbridge, etc, etc, etc... #Maldita";;;#Maldita;"746036793548607488";https://twitter.com/JorianEnciso/status/746036793548607488
;2016-06-23 19:40;2;2;"Which cast do you hate the most in Game of thrones? Fav for Ramsey Bolton Retweet for King Joffrey Baratheon pic.twitter.com/IDOhzYPyM0";;;;"746035318806163456";https://twitter.com/buksberry01/status/746035318806163456
;2016-06-23 19:28;1;1;"Lmao Iwan Rheon the actor that played Ramsey Bolton in Got claimed Ramsey deserves a worse kind of death pic.twitter.com/JF2oQjXrJL";;;;"746032221941792768";https://twitter.com/JoeL_MecKz/status/746032221941792768
;2016-06-23 19:25;0;0;"Rest in Pieces Ramsey Bolton . Gonna miss @iwanrheon not being on GoT though, fantastic actor xxx pic.twitter.com/WH1Z5guNdh";;@iwanrheon;;"746031511510593536";https://twitter.com/Judith_Blair/status/746031511510593536
;2016-06-23 19:21;1;0;"Ramsey Bolton 's alter ego has a lovely album out Listen to Feel It Coming by Iwan Rheon #np on #SoundCloud https:// soundcloud.com/iwan-rheon/05- feel-it-coming-1 …";;;#np #SoundCloud;"746030416616890368";https://twitter.com/JediSticks/status/746030416616890368
;2016-06-23 19:14;10;0;"Botwe get haters pass Ramsey Bolton";;;;"746028563665682432";https://twitter.com/TheMister_Cal/status/746028563665682432
;2016-06-23 19:08;0;0;"Who created this, Ramsey Bolton ? Spoiled - Ruin Game of Thrones For Your Friends, Automatically - https:// spoiled.io /";;;;"746027039921045505";https://twitter.com/thecrossover_io/status/746027039921045505
;2016-06-23 19:06;0;1;"#HouseGOP ran away like Ramsey Bolton .. we know how that ended. #NoBillNoBreak";;;#HouseGOP #NoBillNoBreak;"746026588232425472";https://twitter.com/baconinja/status/746026588232425472
;2016-06-23 19:05;0;2;"Id like put that bloke in a kennel ramsey bolton style like what he did to the defenceless cub at south Herefordshire hunt #pussy #repulsed";;;#pussy #repulsed;"746026383038648320";https://twitter.com/youngwifstoke/status/746026383038648320
;2016-06-23 19:04;0;2;"Took my 93 year old mum to vote, shes registered blind. She shouted..' ramsey bolton is dead' a cheer went up from all the other houses.";;;;"746026119892205568";https://twitter.com/Robbiegettings/status/746026119892205568
;2016-06-23 19:04;0;1;"@biobio justicia...como la que se le dió a #RamseyBolton en #GOT ..nada más...ya basta... #NiUnaMenos";;@biobio;#RamseyBolton #GOT #NiUnaMenos;"746026060496637952";https://twitter.com/Reyjo7/status/746026060496637952
;2016-06-23 19:03;0;1;"Ramsey bolton https:// twitter.com/sondagesseries f/status/743897902796390400 …";;;;"746025786700894208";https://twitter.com/diopystar/status/746025786700894208
;2016-06-23 18:49;1;0;"Ramsey Bolton #MambaMentality https:// twitter.com/rogcrsbuck/sta tus/739950278766669825 …";;;#MambaMentality;"746022263678472193";https://twitter.com/PariSeanGermain/status/746022263678472193
;2016-06-23 18:39;0;0;"It hasn't even be a week & I'm missing @iwanrheon as Ramsey Bolton . A most delicious villian #WoofWoof #GoT";;@iwanrheon;#WoofWoof #GoT;"746019741790277632";https://twitter.com/OldboySmith/status/746019741790277632
;2016-06-23 18:32;0;0;"... Ramsey Bolton geht' mir ja schon gepflegt auf die Eier. 8'D So ein behindertes Arsch.";;;;"746018180724891650";https://twitter.com/MrGluskin/status/746018180724891650
;2016-06-23 18:31;0;0;"So must be Ramsey Bolton . He rejected you once, he wil again. https:// twitter.com/shadysheikh/st atus/746017451549286400 …";;;;"746017917049970688";https://twitter.com/Bravehearrt_/status/746017917049970688
;2016-06-23 18:29;2;5;"RAMSEY BOLTON NO SIEMPRE FUE MALO -> https://www. youtube.com/watch?v=Rv_nBE gwCaw …";;;;"746017452216229888";https://twitter.com/nanutria/status/746017452216229888
;2016-06-23 18:24;0;0;"Final de serial "Person of interest". După ce m-am bucurat c-ar fost halit Ramsey Bolton de dulăii lui, așa m-a... http:// fb.me/8rG6Be1g2";;;;"746016152795680768";https://twitter.com/FranciscVasile/status/746016152795680768
