username;date;retweets;favorites;text;geo;mentions;hashtags;id;permalink
;2016-06-23 18:16;0;0;"Utter wankers if this is true. Should get the same punishment as Bolton Ramsey ... #sozforthespoiler https:// twitter.com/eduardo_lacs/s tatus/746013221530771456 …";;;#sozforthespoiler;"746014013570547712";https://twitter.com/jamiehirstchef/status/746014013570547712
;2016-06-23 18:14;3;6;"@iwanrheon deserves an #Emmy for his work on #GOT we hated #RamseyBolton w/a passion.Only a great actor could've given us that. @HBO";;@iwanrheon @HBO;#Emmy #GOT #RamseyBolton;"746013511273287680";https://twitter.com/Jaquie7c/status/746013511273287680
;2016-06-23 18:04;0;1;"#TBT to that time I nearly suffered the same fate as Ramsey Bolton from a vicious Cane Corso. #bloodthirsty pic.twitter.com/gyQDFGoNkd";;;#TBT #bloodthirsty;"746011050928136192";https://twitter.com/PhelanGuy/status/746011050928136192
;2016-06-23 18:01;0;1;"jon "knows nothing" snow versus ramsey "dog poo" bolton . #battleofthebastards";;;#battleofthebastards;"746010414559924224";https://twitter.com/ozemede/status/746010414559924224
;2016-06-23 17:51;0;2;"Unless you're Ramsey Bolton https:// twitter.com/showerthlnking /status/745871994361647104 …";;;;"746007866545442816";https://twitter.com/AliciaJBrowning/status/746007866545442816
;2016-06-23 17:48;0;1;"low key half amazed at how well she played ramsey bolton + doing things for herself but half upset at how she handled the whole battle";;;;"746006999553368064";https://twitter.com/karlakooklano/status/746006999553368064
;2016-06-23 17:48;0;1;"Damn I'd love to see children of the tree and the Ramsey Bolton in that form https:// twitter.com/meow/status/74 6005053148893184 …";;;;"746006952078151680";https://twitter.com/ItsJustFaisal/status/746006952078151680
;2016-06-23 17:32;0;0;"Snow should have castrated Ramsey Bolton before feeding him to his hounds.";;;;"746003080186073088";https://twitter.com/oluwaddee/status/746003080186073088
;2016-06-23 17:32;1;5;"Ramsey Bolton 's birthday bash. #WorstSummerParty";;;#WorstSummerParty;"746003019687288832";https://twitter.com/Jroq143/status/746003019687288832
;2016-06-23 17:32;1;0;"Watching Ramsey Bolton die gives me unexplainable Joy .";;;;"746002914175508480";https://twitter.com/Wisdom__Rt/status/746002914175508480
;2016-06-23 17:08;0;1;"Dear @GameOfThrones S6 Ep9 was the best episode ever! The death of #RamseyBolton #GameOfThrones";;@GameOfThrones;#RamseyBolton #GameOfThrones;"745997009253871616";https://twitter.com/iamlolarae/status/745997009253871616
;2016-06-23 17:03;0;1;"Preciso abrir meu coração: sempre achei o Ramsey Bolton bonitinho. Pegava fácil. #GameofThrones";;;#GameofThrones;"745995682192949248";https://twitter.com/FerMartello/status/745995682192949248
;2016-06-23 16:59;0;0;"Whenever I have a bad day, I think about Ramsey Bolton and say to myself "It's not that bad" #GameofThrones pic.twitter.com/E3549BsAZX";;;#GameofThrones;"745994709055770624";https://twitter.com/art_mogul/status/745994709055770624
;2016-06-23 16:56;0;2;"Tengo más hambre que los perros de Ramsey Bolton";;;;"745993849898668032";https://twitter.com/cuervo_04/status/745993849898668032
;2016-06-23 16:36;0;4;"I can only hope that there is a hardcore band somewhere that uses Ramsey Bolton sound bits in their music.";;;;"745988968248934400";https://twitter.com/Benji_Bro_Chill/status/745988968248934400
;2016-06-23 16:34;2;0;"Game of thrones : Jon Snow y tue Ramsey Bolton , grâce à l'armée de Sansa et Lord Belish";;;;"745988428492312576";https://twitter.com/lisabnsm/status/745988428492312576
;2016-06-23 16:33;1;4;"Donald Trump is like Ramsey Bolton .";;;;"745988238330957824";https://twitter.com/matosmaximoso/status/745988238330957824
;2016-06-23 16:30;0;0;"Dieser Hurensohn hat es sowas von verdient genau so zu verrecken! #GoTS06E09 #RamseyBolton #Bastard";;;#GoTS06E09 #RamseyBolton #Bastard;"745987319992360960";https://twitter.com/MuddaTui/status/745987319992360960
;2016-06-23 16:28;0;1;""Iwan Rheon, o cruel Ramsey Bolton , é fofo na vida rea..." EU NUM QUERO É NEM SABER. MORRA MOCRÉIA";;;;"745986975824547840";https://twitter.com/videkiddo/status/745986975824547840
;2016-06-23 16:14;0;1;"it's the best! I almost sent it to some people in RL, but then that risked them knowing I'm on here. I'd rather pash Ramsey Bolton .";;;;"745983319884496899";https://twitter.com/ScruffyPia/status/745983319884496899
;2016-06-23 16:12;1;10;"Ramsey Bolton is the kinda guy who would vote leave and that is not who I want to associate myself with";;;;"745982849052979200";https://twitter.com/gandalfsugarnut/status/745982849052979200
;2016-06-23 16:06;0;0;"Unless you're a child molester. In that case you get the Ramsey Bolton treatment.";;;;"745981422008147968";https://twitter.com/floworcrash/status/745981422008147968
;2016-06-23 15:50;0;0;"Ramsey Bolton was a legend. RIP to a real soldier";;;;"745977417248940032";https://twitter.com/thepizzajawn/status/745977417248940032
;2016-06-23 15:40;0;3;"Damn Ramsey Bolton makes beautiful music";;;;"745974862074748929";https://twitter.com/loupiter/status/745974862074748929
;2016-06-23 15:31;0;2;"And Fuck Ramsey Bolton . #GOT";;;#GOT;"745972566951591936";https://twitter.com/justin_time89/status/745972566951591936
;2016-06-23 15:29;0;1;"ramsey bolton öldü nalan";;;;"745972121541705728";https://twitter.com/tanselkaracali/status/745972121541705728
;2016-06-23 15:22;4;7;"My first #GoT meme. #jonsnow #winterfell #battleofthebastards #hbo #hotstar #ramseybolton #GameofThrones pic.twitter.com/KenVniD1x6";;;#GoT #jonsnow #winterfell #battleofthebastards #hbo #hotstar #ramseybolton #GameofThrones;"745970349980803072";https://twitter.com/omraut/status/745970349980803072
;2016-06-23 15:21;0;1;"Still devvod over Ramsey Bolton tho lads, he was one of my faves. Beautiful little bastard.";;;;"745969931422932992";https://twitter.com/standtallx/status/745969931422932992
;2016-06-23 15:14;0;0;"#HainlikKanınızda Malum şahıs vatan hainidir.. ama mal milletin gözü kördür o ayrı.. Kınıyorum seni Ramsey Bolton !!";;;#HainlikKan;"745968195266355201";https://twitter.com/Adolph_1944/status/745968195266355201
;2016-06-23 15:01;0;3;"Non andrei mai a fare grigliata a casa di Ramsey Bolton #GoT";;;#GoT;"745965106740236289";https://twitter.com/verovettorello/status/745965106740236289
;2016-06-23 14:25;0;1;"aye he's a wee wank......up there way ramsey bolton";;;;"745955851937153025";https://twitter.com/madbhoab/status/745955851937153025
;2016-06-23 14:24;1;2;"Ryan Paul reminds me of Ramsey Bolton from GOT.";;;;"745955795968352256";https://twitter.com/ieatlotsofgrass/status/745955795968352256
;2016-06-23 14:03;0;0;"Tbh going Ramsey Bolton on them wouldn't be enough Justice. https:// twitter.com/jillfilipovic/ status/745949452259700737 …";;;;"745950366932467713";https://twitter.com/stephdom8626/status/745950366932467713
;2016-06-23 13:37;0;0;"#yoamber so who would choose to defend you against Ramsey Bolton between Jon snow Sansa Stark, or @WillManso ?";;@WillManso;#yoamber;"745943822278987780";https://twitter.com/Idoitinthe69/status/745943822278987780
;2016-06-23 13:35;0;1;"I'd sign Lucic and then feed him to Ramsey Bolton 's dogs. https:// twitter.com/wgr550/status/ 745922812565721088 …";;;;"745943395273678848";https://twitter.com/JasonIn716/status/745943395273678848
;2016-06-23 13:28;1;0;"@piersmorgan is like Ramsey Bolton to Arsenal fans Every fan hates him and publicly throw insults, but deep down they're like "what a guy"";;@piersmorgan;;"745941643484790784";https://twitter.com/thebabajide/status/745941643484790784
;2016-06-23 13:18;0;1;"Q a estas alturas de la vida la gente escriba aún " RamsEy Bolton " y no "RamsAy Bolton "... es para coger el cuchillito de desollar eh? #Hype";;;#Hype;"745938965769912320";https://twitter.com/Nurse_Lecter/status/745938965769912320
;2016-06-23 13:13;1;8;"Game of Thrones' Ramsey Bolton is up in the club looking for love in his catchy new single, "I'm a Bad, Bad Man" https://www. youtube.com/watch?v=iNy-au ADNGs …";;;;"745937759332868097";https://twitter.com/DeepFriedMan/status/745937759332868097
;2016-06-23 13:12;0;1;"GOT 9.bölüm efsane olmuş,uzun zamandır bu kadar atraksiyon yoktu. Game over ramsey bolton";;;;"745937629200416768";https://twitter.com/burakrc25/status/745937629200416768
;2016-06-23 13:11;4;0;"Ramsey Bolton came into GOT and everything Jeoffrey ever did was like child's play";;;;"745937344746905600";https://twitter.com/_turff/status/745937344746905600
;2016-06-23 13:06;0;0;"Anyone thinks of doing this to me and I'll make Ramsey Bolton look like Ned Stark. http:// gu.com/p/4mhdj/stw";;;;"745936026284212225";https://twitter.com/FionaLMacIntyre/status/745936026284212225
;2016-06-23 13:06;0;3;"like ramsey bolton he should be fed to his own hounds";;;;"745935979601604610";https://twitter.com/marella0411/status/745935979601604610
;2016-06-23 13:01;0;1;"Na dont feel like feedin my own dogs for a few days xx #RamseyBolton";;;#RamseyBolton;"745934710401077248";https://twitter.com/emiliaayms/status/745934710401077248
;2016-06-23 12:55;0;1;"Wtf Ramsey Bolton you absolute wanker";;;;"745933201533767681";https://twitter.com/SamMurd/status/745933201533767681
;2016-06-23 12:41;0;4;"The fact we all hated Ramsey Bolton so much is to testament to how good a actor @iwanrheon is. Bravo sir.... bravo!";;@iwanrheon;;"745929862091792384";https://twitter.com/antcunners86/status/745929862091792384
;2016-06-23 12:31;1;5;"Ramsey "dogchow" Bolton . ¿Se puede decir ya?";;;;"745927224977690624";https://twitter.com/Sinmiescudo/status/745927224977690624
;2016-06-23 12:20;0;1;"Sesli guldum ya koca yürekli ramsey bolton (srfszn tekiydi) pic.twitter.com/LDMyaECvDw";;;;"745924441620750337";https://twitter.com/Btlakyy/status/745924441620750337
;2016-06-23 12:11;0;0;"Apparently if you don't Vote remain Jon Snow will die again and Ramsey Bolton will come back to life";;;;"745922186406432769";https://twitter.com/billyemmerson13/status/745922186406432769
;2016-06-23 12:10;1;2;"so happy after all that Ramsey Bolton got absolutely battered";;;;"745921965685350400";https://twitter.com/_chloeemma/status/745921965685350400
;2016-06-23 12:08;0;0;"ION, soooooo glad Ramsey Bolton was killed. Gonna give thanks for a long time!";;;;"745921337881935876";https://twitter.com/MarriedToKush/status/745921337881935876
;2016-06-23 12:03;0;0;"ninookr: Ramsey Bolton in 6.09 what an excellent actor he is https:// tmblr.co/Z69mfl28JBlZv";;;;"745920237804085248";https://twitter.com/_HoneyWolf/status/745920237804085248
;2016-06-23 12:01;0;1;"OH JA en Ramsey Bolton is stiekem veel knapper dan Jon Snow. #zwijmelendemeisjestweet pic.twitter.com/jfP3VYa8wB";;;#zwijmelendemeisjestweet;"745919627520270336";https://twitter.com/riektweet/status/745919627520270336
;2016-06-23 11:48;0;0;"Ich finde es einfach so geil das Ramsey Bolton von seinen eigenen Hunden gefressen wird. @LochisHeiko @GameOfThrones #GameofThrones";;@LochisHeiko @GameOfThrones;#GameofThrones;"745916329140621315";https://twitter.com/tessa_lochmann/status/745916329140621315
;2016-06-23 11:46;0;1;"je vois pas le rapport avec la mort de Ramsey Bolton dans l'épisode 9 de la saison 6 de Game of Thrones";;;;"745916006489546752";https://twitter.com/_PositiveMind8/status/745916006489546752
;2016-06-23 11:33;2;1;"and then seeing them battered to death by Ramsey Bolton .";;;;"745912630334885889";https://twitter.com/davidbyers26/status/745912630334885889
;2016-06-23 11:25;0;1;"Being extra-careful around our beasts.... :| #BattleOfTheBastards #GoT #GameOfThrones #RamseyBolton #Hounds #Stark pic.twitter.com/hT6GRomARR";;;#BattleOfTheBastards #GoT #GameOfThrones #RamseyBolton #Hounds #Stark;"745910548651458561";https://twitter.com/greenroomtalk/status/745910548651458561
;2016-06-23 11:15;0;1;"driving back from France last night and didn't know whether to kick the radio in or not. You're the Ramsey Bolton of radio";;;;"745908242421784577";https://twitter.com/MarshallCraig75/status/745908242421784577
;2016-06-23 11:04;0;0;"En vrai le meilleur acteur dans Got c'est Iwan Rehon ( Ramsey Bolton ) parce qu'il a réussi à se faire détester par tout le monde";;;;"745905291309490177";https://twitter.com/lamour_maeva/status/745905291309490177
;2016-06-23 10:46;0;1;"When Jon Snow was punching Ramsey Bolton repeatedly, and Ramsey just smirked, it reminded me so much of batman and the joker #GoT #Batman";;;#GoT #Batman;"745900776199970816";https://twitter.com/CraigJames28/status/745900776199970816
;2016-06-23 10:23;1;3;"Time to get as nerdy as Samwell Tarly and as ruthless as Ramsey Bolton , our Game of Thrones quiz is this Sunday! pic.twitter.com/eKHeCeDZ9r";;;;"745894915138293761";https://twitter.com/FruitSpaceHull/status/745894915138293761
;2016-06-23 10:13;0;0;"i dont even know who ramsey bolton is but i cant stop laughing";;;;"745892603468578816";https://twitter.com/thesoulmadonna/status/745892603468578816
;2016-06-23 10:10;1;1;"Every time I saw Ramsey Bolton … my heart screamed Barry you've changed https:// twitter.com/AOT2/status/74 5517598993899520 …";;;;"745891716268494849";https://twitter.com/MsJis/status/745891716268494849
;2016-06-23 10:09;0;0;""Je vois pas le rapport avec la mort de Ramsey Bolton bouffé par ses propres chiens dans l'épisode 9 s.6 de Game of thrones." Arrêtez svp";;;;"745891593207578625";https://twitter.com/GShadood/status/745891593207578625
;2016-06-23 09:52;0;2;"loose? Who are you? Ramsey Bolton ?";;;;"745887210583560193";https://twitter.com/geekmanoz/status/745887210583560193
;2016-06-23 09:46;0;0;"Penso que devia existir alguém como o Ramsey Bolton pra sumir com esses comunas do Brasil... Não sobrava um. pic.twitter.com/8Kcto73FFa";;;;"745885670229557248";https://twitter.com/NemVemQueNemTem/status/745885670229557248
;2016-06-23 09:40;1;0;"your sister is ramsey bolton . https:// twitter.com/SAMCLAFLlN/sta tus/745763889967661056 …";;;;"745884127526797312";https://twitter.com/SlayboyBunny_/status/745884127526797312
;2016-06-23 09:32;0;1;"I would like Ramsey Bolton instead ;)";;;;"745882163887878144";https://twitter.com/BeingPrabesh/status/745882163887878144
;2016-06-23 09:23;0;4;"I think I'm Ramsey Bolton and my boss is Hannibal. I don't think we should've found each other. https:// twitter.com/amyoosed/statu s/745875489189924865 …";;;;"745880025602342912";https://twitter.com/Eyre_Estella/status/745880025602342912
;2016-06-23 09:11;1;3;"Who is having a worse week: Paul Ryan or Ramsey Bolton ? #battleofthebastards #holdthefloor #NoBillNoBreak https://www. youtube.com/watch?v=75q1x2 RVV_Q …";;;#battleofthebastards #holdthefloor #NoBillNoBreak;"745876996761190401";https://twitter.com/reallyZerilli/status/745876996761190401
;2016-06-23 09:10;0;0;"1. Those are not tigers. 2. I hope he feeds them well unlike Ramsey Bolton . https:// twitter.com/nigerianewsdes k/status/745874563414761472 …";;;;"745876742921986049";https://twitter.com/_Udanyi/status/745876742921986049
;2016-06-23 08:37;0;1;"@ttolbert05 your Ramsey Bolton death snap just made my entire day.";;@ttolbert05;;"745868436283211780";https://twitter.com/betouchka90/status/745868436283211780
;2016-06-23 08:30;0;0;"Ramsey Bolton is the best/worst/evil villain in years. Vile. https:// twitter.com/independent/st atus/745863217876869120 …";;;;"745866547760082946";https://twitter.com/DSolberg/status/745866547760082946
;2016-06-23 08:16;1;1;"Even Ramsey Bolton could not have devised anything so wicked https:// twitter.com/mybroadband/st atus/745861184000262145 …";;;;"745863077686558720";https://twitter.com/ItsStillAyoba/status/745863077686558720
;2016-06-23 08:16;0;1;"Shows how personality is a lot to me. I used to fancy Simon from misfits whereas Ramsey Bolton from GoT made my skin crawl.";;;;"745862990616985605";https://twitter.com/DianaAsihene/status/745862990616985605
;2016-06-23 08:14;0;1;"epic! Nothing like a poisonous git like Ramsey Bolton copping it.";;;;"745862579935911936";https://twitter.com/Jon404/status/745862579935911936
;2016-06-23 08:06;0;1;"Ramsey Bolton is the fucking maaan. pic.twitter.com/XfUdfRRgHw";;;;"745860496453165057";https://twitter.com/notbadurself/status/745860496453165057
;2016-06-23 08:05;1;0;"People who peddle the 'middle-income' fantasies are Ramsey Bolton 's of this world https:// twitter.com/nbstv/status/7 45854964816281600 …";;;;"745860280425582593";https://twitter.com/fmrsema/status/745860280425582593
;2016-06-23 08:02;0;0;"Ramsey Bolton dies! Eaten alive by his dogs I love you https:// twitter.com/__yemisi/statu s/745757899541123076 …";;;;"745859564629786624";https://twitter.com/BlackseidTheDJ/status/745859564629786624
;2016-06-23 07:46;0;2;"This has made me finally break down and join Twitter. And yes, Paul Ryan DOES look like Ramsey Bolton . #NoBillNoBreak";;;#NoBillNoBreak;"745855419843809281";https://twitter.com/Cgmcd69/status/745855419843809281
;2016-06-23 07:33;0;0;"I think my favourite villain next to Joker is Ramsey Bolton . It seems like he has nothing to lose. Damn";;;;"745852353748828160";https://twitter.com/LuqmanAtif/status/745852353748828160
;2016-06-23 07:21;1;0;"@SpeakerRyan is SO Ramsey Bolton . #NoBillNoBreak #GameofThrones #gameofguns";;@SpeakerRyan;#NoBillNoBreak #GameofThrones #gameofguns;"745849259342331904";https://twitter.com/MissMelicious/status/745849259342331904
;2016-06-23 07:15;1;148;"I hope you watch our recreation of Ramsey Bolton 's death on my SnapChat. it's at Jadepippa";;;;"745847691855405056";https://twitter.com/jadelizroper/status/745847691855405056
;2016-06-23 07:14;0;1;"My cat just nibbled my nose affectionately and all I could see was Ramsey Bolton 's face being eaten!";;;;"745847354952126464";https://twitter.com/CathrynTheBrit/status/745847354952126464
;2016-06-23 06:44;1;1;"Ramsey bolton https:// twitter.com/petermaxiff/st atus/745427852997328896 …";;;;"745839840361590784";https://twitter.com/thaynageramav/status/745839840361590784
;2016-06-23 06:43;0;0;"Ramsey Bolton is a singer and his album is fire. His voice is crazy. I'm shocked";;;;"745839669766725632";https://twitter.com/Chris726/status/745839669766725632
;2016-06-23 06:33;0;1;"Fuck Ramsey Bolton";;;;"745837040697221120";https://twitter.com/AtamNodnerb/status/745837040697221120
;2016-06-23 06:25;0;2;"As bad as Ramsey Bolton is, @iwanrheon 's acting often has left me laughing because of how good he is. Such legit acting! Superb job mate";;@iwanrheon;;"745835157295403008";https://twitter.com/JeremiahKarr/status/745835157295403008
;2016-06-23 06:24;2;0;"tan bien que me caia #Ramsey #Bolton jajajaj #GoTS06E09";;;#Ramsey #Bolton #GoTS06E09;"745834868328771585";https://twitter.com/Gama_Lion/status/745834868328771585
;2016-06-23 06:23;0;2;"No gifs of Ramsey Bolton 's dogs with bees in their mouth and when they open their mouths they shoot bees? Shame on you internet! #simpsons";;;#simpsons;"745834537813422080";https://twitter.com/Dasgoot1/status/745834537813422080
;2016-06-23 06:20;0;0;"Ramsey Bolton 's death was much anticipated the same way as Jeoffrey Lannister.";;;;"745833972131860481";https://twitter.com/stain_les/status/745833972131860481
;2016-06-23 06:17;0;0;"Just found out Ramsey Bolton sings on YouTube and he's got a song called 'You are in me'. Think he might have stole that one from Sansa..";;;;"745833202728771588";https://twitter.com/1amzlatan/status/745833202728771588
;2016-06-23 06:07;0;0;"You might have thought Paul Ryan was the Ramsey Bolton analogue, but in a twist it's Louie Gohmert! https:// twitter.com/GerryDuggan/st atus/745828789045735424 …";;;;"745830654009475076";https://twitter.com/TheOneWhoKnox/status/745830654009475076
;2016-06-23 06:01;0;1;"Ramsey Bolton fue uno de los mejores villanos pasajeros de toda la historia";;;;"745829199387201536";https://twitter.com/Roroyere/status/745829199387201536
;2016-06-23 05:58;1;5;"Two OWS flashback/ptsd moments this week! First Ramsey Bolton 's pike/shield kettle. & then the sit-in, complete w/ attempted media blackout.";;;;"745828399227232256";https://twitter.com/dicey__/status/745828399227232256
;2016-06-23 05:57;1;0;"It's getting close to Jon Snow vs Ramsey Bolton time. #Congress";;;#Congress;"745828192347365377";https://twitter.com/yoruba69/status/745828192347365377
;2016-06-23 05:31;0;1;"How i wish they had cut off a kilo of flesh off Ramsey Bolton each day whilst feeding it to his hounds #GameOfThornes";;;#GameOfThornes;"745821545709309952";https://twitter.com/JustAdree/status/745821545709309952
;2016-06-23 05:28;0;1;"The end of episode 9 season 6 (last episode) of #GoT has made me a very happy person. Ramsey Bolton is a loser. #BattleOfTheBarstards";;;#GoT #BattleOfTheBarstards;"745820800050044929";https://twitter.com/Downs_Co/status/745820800050044929
;2016-06-23 05:15;0;2;"@jordirocasan la eliminación de @RaquelMChef4 en #MasterChef y el menú degustación de los perros de Ramsey Bolton , de lo mejor de la semana";;@jordirocasan @RaquelMChef4;#MasterChef;"745817616783138816";https://twitter.com/Tontines/status/745817616783138816
;2016-06-23 05:14;0;0;"How is GOT going to find another person as evil as Ramsey Bolton ...Dude topped Joffery...Who will the evil MF be....";;;;"745817185768054785";https://twitter.com/larryinstafford/status/745817185768054785
;2016-06-23 05:09;0;1;"¿Si supieron que mataron a Ramsey Bolton ?";;;;"745815968107143168";https://twitter.com/LinaMaO/status/745815968107143168
;2016-06-23 04:57;0;1;"Hell yes watching Jon Snow kick the shit out of Ramsey Bolton again #GameOfThrones best show on TV by far";;;#GameOfThrones;"745812924321628160";https://twitter.com/Proudpoppa24/status/745812924321628160
;2016-06-23 04:55;1;0;"I just realized, #Ramsey scored for #Wales and Ramsey Bolton died! Haha no one is safe from the curse #GameOfThrones #BattleOfTheBarstards";;;#Ramsey #Wales #GameOfThrones #BattleOfTheBarstards;"745812382644080640";https://twitter.com/AnandKumarSai/status/745812382644080640
;2016-06-23 04:48;0;2;"Ramsey Bolton qui se fait bouffer par ses propres chiens, quelle ironie du sort";;;;"745810832899084292";https://twitter.com/QuentinIsamb/status/745810832899084292
;2016-06-23 04:40;0;2;"Ramsey Bolton style";;;;"745808796463730688";https://twitter.com/BiggSmott/status/745808796463730688
;2016-06-23 04:40;0;3;"Hawk sounds like Ramsey Bolton";;;;"745808741396676608";https://twitter.com/BiggSmott/status/745808741396676608
;2016-06-23 04:34;1;0;"La ultima vez era Ramsey Bolton !!! :( https:// twitter.com/CalvoDeBarba/s tatus/745805096097808384 …";;;;"745807195527385093";https://twitter.com/juan_badumpss/status/745807195527385093
;2016-06-23 04:20;0;1;"This man Ramsey Bolton is cold blooded";;;;"745803677076643842";https://twitter.com/BlondiesBlack/status/745803677076643842
;2016-06-23 04:18;0;0;"Paul Ryan reminds me of Ramsey Bolton https:// tmblr.co/ZBLSTy28IHJ6j";;;;"745803220757450752";https://twitter.com/RedheadQuarters/status/745803220757450752
;2016-06-23 04:16;0;0;"De todas las series que he visto, Ramsey Bolton se lleva el premio del mejor villano pic.twitter.com/KmNylSTchh";;;;"745802762739286022";https://twitter.com/antoniomanguart/status/745802762739286022
;2016-06-23 04:12;0;0;"Como así que Ramsey Bolton canta?! Creo que me enamoré https:// youtu.be/dPuM5JXvD4w";;;;"745801753468211200";https://twitter.com/nathacm/status/745801753468211200
;2016-06-23 04:08;1;0;"Ramsey bolton was a wavey character";;;;"745800615251558401";https://twitter.com/yus_ful_/status/745800615251558401
;2016-06-23 03:56;0;1;"this is EXACTLY how Ramsey Bolton passed away Sunday..";;;;"745797643545124869";https://twitter.com/blanefillingim/status/745797643545124869
;2016-06-23 03:55;0;0;"1) Joker 4m Dark Knight (Heath Ledger) 2) Theodore Bagwell 4m Prison Break (Robert Knepper) 3) Ramsey Bolton 4m GOT (Iwan Rheon) RESPECT";;;;"745797440217964545";https://twitter.com/Sumeetxolt/status/745797440217964545
;2016-06-23 03:51;5;1;"Los perros de caza de Ramsey Bolton se lo comieron porque tenían hambre... Con hambre no hay amor ni lealtad... El que tenga ojos que vea.";;;;"745796274050433024";https://twitter.com/LesterYomar/status/745796274050433024
;2016-06-23 03:40;3;3;"Barack Obama is the Ramsey Bolton of politics - Ramsey 's dogs are the radical Islamists Obama falsely believes are "loyal beasts" #tcot";;;#tcot;"745793681534386177";https://twitter.com/jeanniology/status/745793681534386177
;2016-06-23 03:25;3;3;"Ramsey Bolton said: "My hounds will never harm me...they're loyal beasts." Sounds like Democrats talking about radical Islamists. #tcot";;;#tcot;"745789870556221440";https://twitter.com/jeanniology/status/745789870556221440
;2016-06-23 03:25;0;0;"Mis perrinchos me pidieron dos veces de cenar, y pues les di porque no vaya a ser la de Ramsey Bolton y me devoren por muertos de hambre...";;;;"745789866781204481";https://twitter.com/BernaZamora/status/745789866781204481
;2016-06-23 03:24;0;2;"I tell you this, Iwan Rheon - Ramsey Bolton . What an absolute bad arse fucking cunt. One of greatest villains, I'll miss him";;;;"745789638875439104";https://twitter.com/chris88proctor/status/745789638875439104
;2016-06-23 03:22;1;4;"Ramsey Bolton was probably worse then Prince Joffrey let's be real here folks";;;;"745789089505550336";https://twitter.com/ColeZych/status/745789089505550336
;2016-06-23 03:22;0;3;"Watching AGAIN as Ramsey Bolton 's alpha dog takes his first glorious bite. #ThronesYall #DemThrones @GameOfThrones pic.twitter.com/bGgeOOU9VI";;@GameOfThrones;#ThronesYall #DemThrones;"745789023134818304";https://twitter.com/ShamefreeTV/status/745789023134818304
;2016-06-23 03:03;0;1;"No one was happier than myself when Ramsey Bolton met his fate. Iwan Rheon did a great job.Have to watch him on #misfits to undo the Ramsey .";;;#misfits;"745784277405577216";https://twitter.com/Jahkotta/status/745784277405577216
;2016-06-23 02:57;0;4;"On a scale from 1- Not zigzagging as Ramsey Bolton shoots arrows at you, how bad is your idea?";;;;"745782923505328128";https://twitter.com/superkeara/status/745782923505328128
